,text,label
6689,మీ స్టోర్ నుండి కొనుగోలు చేసేటప్పుడు నాకు అదనపు రుసుము వసూలు చేయబడింది. ఇది ఎందుకు?,15
6690,ఫిజికల్ కార్డ్ కోసం ఛార్జ్ ఉందా?,43
6691,నేను ఎందుకు అదనంగా వసూలు చేసాను?,15
6692,నేను ఆస్ట్రియాలో నా పిన్‌ని మార్చవచ్చా?,21
6693,నేను నా ఖాతా బ్యాలెన్స్‌ని రీఫిల్ చేసాను కానీ ఎర్రర్ మెసేజ్ వచ్చింది.,61
6694,"నేను నా ఖాతా నుండి లాక్ అయ్యాను, నేను నా పిన్‌ని అన్‌బ్లాక్ చేయడం ఎలా?",49
6695,నా యాప్ స్టేట్‌మెంట్ నేను ATM నుండి నగదు తీసుకున్నానని చూపిస్తుంది కానీ నేను చేయలేదు. నేను ఏమి చెయ్యగలను?,20
6696,నేను నా వివరాలను ఎలా సవరించగలను?,30
6697,"3 రోజులు గడిచాయి, నా బదిలీ నా వాలెట్‌కి చేరుకోవడానికి ఎంత సమయం పడుతుంది?",67
6698,నేను వేరే దేశాలలో డబ్బుని పొందవచ్చా?,50
6699,నా కార్డ్ చెడిపోయిందని అనుకుంటున్నావా?,14
6700,నేను పని చేయడానికి నా అసలు కార్డ్‌ని పొందలేకపోయాను,14
6701,నా ఖాతాకు బదిలీ ఎందుకు కనిపించడం లేదు?,5
6702,"హాయ్, నేను నా లావాదేవీలను తనిఖీ చేసాను మరియు రెస్టారెంట్ సందర్శన సమయంలో నాకు రెండుసార్లు ఛార్జీ విధించబడిందని చూశాను. నేను నా డబ్బును తిరిగి పొందాలనుకుంటున్నాను.",63
6703,నాకు లావాదేవీ ఉంది మరియు నేను దానిని రద్దు చేయగలనా అని తెలుసుకోవాలనుకుంటున్నారా?,8
6704,నా టాప్ అప్ పని చేయలేదా?,47
6705,"ATM నేను అభ్యర్థించిన మొత్తం డబ్బును ఉపసంహరించుకున్నట్లు చూపుతుంది, కానీ నేను ఆ మొత్తాన్ని నగదు రూపంలో తిరిగి పొందలేదు.",75
6706,నేను కొత్త చిరునామాను ఎలా ఇన్‌పుట్ చేయాలి?,30
6707,నగదు యంత్రం వద్ద వేరే దేశంలో విత్‌డ్రా చేయడానికి అదనపు రుసుములు ఉన్నాయా.,76
6708,నా వాపసు నా స్టేట్‌మెంట్‌లో కనిపించడం లేదు.,51
6709,"నా కార్డ్ చెల్లింపు రెండుసార్లు పూర్తయినట్లు కనిపిస్తోంది. నేను ఇంతకు ముందు స్టోర్‌లో చెల్లించాను మరియు మొదటిది వెళ్ళినట్లు అనిపించలేదు. రెండవ ప్రయత్నం తరువాత, అది సాగింది. నేను ఇప్పుడు యాప్‌లో చూస్తున్నాను, వాటిలో ఒకటి పెండింగ్‌లో ఉన్నందున నాకు రెండుసార్లు ఛార్జీ విధించబడింది. దయచేసి పెండింగ్‌లో ఉన్న మొత్తాన్ని తీసివేయగలరా, ఎందుకంటే ఇది స్పష్టంగా తిరస్కరించబడినది?",63
6710,"నా కార్డ్ గడువు దగ్గర పడింది, నేను కొత్త కార్డ్‌ని ఎలా ఆర్డర్ చేయాలి?",9
6711,నేను నగదు పొందినప్పుడు నాకు తప్పు మార్పిడి రేటు వచ్చిందని నేను నమ్ముతున్నాను.,76
6712,మీరు నా బదిలీలను ఎందుకు నిరాకరిస్తున్నారు? ఇది ఇప్పటివరకు బాగా పని చేస్తోంది కానీ నేను ఇప్పుడే ఏదైనా కొనడానికి ప్రయత్నించినప్పుడు కార్డ్ తిరస్కరించబడింది . నేను ఇప్పటికే రెండు సార్లు ప్రయత్నించాను కానీ అదే జరుగుతోంది.,27
6713,"నా కార్డ్ స్తంభింపజేయాలి, ఎందుకంటే డబ్బు తీసుకోవడానికి నా అనుమతి లేకుండా ఉపయోగించబడింది. ఇది బేసి స్థానంలో ఉంది.",20
6714,నా గుర్తింపును ధృవీకరించడానికి నాకు ఏ పత్రాలు అవసరం?,69
6715,నా ఖాతాలో నగదు ఉపసంహరణ జరిగినట్లు నాకు గుర్తులేకపోతే నేను ఏమి చేయాలి?,20
6716,"నా దగ్గర మీ కార్డ్ ఒకటి ఉంది, కానీ దాన్ని ఎలా లింక్ చేయాలో నాకు తెలియదు.",13
6717,USకు డెలివరీ చేయడానికి ఎంత సమయం పడుతుంది?,12
6718,నా టాప్-అప్ ఇంకా పెండింగ్‌లో ఉంది,47
6719,"నేను ఇప్పుడే నా కొత్త కార్డ్‌ని పొందాను, నేను దాన్ని ఎలా యాక్టివేట్ చేయాలి?",0
6720,నగదు ఉపసంహరణ నాకు ఎందుకు వసూలు చేయబడింది?,19
6721,నా టాప్-అప్ పూర్తి కాలేదు.,47
6722,ఖాతాను తొలగించడం సాధ్యమేనా?,55
6723,నేను పొరపాటున తప్పు ఖాతాకు చేసిన లావాదేవీని త్వరగా రద్దు చేయడానికి మీరు నాకు సహాయం చేయగలరా?,8
6724,బ్యాంకు సేవలను ఉపయోగించడానికి మీ వయస్సు ఎంత?,1
6725,నేను నా స్టేట్‌మెంట్‌లను తనిఖీ చేస్తూనే ఉన్నాను కానీ ఏమీ కనిపించదు! నేను చాలా కాలం క్రితం వాపసు కోసం అభ్యర్థించాను కానీ కొన్ని కారణాల వల్ల అది నా ఖాతాకు చేరుకోవడం లేదు. దయచేసి నా కోసం విక్రేత నుండి డబ్బును తిరిగి పొందడంలో నాకు సహాయం చేయగలరా,51
6726,ఏ రకమైన కార్డ్‌లకు మద్దతు ఉంది? ఏ కరెన్సీ?,54
6727,మీరు నా పాస్‌వర్డ్‌ని చూడగలరా?,44
6728,కార్డును టాప్ అప్ చేయడానికి రుసుము ఉందా?,57
6729,నేను ATM నుండి ఎందుకు రుసుము తీసుకున్నాను?,19
6730,నేను విదేశాలలో చేసిన ఇటీవలి కొనుగోలుకు వర్తించే మారకపు రేటు తప్పు అని నేను గమనించాను.,17
6731,నా నగదు ఉపసంహరణ కోసం తప్పు మారకపు రేటు ఉపయోగించబడింది,76
6732,టాప్ అప్ కార్డ్‌లోని ధృవీకరణ నంబర్,71
6733,అర్హత కలిగిన హోల్డింగ్ మరియు మార్పిడి కరెన్సీలు ఏమిటి?,36
6734,నా ఖాతా ఏ కరెన్సీలలో ఉండవచ్చు?,36
6735,దయచేసి నా ఖాతాకు చేసిన నకిలీ చెల్లింపును తొలగించండి. ఒక చెల్లింపు ఇంకా పెండింగ్‌లో ఉంది మరియు నేను రెండుసార్లు చెల్లించాలనుకోవడం లేదు.,63
6736,నేను వీసా పొందగలనా లేదా అది మరేదైనా అయి ఉండాలి.,73
6737,నేను ఈ కార్డ్‌ని ఏ ఏటీఎంలలో ఉపయోగించగలను?,3
6738,డిస్పోజబుల్ కార్డ్‌లకు వాటిపై ఏమైనా పరిమితులు ఉన్నాయా?,29
6739,ఆర్డర్ చేయడానికి కార్డ్‌లు ఎక్కడ అందుబాటులో ఉన్నాయి?,43
6740,నా జీతం GBPలో ఉంటే దానిని బదిలీ చేయవచ్చా?,50
6741,"నేను విదేశాలలో ఉన్నాను మరియు కొంత నగదు అవసరం, కానీ లావాదేవీకి తప్పు మార్పిడి రేటు వర్తించబడిందని నేను భావిస్తున్నాను.",76
6742,యాప్‌లో ఏ కరెన్సీలను మార్చుకోవచ్చు?,33
6743,నా పిల్లలు సేవను ఉపయోగించుకోవాలా?,1
6744,దయచేసి నా కార్డ్‌ని తిరిగి పొందడానికి నాకు సహాయం చేస్తారా?,18
6745,"నా ఛార్జీలను సమీక్షించిన తర్వాత, నేను చేసిన బదిలీకి రుసుము వసూలు చేసినట్లు నేను చూశాను, ఎందుకు?",64
6746,"హలో. నేను నా ఖాతాను చూసాను మరియు నేను చేయడానికి ప్రయత్నించిన లావాదేవీ పెండింగ్‌లో ఉందని నేను చూశాను, కానీ నేను ఆ లావాదేవీని పూర్తి చేయలేదు. నేను ATM వద్ద ఉన్నప్పుడు, యంత్రం నా కార్డును తిరస్కరించింది. నేను ఖచ్చితంగా డబ్బుని అందుకోనందున ఆ లావాదేవీ జరగలేదని మీరు నిర్ధారించుకోగలరా.",46
6747,నేను పూర్తి చేయడానికి ప్రయత్నిస్తున్న బదిలీ తిరస్కరించబడింది. కారణం ఏమిటి?,27
6748,"డైరెక్ట్ డెబిట్ లావాదేవీ జరిగింది, అక్కడ ఉండకూడదని నేను అనుకుంటున్నాను.",28
6749,మీ సేవలు ఏ దేశాలకు మద్దతు ఇస్తున్నాయి?,24
6750,నేను గ్యాస్ పొందడానికి చెక్‌ను ఉపయోగించవచ్చా?,58
6751,నేను ఆన్‌లైన్‌లో ఏదైనా కొన్నాను మరియు డబ్బును బదిలీ చేయడానికి రుసుము ఉందని చెబుతుంది. అది ఉచితం కాదా?,64
6752,"నేను నా కార్డ్‌ని పోగొట్టుకున్నాను, కానీ ఆన్‌లైన్‌లో ఆర్డర్ చేయాలి! నేను తక్షణమే వర్చువల్ కార్డ్‌ని ఎలా పొందగలను?",40
6753,నేను నా గుర్తింపును ఎలా ధృవీకరించాలి?,69
6754,నా కార్డ్ గడువు ముగియబోతోంది. నేను మరొకదాన్ని ఎలా ఆర్డర్ చేయాలి?,9
6755,నాకు ATMలో నగదు నిరాకరించబడింది,26
6756,నేను పెళ్లి చేసుకున్నాను కాబట్టి నా పేరు మార్చుకోవడం ఎలా?,30
6757,నేను జర్మనీలో నివసిస్తున్నాను. మీరు ఉన్న దేశాల్లో ఇది ఒక్కటేనా? మీరు ఏ ఇతర దేశాలలో ఉన్నారు?,24
6758,"మీరు నా డబ్బు పోగొట్టుకున్నారా? నేను చాలా కాలం క్రితం టాప్-అప్ ద్వారా నిధులను జోడించాను మరియు అవి నా ఖాతాలో ఉన్నాయని నాకు తెలుసు, కానీ అవి కనిపించకుండా పోయాయి. ఏం జరిగింది?",61
6759,కార్డ్‌తో చెల్లించేటప్పుడు నాకు అదనపు రుసుము ఎందుకు విధించబడింది?,15
6760,నేను నా ఖాతాను యాక్సెస్ చేయలేను.,44
6761,నేను చెల్లింపు చేయలేదు మరియు ఇప్పుడు నా దగ్గర ఉంది.,16
6762,నేను ఈరోజు మీ నాటింగ్ హిల్ లొకేషన్‌లో నా ATM కార్డ్‌ని ఉపయోగించడానికి ప్రయత్నించాను. అది పని చేయలేదు. నేను తప్పు చేస్తున్నానా?,26
6763,నేను నా పాస్‌కోడ్‌ని రీసెట్ చేయాలి. అలా చేయడానికి నేను ఎక్కడికి వెళ్లాలి?,44
6764,నా ఇటీవలి బదిలీ జరగలేదు - ఎందుకు కాదు?,27
6765,కొన్ని రోజుల ముందు నా ఖాతాలో జమ కావాల్సిన నా చెక్కు మొత్తం గురించి నేను ఆందోళన చెందుతున్నాను. నేను ఇప్పటికే మీకు చెక్ పంపాను.,6
6766,బదిలీ చేయబడిన డబ్బు ఎంతకాలం ముందు చూపబడుతుంది?,5
6767,నేను కొంత డబ్బును బదిలీ చేసాను కానీ బ్యాలెన్స్ మారలేదు.,5
6768,దయచేసి లావాదేవీని రద్దు చేయడంలో నాకు సహాయం చేయండి.,8
6769,నా ఖాతాలోకి డబ్బును బదిలీ చేసే ప్రక్రియను నేను తెలుసుకోవాలి.,65
6770,"హాయ్, నేను ఈ రోజు ATM నుండి కొంత డబ్బు డ్రా చేసాను. ATM నాకు తప్పుడు మొత్తం ఇచ్చింది మరియు అప్లికేషన్ నేను విత్‌డ్రా చేసిన దానికంటే ఎక్కువ మొత్తాన్ని ప్రదర్శిస్తోంది.",75
6771,నా కార్డ్‌లో తప్పు ఏమిటి? కిరాణా దుకాణంలోని గుమస్తా దానిని తిరస్కరించినట్లు చెప్పాడు.,14
6772,నా కార్డు ఎవరో దొంగిలించారు!,41
6773,కొంత నగదు విత్‌డ్రా చేయబడింది కానీ నేను చేయలేదు.,20
6774,నేను టాప్ అప్ చేయాలనుకునే చెక్ నాకు వచ్చింది?,58
6775,నేను కలిగి ఉండే డిస్పోజబుల్ కార్డ్‌ల సంఖ్యకు పరిమితి ఉందా?,29
6776,నేను ఎన్ని యాక్టివ్ కార్డ్‌లను కలిగి ఉండగలను?,39
6777,నేను Apple Payని ఉపయోగించగలనా?,2
6778,యూరప్ నుండి బదిలీలు పూర్తి కావడానికి ఎంత సమయం పడుతుంది?,67
6779,ATM నుండి నా ఉపసంహరణ రద్దు చేయబడింది.,26
6780,డబ్బు బదిలీ చేసినందుకు నాపై ఛార్జీ విధించడం సరైనదేనా?,64
6781,నేను అధికారం ఇవ్వని డైరెక్ట్ డెబిట్ చెల్లింపు నా యాప్‌లో కనిపిస్తుంది.,28
6782,నా కార్డ్‌లో మోసాన్ని ఎలా ఆపాలి?,22
6783,గరిష్టంగా డిస్పోజబుల్ వర్చువల్ కార్డ్‌లు ఏమిటి?,29
6784,"Apple పే నా అమెరికన్ ఎక్స్‌ప్రెస్ కార్డ్‌ని అంగీకరించడం లేదు, ఈ సమస్యతో మీరు నాకు సహాయం చేయగలరా?",2
6785,ATM మెషిన్ నా కార్డును తిరిగి ఇవ్వలేదు,18
6786,నేను నా కార్డ్ పిన్‌ను ఎక్కడ కనుగొనగలను?,38
6787,నా ఖాతాలో బదిలీ ఎందుకు కనిపించడం లేదని మీరు నాకు చెప్పగలరా?,5
6788,నా డబ్బు లావాదేవీ రాలేదు.,66
6789,విదేశీ కరెన్సీ మార్పిడికి రుసుము ఎంత?,31
6790,నేను నా ఖాతాను టాప్ అప్ చేయాలనుకుంటున్నాను. ఏ చెల్లింపు పద్ధతులకు మద్దతు ఉంది?,54
6791,టాప్-అప్‌తో పరిమితులు ఉన్నాయా?,60
6792,నేను కరెన్సీని మార్పిడి చేయాలనుకుంటున్నాను ఏ రకాలు ఉన్నాయి?,33
6793,చెక్కును డిపాజిట్ చేసినప్పటికీ నా బ్యాలెన్స్ మారలేదు,6
6794,చెక్ ఉపయోగించి టాప్ అప్ చేయడం సాధ్యమేనా?,58
6795,నేను నా ప్రకటనలను పరిశీలించాను మరియు నేను చేయని పెద్ద చెల్లింపు ఉందని గమనించాను. నేను ఇప్పటికీ చెల్లింపును వివాదం చేయవచ్చా? ఇది కొంత సమయం,28
6796,నేను నా వర్చువల్ కార్డ్‌ని అందుకోలేదు.,40
6797,బదిలీ సమయంలో అదనపు ఛార్జీ,64
6798,టాప్ అప్ కోసం నేను ఎంతకాలం వేచి ఉండాలి?,47
6799,చెక్కును డిపాజిట్ చేసిన తర్వాత నా ఖాతా బ్యాలెన్స్ ఎందుకు మారలేదు?,6
6800,నా ఖాతాను టాప్ అప్ చేయడానికి నేను ఏ కరెన్సీని ఉపయోగించవచ్చో దయచేసి నాకు తెలియజేయండి?,54
6801,నేను నా వ్యక్తిగత సమాచారాన్ని సవరించాలనుకుంటున్నాను.,30
6802,"నేను పశ్చాత్తాపపడి పెద్ద కొనుగోలు చేసాను మరియు రద్దు చేసాను, నా రీఫండ్ సమర్పించబడిందని వ్యాపారి చెప్పారు. నా డబ్బు మొత్తం నాకు నిజంగా తిరిగి వచ్చిందని మీరు నాకు ధృవీకరించగలరా?",51
6803,పెండింగ్‌లో ఉన్న నగదు ఉపసంహరణ అంటే ఏమిటి?,46
6804,నా వాపసు ఇంకా నా ఖాతాలో చేరలేదు,51
6805,నా టాప్-అప్ పెండింగ్‌లో ఉన్నట్లు కనిపిస్తోంది.,47
6806,"నాకు కొత్త కార్డ్ వచ్చింది, దాన్ని ఎలా లింక్ చేయాలి?",13
6807,ఈ యాప్ ద్వారా నేను ఏ ఫియట్ కరెన్సీలను ఉపయోగించగలను?,36
6808,టాప్-అప్‌ల పరిమితి ఏమిటి?,60
6809,చెల్లింపు పెండింగ్‌లో ఉన్నప్పుడు దాని అర్థం ఏమిటి?,45
6810,కార్డ్ టాప్-అప్ కోసం ధృవీకరణ కోడ్‌ను నేను ఎక్కడ కనుగొనగలను?,71
6811,నేను డిస్పోజబుల్ వర్చువల్ కార్డ్‌ని ఎక్కడ పొందగలను?,37
6812,"స్పర్శరహిత చెల్లింపులను ఉపయోగించడంలో నాకు సమస్యలు ఉన్నాయి, నా కార్డ్ పాడైపోవచ్చా?",23
6813,డిస్పోజబుల్ వర్చువల్ కార్డ్‌లకు పరిమితులు ఉంటే మీరు నాకు చెప్పగలరా?,29
6814,నాకు తెలియకుండా ఎవరో నా కార్డును ఉపయోగించారు!,22
6815,విదేశాల్లో నగదు మార్పిడి రేటు తప్పుగా వర్తించబడుతుంది.,76
6816,"నా భర్త మరియు నేను మా వారపు ""డిన్నర్ మరియు సినిమా"" కోసం బయటకు వెళ్ళాము మరియు చెక్కును తీయడం నా వంతు. ఇప్పుడు నా కార్డ్‌కి రెండుసార్లు ఛార్జ్ చేసినట్లు నేను చూస్తున్నాను. రెండవ ఛార్జ్‌ను తిరస్కరించడం మరియు నా కార్డ్‌ని క్రెడిట్ చేయడం గురించి నేను ఎవరిని సంప్రదించాలి?",63
6817,సిస్టమ్ అప్‌డేట్ చేయడానికి ముందు బ్యాలెన్స్ ఎంత తక్కువగా ఉండాలి?,4
6818,మీరు అందిస్తున్న సేవల పట్ల నేను చాలా అసంతృప్తిగా ఉన్నాను. నేను నా ఖాతాను రద్దు చేయాలనుకుంటున్నాను.,55
6819,నాకు మరొక కరెన్సీలో నా చెల్లింపు అవసరం,50
6820,నా కార్డ్ చెల్లింపు పని చేయదు.,25
6821,కొత్త కార్డ్ గడువు ముగిసిన తర్వాత దాన్ని పొందడానికి నేను ఏదైనా చేయాలా?,9
6822,నేను చేసిన బదిలీని రద్దు చేయాలి.,8
