,text,label
4533,నా టాప్అప్ ఎందుకు పని చేయడం లేదు?,59
4534,నా పాస్‌వర్డ్ నాకు తెలియకపోతే నేను ఏమి చేయాలి?,44
4535,నగదు టాప్ అప్ కోసం నేను ఎక్కడ వెతకాలి?,58
4536,ఈ కార్డ్ ప్రపంచవ్యాప్తంగా పని చేస్తుందా?,10
4537,నేను టాప్ అప్‌ని ఎలా వెరిఫై చేయాలి?,71
4538,నా స్టేట్‌మెంట్‌పై అదనపు రుసుము గురించి నేను ఎలా కనుగొనగలను?,34
4539,నా పిన్ ఎక్కడ ఉంది? నా దగ్గర ఇంకా లేదు,38
4540,ఈ ఖాతాను పూర్తి చేయడానికి దశలు ఏమిటి?,55
4541,నా పిన్‌ని రీసెట్ చేయడానికి ఏదైనా మార్గం ఉందా?,49
4542,"నేను నా డబ్బును ఉపసంహరించుకున్నప్పుడు, అదనపు ఛార్జీ ఎందుకు విధించబడింది?",19
4543,ట్రాక్ చేయడానికి నేను పొందగలిగే నంబర్ ఉందా?,11
4544,నా బ్యాలెన్స్‌ని విదేశీ కరెన్సీలోకి మార్చుకోవడానికి ఎంత ఖర్చవుతుంది?,31
4545,ఎక్కువ కార్డులు పొందడానికి ఛార్జీ విధించబడుతుందా?,39
4546,నా కార్డ్ గడువు ముగియబోతున్నట్లయితే నేను ఏమి చేయాలి?,9
4547,నాకు తెలియకుండా ఎవరైనా నా కార్డ్‌ని ఉపయోగిస్తున్నారని నేను నమ్ముతున్నాను!,22
4548,నేను నగదు ఉపసంహరించుకున్నప్పుడల్లా నాకు ఎందుకు ఛార్జీ విధించబడుతుంది?,19
4549,"నేను నా ఖాతాకు నగదు డిపాజిట్ చేసాను, కానీ అది అక్కడ లేదు",6
4550,సమీపంలో మాస్టర్ కార్డ్ ATM ఉందా?,3
4551,ఈ నగదు ఉపసంహరణ ఏమిటో చెప్పగలరా?,20
4552,ఏటీఎం నేను అడిగినంత మొత్తం ఇవ్వలేదు,75
4553,నేను ఇటీవలే నా కార్డ్ తప్పిపోయినట్లు/పోగొట్టుకున్నట్లు నివేదించాను మరియు నేను ఇప్పుడే దాన్ని కనుగొన్నాను. నేను ఇప్పటికీ దానిని ఉపయోగించవచ్చా?,13
4554,నేను ఆటో టాప్ అప్ ఫీచర్‌ని ఎక్కడ కనుగొనగలను మరియు దాని గురించి కొంచెం చెప్పండి.,4
4555,నా కార్డ్‌కి డబ్బు జోడించడానికి ఖర్చు అవుతుందా?,57
4556,టాప్ అప్ చేయడానికి నా పరిమితి ఎంత?,60
4557,"నాకు కార్డ్ రీయాక్టివేషన్ కావాలి, నా కార్డ్ పోయినట్లు నేను రిపోర్ట్ చేసాను కానీ నేను దానిని జాకెట్‌లో వేసుకున్నాను.",13
4558,నా కార్డ్ గడువు ముగిసేలోపు నేను తీసుకోవాల్సిన చర్యలు ఏమైనా ఉన్నాయా?,9
4559,నేను డబ్బు మూలాన్ని ఎక్కడ చూడగలను?,70
4560,"నేను దుకాణానికి వెళ్లి కొనుగోలు చేయడానికి ప్రయత్నించాను. మొదటి సారి, ఇది తిరస్కరించబడింది, కానీ రెండవది జరిగింది. కానీ నా యాప్ నాకు ఇప్పటికే ఒకసారి ఛార్జీ విధించబడిందని మరియు రెండవ ఛార్జీ ఇంకా పెండింగ్‌లో ఉందని చూపిస్తుంది. నాకు రెండుసార్లు ఛార్జీ విధించబడలేదని మీరు నిర్ధారించగలరా?",63
4561,దయచేసి నేను చేసిన బదిలీపై రుసుమును వివరించండి.,64
4562,నాకు కొంత నగదు వచ్చింది కానీ అది సరైన మొత్తం కాదు.,75
4563,టాప్-అప్ ఇప్పటికీ ఎందుకు పెండింగ్‌లో ఉందో మీరు నాకు వివరించగలరా?,47
4564,నా దగ్గర నా సెల్ ఫోన్ లేదు కాబట్టి లావాదేవీని పూర్తి చేయడానికి నేను సిస్టమ్‌ని యాక్సెస్ చేయలేను.,42
4565,నా కరెన్సీకి నేను ఏ విలువను పొందగలను?,32
4566,విదేశీ కరెన్సీని మార్చుకున్నందుకు నాకు ఛార్జీ విధించవచ్చా?,31
4567,నేను బదిలీ చేసిన డబ్బు నాకు ఇంకా రాలేదు,5
4568,నేను కలిగి ఉండే కరెన్సీకి పరిమితులు ఉన్నాయా?,36
4569,నేను డిస్పోజబుల్ కార్డ్‌ని ఎన్నిసార్లు ఉపయోగించవచ్చో పరిమితి ఉందా?,29
4570,నేను కార్డును ఎక్కడ ఆర్డర్ చేయగలను?,43
4571,డిస్పోజబుల్ కార్డులు - అవి దేనికి?,37
4572,నేను ప్రయాణిస్తున్నాను మరియు మీ మారకపు రేట్లు ఏమిటి అని నేను ఆశ్చర్యపోతున్నాను,32
4573,నేను నా కార్డును నా తల్లిదండ్రుల ఇంట్లో ఉంచాను. దయచేసి ఈలోగా ఉపయోగించడానికి దయచేసి నాకు ఒక విడిభాగాన్ని పంపగలరా?,39
4574,నా ప్రకటనలో అనధికార చెల్లింపు ఉంది.,16
4575,"సహాయం! నా కార్డ్ దొంగిలించబడిందని నేను భయపడుతున్నాను,",41
4576,ATM నా కార్డ్ నాకు తిరిగి ఇవ్వలేదా?,18
4577,"హలో, వర్చువల్ కార్డ్ అంటే ఏమిటి మరియు నేను దానిని ఎలా పొందగలను?",40
4578,నా స్టేట్‌మెంట్‌లో అదనపు €1 రుసుము ఎందుకు ఉందో దయచేసి నాకు వివరించగలరా?,34
4579,నా ఖాతాను టాప్ అప్ చేయడానికి నేను నా చెక్కును డిపాజిట్ చేయాలనుకుంటున్నాను,58
4580,బదిలీలకు ఎంత సమయం పడుతుంది? నేను త్వరగా డబ్బు అవసరమైన స్నేహితుడికి పంపాను. గంటలు గడిచినా డబ్బులు రాలేదు.,66
4581,నా ప్యాకేజీ రావడానికి చాలా సమయం తీసుకుంటోంది మరియు నాకు అది ఇక అక్కరలేదు. నేను వాపసు పొందవచ్చా?,52
4582,నా కార్డ్ లేదు! సహాయం!,41
4583,నా టాప్ ఆఫ్ పని చేయకపోతే నేను చెప్పగలనా? అది ఉన్నట్లు లేదు.,59
4584,నేను నా వ్యక్తిగత సమాచారాన్ని కొన్నింటిని ఎలా ఎడిట్ చేయవచ్చో మీరు నాకు తెలియజేయగలరా?,30
4585,"నా దగ్గర చెక్ డిపాజిట్ చేయబడింది, కానీ నా డబ్బు ఇంకా కనిపించలేదా?",6
4586,నేను గుర్తింపు తనిఖీలను ఎలా నిర్వహించగలను?,69
4587,నా దగ్గర ఇంకా నగదు ఉపసంహరణ ఎందుకు పెండింగ్‌లో ఉంది?,46
4588,నేను మళ్ళీ నా కార్డును కనుగొన్నాను. నేను దానిని తిరిగి యాప్‌లో ఉంచవచ్చా?,13
4589,నా ఖాతా నుండి డైరెక్ట్ డెబిట్ ఉంది మరియు నేను దానికి అధికారం ఇవ్వలేదు,28
4590,"నేను నా స్నేహితులకు డబ్బు పంపడానికి ప్రయత్నించాను మరియు నేను తిరస్కరించబడుతూనే ఉన్నాను. దయచేసి ఎందుకు చెప్పగలరా, నాకు అర్థం కాలేదు.",35
4591,నా కార్డ్ వెంటనే స్తంభింపజేయాలనుకుంటున్నాను. నేను ఎప్పుడూ వినని బేసి ప్రదేశంలో డబ్బు తీయబడింది.,20
4592,నేను టాప్-అప్ ధృవీకరణ కోడ్‌ను ఎలా కనుగొనగలను?,71
4593,"నేను ఇంకా నా బదిలీ నిధులను స్వీకరించలేదు, అవి ఎక్కడ ఉన్నాయి?",48
4594,నేను యాప్‌లో కార్డ్‌లను ఆర్డర్ చేయవచ్చా,43
4595,"యాప్‌తో నా ఫోన్ ఇప్పుడు నా దగ్గర లేదు, నేను ఏమి చేయాలి?",42
4596,నాకు నిధులు తక్కువగా ఉంటే నేను ఆటో టాప్ చేయవచ్చా?,4
4597,నేను గుర్తించలేని ప్రత్యక్ష డెబిట్ చెల్లింపు ఉంది.,28
4598,నేను ఆమోదించని డైరెక్ట్ డెబిట్ ఛార్జీని చూస్తున్నాను,28
4599,"నా కార్డ్‌లో గత రోజుల నుండి నేను గుర్తించని కొన్ని ఛార్జీలను ఇప్పుడే చూశాను, నేను కార్డ్‌ని త్వరగా స్తంభింపజేయాలి! నేను నా డబ్బును తిరిగి పొందగలనా?",16
4600,"నేను నా ఖాతాలో నగదు డిపాజిట్ చేసాను, కానీ నాకు అది ఇంకా కనిపించలేదు.",6
4601,నేను హార్డ్ క్యాష్‌లో నిధులను పొందడానికి ప్రయత్నించాను కానీ అది తిరస్కరించబడింది!,26
4602,నేను నా కార్డ్‌ని రెండు వారాల క్రితం ఆర్డర్ చేసాను మరియు ఇంకా దానిని అందుకోలేదు. నేను ఎప్పుడు ఆశించగలను?,12
4603,నా స్టేట్‌మెంట్‌పై రుసుము ఎంత?,34
4604,నా కార్డ్‌పై చెల్లింపు ఇంకా ఎందుకు పెండింగ్‌లో ఉంది?,45
4605,ఏదో ఒక డూప్లికేట్ చెల్లింపు జరిగింది.,63
4606,నగదు ఉపసంహరణకు రుసుము ఎంత?,19
4607,అంతర్జాతీయ కొనుగోలు కోసం దరఖాస్తు చేసిన మారకం రేటు తప్పు.,17
4608,నేను చైనాలో ఉన్నాను మరియు కొత్త కార్డ్ కావాలి. దయచేసి సహాయం చేయండి.,9
4609,US కార్డ్‌లకు టాప్ అప్ ఛార్జీలు ఉన్నాయా?,57
4610,నా కొత్త కార్డ్ ఇక్కడ లేదు మరియు అది వారం క్రితం జారీ చేయబడింది.,11
4611,నా ఖాతాలో డబ్బును ఉంచడానికి నేను నా అమెరికన్ ఎక్స్‌ప్రెస్‌ని ఉపయోగించాలనుకుంటున్నాను.,54
4612,నాకు రుసుము ఉంది మరియు ఎందుకో నాకు తెలియదు,15
4613,నేను బదిలీ చేయడానికి విఫలయత్నం చేస్తున్నాను మీరు సహాయం చేయగలరా?,35
4614,నేను ATM నుండి డబ్బు తీసుకున్నాను మరియు అది ఇంకా పెండింగ్‌లో ఉందా?,46
4615,"నా కార్డ్ సమాచారం దొంగిలించబడింది, నేను ఏమి చేయాలి?",22
4616,గత శనివారం నా చెల్లింపుపై అదనపు ఛార్జీ విధించబడిందని నేను భావిస్తున్నాను. బహుశా మార్పిడి రేటు తప్పుగా ఉందా? నేను వాపసు చేయాలనుకుంటున్నాను.,17
4617,ఇది అత్యవసరం. దయచేసి ఇప్పుడు నా కార్డును స్తంభింపజేయండి. మారుమూల పట్టణంలోని ఎవరైనా నా కార్డ్‌ని ఉపయోగించి కొంత డబ్బు విత్‌డ్రా చేసుకున్నారు. నేను డబ్బు తీసుకోలేదు కాబట్టి.,20
4618,"నేను నగదు ఉపసంహరించుకోవడానికి ప్రయత్నించాను మరియు తిరస్కరించాను, అది ఎందుకు?",26
4619,నాకు ఎవరు డబ్బు పంపగలరు?,50
4620,నేను నా వ్యక్తిగత వివరాలను సవరించవచ్చా?,30
4621,నా పాస్‌వర్డ్ ఏమిటో నాకు తెలియదు.,44
4622,నేను ఆర్డర్ చేసిన కార్డ్ ఎక్కడ ఉందో తెలుసుకోవాలి.,11
4623,నేను ఇప్పటికీ వాపసు కోసం ఎదురు చూస్తున్నాను,51
4624,నేను నా పిన్‌ని మళ్లీ ఎలా పని చేయగలను?,49
4625,నేను ప్రయాణంలో ఉన్నప్పుడు నా ఖాతాకు ఆటోమేటిక్‌గా డబ్బు జోడించవచ్చా?,4
4626,సహాయం! యాప్‌లో నాకు గుర్తులేని చెల్లింపు ఉంది.,16
4627,US జారీ చేసిన కార్డ్‌ని టాప్ అప్ చేయడానికి ఎంత ఖర్చవుతుంది?,57
4628,నిధులను జోడించడానికి అమెరికన్ ఎక్స్‌ప్రెస్‌కు మద్దతు ఉందా?,54
4629,X లబ్ధిదారునికి నా చెల్లింపు ఎందుకు ఆమోదించబడలేదు?,7
4630,మారకం రేటుపై మీ అభిప్రాయాన్ని తెలియజేయండి.,32
4631,మీరు మార్పిడి రుసుము కోసం ఏమి వసూలు చేస్తారు?,31
4632,"హాయ్, నేను టాప్-అప్ చేయడానికి ప్రయత్నిస్తున్నప్పుడు నా కార్డ్ నిరంతరం తిరస్కరించబడుతోంది. ఈ సమస్యను పరిశీలించమని లేదా ఏదైనా ఇతర ప్రత్యామ్నాయాలను నాకు తెలియజేయమని మిమ్మల్ని అభ్యర్థిస్తున్నాను.",59
4633,నాకు చెల్లింపు పెండింగ్‌లో ఉందని చెప్పినప్పుడు దాని అర్థం ఏమిటి?,45
4634,టాప్-అప్ ధృవీకరణ కోడ్ ఎక్కడ పంపబడింది?,71
4635,నేను చేయని చెల్లింపును ఎలా వివాదం చేయాలి,16
4636,నా ఖాతాలో నేను గుర్తించలేని డైరెక్ట్ డెబిట్ ఛార్జీ ఉంది.,28
4637,తరలించిన తర్వాత నేను నా వ్యక్తిగత సమాచారాన్ని ఎలా అప్‌డేట్ చేయగలను?,30
4638,నేను పాస్‌కోడ్‌ని రీసెట్ చేయవచ్చా?,44
4639,ఈ కొత్త కార్డు పొందడానికి ఎంత సమయం పడుతుంది?,11
4640,దయచేసి సహాయం చేయండి! నా భౌతిక కార్డ్ సరిగ్గా పని చేయడం లేదు.,14
4641,నేను వీలైనంత త్వరగా నా ఖాతాను మూసివేయాలి.,55
4642,ఏటీఎం పగిలింది. ఇది నాకు పూర్తి మొత్తాన్ని ఇవ్వలేదు (30 పౌండ్లు.) నేను ఇక్కడ కేవలం 10 పౌండ్లతో నిలబడి ఉన్నాను మరియు అది నాకు 30 పౌండ్లు ఇచ్చిందని చెబుతోంది. నాకు ఇప్పుడు సహాయం కావాలి!,75
4643,నేను చెల్లించడానికి చెక్కును ఉపయోగించాలనుకుంటున్నాను.,58
4644,నా టాప్ అప్ విఫలమైందని నేను నమ్ముతున్నాను,59
4645,"బదిలీకి సాధారణంగా పట్టే కాలపరిమితి ఎంత? నాకు ఇది వెంటనే అవసరమయ్యే స్నేహితుడికి ఉంది, కానీ అది ఇంకా రాలేదు.",66
4646,"హే నేను ఇక్కడ ATM ముందు నిలబడి ఉన్నాను, నేను 30 విత్‌డ్రా చేయాలనుకున్నా అది నాకు 10 పౌండ్లు మాత్రమే ఇచ్చింది! యాప్‌లో 30 పౌండ్లు ఉన్నట్లుగా ఉంది, నేను ఏమి చేయాలి ??",75
4647,హాయ్ నేను వేరే దేశానికి డబ్బు బదిలీ చేయడానికి ప్రయత్నిస్తున్నాను కానీ అది పెండింగ్‌లో ఉంది మరియు చాలా కాలం అయ్యింది. నేను నంబర్లను తనిఖీ చేసాను మరియు అవి సరైనవి. దయచేసి మీరు సహాయం చేయగలరా?,48
4648,"నేను గత వారం నా కొత్త కార్డ్‌ని ఆర్డర్ చేసినట్లయితే, దాన్ని అందుకోవడానికి నేను ఎంతకాలం వేచి ఉండాలి?",11
4649,"నా కార్డ్‌తో చెల్లింపు ఉంది, అది నేను ఖచ్చితంగా చేయలేదు .ఇది ఇంతకు ముందెన్నడూ చూడలేదు.",16
4650,నేను సెలవులో ఉన్నాను మరియు మారకపు రేటు కోసం వేరే మొత్తాన్ని గమనించాను. మీరు వివరంచగలరా?,17
4651,టాప్-అప్ కార్డ్ ధృవీకరణ కోడ్ ఎక్కడ ఉంది?,71
4652,టాప్-అప్‌లకు ఛార్జీ ఉందా?,57
4653,ఎలా టాప్ అప్ చేయాలో నాకు అర్థం కావడం లేదు,62
4654,"నా కార్డ్ గడువు ముగిసినప్పుడు, రీప్లేస్‌మెంట్ ధర ఎంత మరియు ఎంత వేగంగా ఉంటుంది?",9
4655,నా టాప్-అప్ ఎందుకు పెండింగ్‌లో ఉందో చెప్పండి.,47
4656,నేను నా కార్డ్‌తో కొనుగోలు చేసాను మరియు దానిని ఉపయోగించినందుకు నాకు రుసుము విధించబడింది,15
4657,నా పిన్‌ను అన్‌బ్లాక్ చేయడానికి వెబ్ చిరునామా ఏమిటి?,49
4658,"నాకు బదిలీ రుసుము విధించబడింది, అది ఎందుకు?",64
4659,బదిలీ చేయడానికి నాకు ఎందుకు అదనపు ఛార్జీ విధించబడుతుందో మీరు వివరించగలరా?,64
4660,"నేను ఈ బదిలీని చేయడానికి ప్రయత్నించిన ప్రతిసారీ లోపాలు కనిపిస్తూనే ఉంటాయి మరియు నేను టైమ్ క్రంచ్‌లో ఉన్నాను, దయచేసి మీరు సహాయం చేయగలరా.",35
4661,నా కార్డ్ చెల్లింపు ఎందుకు పని చేయలేదని మీరు వివరించగలరా?,25
4662,టాప్-అప్ ధృవీకరణ కోడ్ ఎక్కడ ఉంది?,71
4663,బదులుగా నాకు మాస్టర్ కార్డ్ కావాలి.,73
4664,మీరు కార్డులను ఎక్కడికి డెలివరీ చేస్తారు?,43
4665,"నగదు పొందుతున్నప్పుడు, నాకు రుసుము వసూలు చేయబడింది.",19
4666,నాకు సహాయం కావాలి. నేను నిన్న నా బ్యాలెన్స్ చెక్‌తో అప్‌డేట్ చేసాను మరియు నాకు అది కనిపించడం లేదు. ఏమి తప్పు జరిగిందో తెలుసుకోవడానికి మీరు నా ఖాతాను చూడగలరా?,6
4667,"నేను సాధారణంగా ATMలను ఉపయోగించను, కానీ నేను ఈ రోజు హడావిడిలో ఉన్నాను మరియు కొంత నగదు తీసుకోవలసి వచ్చింది. ATM నాకు తప్పుడు మొత్తంలో డబ్బు ఇచ్చింది మరియు ఇప్పుడు నా యాప్ చూపించాల్సిన మొత్తాన్ని చూపడం లేదు. నెను ఎమి చెయ్యలె?",75
4668,విదేశీ కరెన్సీ ఛార్జీ ఉందా?,31
4669,US నుండి బదిలీకి ఎంత సమయం పడుతుంది?,67
4670,ATM మెషిన్ నా కార్డును తిరిగి ఇవ్వలేదు.,18
