,text,label
2243,నేను వర్చువల్ కార్డ్‌ని పొందాలనుకుంటున్నాను!,40
2244,నేను నా వాపసు పొందలేదా? నాకు కనిపించడం లేదు.,51
2245,నేను వారాల క్రితం ఆన్‌లైన్‌లో ఆర్డర్ చేసాను మరియు నా ప్యాకేజీని మెయిల్‌లో ఎప్పుడూ అందుకోలేదు మరియు నేను ఇక వేచి ఉండకూడదనుకుంటున్నాను. కాబట్టి నేను ఇప్పుడు నా డబ్బును తిరిగి పొందగలిగితే అది గొప్పది.,52
2246,నేను ఈ ఉదయం చేసిన లావాదేవీని రివర్స్ చేయాలనుకుంటున్నాను,8
2247,UK వెలుపల ఉన్న వారికి కార్డ్‌లు అందుబాటులో ఉన్నాయా?,24
2248,నేను నా ఖాతా ద్వారా చెల్లించడానికి ప్రయత్నించాను కానీ చెల్లింపు జరగలేదు. ఏం జరుగుతోంది?,45
2249,నా ఫోన్ పోయింది లేదా దొంగిలించబడింది,42
2250,నా కార్డ్ గడువు ముగియనుంది,9
2251,నేను కార్డ్ ద్వారా టాప్ అప్ చేయాలనుకుంటున్నాను,62
2252,నేను ఇప్పటికే చెల్లించినప్పటికీ డబ్బు నా ఖాతాలోనే ఉంది -- ఏమి జరిగిందో నాకు అర్థం కాలేదు.,53
2253,నా టాప్-అప్ ఎక్కడ నుండి రూపొందించబడింది?,70
2254,కార్డ్‌లు ఏయే స్థానాలకు డెలివరీ చేయబడ్డాయి?,43
2255,నేను నా కార్డును ఎందుకు ఉపయోగించలేను?,14
2256,నా గ్రహీత డబ్బుని అందుకోలేదు,66
2257,నేను ఎలా టాప్ అప్ చేయాలి?,65
2258,నేను మాస్టర్‌కార్డ్ పొందడానికి ఇష్టపడతాను.,73
2259,"ATM నా కార్డ్‌ని ఎందుకు నిరంతరం తిరస్కరిస్తుంది? నేను ఒకే ఫలితాలతో విభిన్న మెషీన్‌లలో అనేకసార్లు ప్రయత్నించాను. దీని కోసం నా దగ్గర తగినంత నిధులు ఉన్నాయని నేను అనుకున్నాను, దయచేసి ఇది ఎందుకు జరుగుతుందో అర్థం చేసుకోవడానికి నాకు సహాయం చేయండి.",26
2260,నగదు ఉపసంహరణకు ప్రయత్నించినప్పుడు నేను తిరస్కరించబడ్డాను!,26
2261,టాప్-అప్ కార్డ్‌ని ఎలా ధృవీకరించాలో మీరు నాకు చూపగలరా?,71
2262,డిస్పోజబుల్ వర్చువల్ కార్డ్‌లను ఉపయోగించడం వల్ల నష్టాలు ఉన్నాయా?,29
2263,నేను ఈ కార్డ్ చెల్లింపును గుర్తించలేదు.,16
2264,నా ఖాతా నుండి డబ్బు తీసివేయబడింది మరియు నేను దీన్ని చేయలేదని నేను ఖచ్చితంగా అనుకుంటున్నాను.,20
2265,నాకు పెళ్లయింది కాబట్టి నా పేరు మార్చుకోవాలి,30
2266,నా నగదు ఉపసంహరణతో ఏమి జరుగుతోంది? మార్పిడి రేటు తప్పు,76
2267,నా యాప్ నేను చేయని చెల్లింపును చూపుతుంది,16
2268,నా దగ్గర కొత్త కార్డ్ ఉంది మరియు దానిని యాక్టివేట్ చేయాలి,0
2269,నేను నా ఖాతాకు నగదు డిపాజిట్ చేసాను కానీ అది కనిపించలేదు,6
2270,గుర్తింపు ధృవీకరణ కోసం మీకు ఏ ID ఫారమ్‌లు అవసరం?,69
2271,అన్ని ATMలు ఈ కార్డును అంగీకరిస్తాయా?,3
2272,నేను అదనపు కార్డ్‌లను ఎక్కడ ఆర్డర్ చేయాలి?,39
2273,నేను టాప్ అప్ కోసం ఒక గంటకు పైగా వేచి ఉన్నాను. దీనికి ఎంత సమయం పడుతుంది? నాకు నిజంగా ఈ డబ్బు కావాలి.,47
2274,"కార్డ్ టాప్-అప్‌లో, నేను ఎక్కడ ధృవీకరించగలను?",71
2275,"మీరు దీన్ని కొన్ని సెకన్లలో చేయవచ్చు. ఖాతాకు వెళ్లి, యాక్టివేట్ నొక్కండి మరియు అక్కడ నుండి సూచనలను అనుసరించండి.",0
2276,నేను atm వద్ద నా పిన్ మార్చవచ్చా?,21
2277,సహాయం! నేను లావాదేవీని రద్దు చేయాలి.,8
2278,నా బ్యాంక్ ఖాతాలో కనిపించడానికి నా బ్యాంక్ బదిలీని నేను ఎలా పరిష్కరించగలను?,5
2279,"నా టాప్-అప్ బదిలీ చేయకపోతే, ఏమి తప్పు జరిగింది?",61
2280,నేను నా కార్డ్‌ని డియాక్టివేట్ చేసాను కానీ దాన్ని మళ్లీ యాక్టివేట్ చేయాలనుకుంటున్నాను.,13
2281,డిస్పోజబుల్ కార్డ్ పరిమితులు ఏమిటి?,29
2282,మీ యాప్ ఏయే దేశాల్లో పని చేస్తుంది,24
2283,నా టాప్-అప్ ఎందుకు తిరస్కరించబడింది?,59
2284,ఈ కార్డ్‌ని ఏ వ్యాపారం తీసుకుంటుందో నేను చెప్పగలనా?,10
2285,కార్డ్‌ని యాక్టివేట్ చేసే ప్రక్రియ ఏమిటి,0
2286,నా టాప్-అప్‌లో తప్పు ఏమిటి?,47
2287,నా చెల్లింపు ఇప్పటికీ ఎందుకు పెండింగ్‌లో ఉన్నట్లు చూపబడుతుంది?,45
2288,నా రీఫండ్‌కి ఇంత సమయం పట్టేది ఏమిటి?,51
2289,"మీ కంపెనీ భయంకరంగా ఉంది, దయచేసి నా ఖాతాను తొలగించాలనుకుంటున్నాను",55
2290,నేను సేవతో సంతోషంగా లేను మరియు ఈ ఖాతాను తొలగించాలనుకుంటున్నాను.,55
2291,గరిష్టంగా టాప్-అప్ అంటే ఏమిటి?,60
2292,నా బదిలీ సాధ్యం కాదని నాకు సందేశం వచ్చింది. ఏం జరుగుతుంది? దయచేసి నాకు ఇది అవసరం.,7
2293,నా నగదు ఉపసంహరణ పూర్తిగా పూర్తి కాలేదు,75
2294,నేను టాప్ అప్ ధృవీకరణ కోడ్‌ను ఎక్కడ కనుగొనగలను?,71
2295,"కొంతకాలం క్రితం ఒక విక్రేత నా ఖాతా నుండి డబ్బు తీసుకున్నట్లు నేను చూశాను. నేను విక్రేతను గుర్తించలేదు, కానీ నేను ఆ చెల్లింపు చేయలేదని నేను ఖచ్చితంగా అనుకుంటున్నాను. విక్రేత ఎవరో మీరు ట్రాక్ చేయగలరా?",28
2296,ఫోన్ పోయింది,42
2297,పిన్ విడిగా వస్తుందా?,38
2298,నేను వాపసు కోసం అభ్యర్థించవచ్చా,52
2299,నా గుర్తింపును ఎలా ధృవీకరించాలో వివరించండి?,69
2300,నా టాప్ అప్‌తో సమస్యలు,59
2301,నేను నా కార్డ్‌ని రెస్టారెంట్‌లో ఉంచాను మరియు ఇప్పుడు అది లేదు.,41
2302,నేను ఇంతకు ముందు చేసినప్పుడు నా బదిలీ సాధ్యం కాదని నేను ఎందుకు ఎర్రర్‌ను స్వీకరిస్తాను?,7
2303,మీ కార్డ్‌లు ఎక్కడికి డెలివరీ చేయబడ్డాయి?,43
2304,నా బదిలీ విఫలం కావడానికి కారణం ఏమిటి?,35
2305,ఈ అదనపు పౌండ్ ఛార్జ్ దేనికి?,34
2306,టాప్-అప్ ధృవీకరణ కోడ్ ఎక్కడ ఉంది?,71
2307,నేను ఎందుకు బదిలీ చేయలేను?,35
2308,నా ఖాతా నుండి నగదు తీసుకోవడానికి ఛార్జీలు ఎప్పటి నుండి ఉన్నాయి? ఇంతకు ముందు ఇలా చేయడం నాకు ఎప్పుడూ ఉచితం. ఛార్జీలు ఎంత ఉండబోతున్నాయి?,19
2309,నేను నా పిన్‌లోకి ప్రవేశించకుండా లాక్ చేయబడ్డాను.,49
2310,నాకు సహాయం కావాలి- నేను నిన్న మగ్డ్ అయ్యాను మరియు వారు ప్రతిదీ తీసుకున్నారు కాబట్టి నేను యాప్‌ని ఉపయోగించలేను.,42
2311,నా జీతం వేరే కరెన్సీలో ఉంటే మీరు అంగీకరిస్తారా?,50
2312,నా ప్రస్తుత నిధుల మూలాన్ని ఎలా చూడాలో నాకు చూపించాలా?,70
2313,"యాప్‌లో చూపబడిన నా కార్డ్‌తో రెండు చెల్లింపులు ఉన్నాయి, అవి నేను నిజంగా చేయనివి. దీనితో ఏమి జరుగుతోంది, ఎవరైనా నా కార్డ్‌కి యాక్సెస్ కలిగి ఉన్నారా?!",16
2314,ప్రతిదీ సరిగ్గా జరిగిందని నిర్ధారించుకోవడానికి దయచేసి మీరు నా UK ఖాతాను తనిఖీ చేయగలరా? నేను కొన్ని గంటల క్రితం బదిలీ చేసాను.,5
2315,నా ఖాతాలో కార్డ్ చెల్లింపు పెండింగ్‌లో ఉన్నట్లు చూపబడింది.,45
2316,మారకం రేటులో లోపం ఉంటే?,17
2317,నేను నా నిధులను ధృవీకరించాలి.,70
2318,"నా ఖాతాలో నేను చేయని కొన్ని లావాదేవీలు ఉన్నాయి. మీరు నా కార్డ్‌ని రద్దు చేసి, తదుపరి వినియోగాన్ని నిరోధించగలరా.",22
2319,"నేను ఇప్పటికి నా కొత్త కార్డ్‌ని అందుకోవాల్సి ఉంది, కానీ అది రాలేదు.",11
2320,నాకు ఎక్కడా టాప్-అప్ ధృవీకరణ కోడ్ కనిపించడం లేదు,71
2321,నా టాప్-అప్ ఎందుకు రద్దు చేయబడిందో మీరు నాకు చెప్పగలరా?,61
2322,US బదిలీకి ఎంత సమయం పడుతుంది,67
2323,"మీరు నా కార్డ్‌తో నాకు సహాయం చేయగలరా, అది విరిగిపోయిందని నేను భావిస్తున్నాను.",14
2324,నా కార్డ్‌ని ఎలా యాక్టివేట్ చేయాలో మీకు ప్రాసెస్ తెలుసా?,0
2325,నా నగదు ఉపసంహరణకు నా ఉపసంహరణ రేటు ఎలా తప్పు అవుతుంది,76
2326,చైనాలో కొత్త కార్డు పొందాలనుకుంటున్నాను,9
2327,నిధులు ఎక్కడి నుంచి వచ్చాయో వెతకడానికి మార్గం ఉందా?,70
2328,నేను ఈ కార్డ్‌ని ఎక్కడ ఉపయోగించాలో ఏవైనా పరిమితులు ఉన్నాయా?,10
2329,నేను ఏదైనా ATMలో నా PINని మార్చవచ్చా?,21
2330,బదిలీని ప్రతిబింబించడానికి మరియు అందుబాటులో ఉండటానికి ఎంత సమయం పడుతుంది,5
2331,ఏ వ్యాపారులు ఈ కార్డ్‌ని అంగీకరిస్తారు?,10
2332,నాకు సహాయం చెయ్యండి. నా బదిలీ తిరస్కరించబడింది. ఇది ఎలా జరుగుతుంది?,27
2333,"నేను నా స్నేహితులకు అత్యవసరంగా కొంత డబ్బు పంపవలసి వచ్చింది. నేను ఈ ఉదయం డబ్బును బదిలీ చేయడానికి చాలాసార్లు ప్రయత్నించాను, కానీ బదిలీ విఫలమవుతూనే ఉంది. బదిలీ ఎందుకు తిరస్కరించబడుతుందో చెప్పగలరా?",35
2334,నేను ఉపసంహరణ కోసం వేచి ఉన్నాను.,46
2335,నా కరెన్సీ రేటు సరిగ్గా లేదు.,17
2336,నేను కార్డ్‌కి డబ్బు జోడించాను కానీ లావాదేవీ జరగలేదు,47
2337,ఈ కార్డ్‌ని ఏ వ్యాపారాలు అంగీకరిస్తాయి?,10
2338,టాప్ అప్ చేయడానికి చెక్‌ని ఉపయోగించడం ఏమైనా ఉందా?,58
2339,దయచేసి నేను కలిగి ఉండగల కరెన్సీ రకాలను నాకు చెప్పండి.,36
2340,నా ఖాతాను టాప్ అప్ చేయడానికి నేను చెక్ పంపుతాను,58
2341,నా టాప్ అప్ తిరిగి వెనక్కి రావడానికి కారణం ఏమిటి?,61
2342,నా ఇన్ కంట్రీ బదిలీ ఇంకా ఎందుకు జరగలేదు? నేను రెండు రోజుల క్రితం ఖాతా సమాచారాన్ని ధృవీకరించాను కానీ చెల్లింపు ఇంకా పోస్ట్ చేయబడలేదు.,66
2343,నా చెల్లింపు అనేక సార్లు తిరస్కరించబడింది. మీరు నాకు సహాయం చేయగలరా?,25
2344,దయచేసి నా టాప్ అప్ కార్డ్‌ని ఎలా వెరిఫై చేయాలో చెప్పండి.,71
2345,గడువు ముగిసేలోపు నాకు కొత్త కార్డ్ కావాలి.,9
2346,"నా కార్డ్ చెల్లింపు తిరస్కరించబడింది, ఎందుకో తెలుసా?",25
2347,నేను కొన్ని లావాదేవీలను గుర్తించలేదు. ఇంకెవరైనా వాడుతున్నారా?,22
2348,నేను Apple Payతో నా అమెరికన్ ఎక్స్‌ప్రెస్ కార్డ్‌ని ఉపయోగించవచ్చా?,2
2349,నా కార్డ్ చెల్లింపు తిరిగి మార్చబడి ఉండవచ్చు.,53
2350,నేను $100 అభ్యర్థించాను కానీ $20 మాత్రమే వచ్చింది,75
2351,నా కార్డ్ చెల్లింపులో ఉన్న మార్పిడి రేటు తప్పు,17
2352,"నేను చెక్కు రూపంలో డబ్బును నా ఖాతాలో వేసుకున్నాను, కానీ నా బ్యాలెన్స్ మారలేదు.",6
2353,నా కార్డ్ చెల్లింపు ఎందుకు రద్దు చేయబడుతుంది?,53
2354,మార్పిడి రేటు చెడ్డది. ఇది మార్పిడి రేటు అని మీరు ఖచ్చితంగా అనుకుంటున్నారా?,17
2355,నేను ప్రయాణిస్తున్నప్పుడు నా కార్డ్‌కి రీఫిల్‌లను ఎలా పొందగలను?,4
2356,నేను ఈ యాప్‌తో కరెన్సీలను ఎలా మార్పిడి చేసుకోగలను?,33
2357,"ATM నేను అడిగినంత ఇవ్వలేదు, కానీ నా బ్యాలెన్స్ అది చెప్పింది",75
2358,నాకు ATM ఫీజులు ఎందుకు వసూలు చేస్తున్నారు?,19
2359,నేను బ్యాంక్ బ్రాంచ్‌కి వెళ్లకుండానే నా పిన్‌ను మార్చవచ్చా?,21
2360,"కొత్త కస్టమర్ మరియు ఈరోజు మొదటిసారి గ్యాస్ నింపడం, పని చేయడం లేదు,",47
2361,నా గుర్తింపును ధృవీకరించడానికి నాకు ఏమి అవసరం?,69
2362,UK వెలుపల కార్డు పొందడం సాధ్యమేనా?,24
2363,నేను నా ఇతర బ్యాంక్ ఖాతా నుండి ఈ ఖాతాలోకి డబ్బును బదిలీ చేయాలి.,65
2364,USలో ఎవరైనా కార్డు కలిగి ఉండగలరా?,24
2365,నా ఖాతాలోని నిధులకు సంబంధించిన మూలాలు ఏమిటి?,70
2366,"నేను యూరప్ నుండి బదిలీ చేయవలసి ఉంది, దీనికి ఎన్ని రోజులు పడుతుంది?",67
2367,ATMలో నా క్రెడిట్ కార్డ్ పోయింది!,18
2368,మీకు ఏవైనా టాప్-అప్ పరిమితులు ఉన్నాయా?,60
2369,"నేను డబ్బు బదిలీ చేయడానికి ప్రయత్నించాను, కానీ అది జరగలేదు",35
2370,నా లావాదేవీ ఇంకా నా స్నేహితుడికి ఎందుకు చేరలేదు?,66
2371,"నేను వారి నుండి ఏదైనా కొనుగోలు చేసి, వెంటనే వారికి డబ్బు పంపినట్లయితే, విక్రేత EU బదిలీని స్వీకరించడానికి ఎంత సమయం పడుతుంది?",48
2372,మీరు EUలో వ్యాపారం చేస్తున్నారా?,24
2373,నా ఖాతాకు డబ్బు జోడించినందుకు మీరు అమెరికన్ ఎక్స్‌ప్రెస్‌ని ఎందుకు అంగీకరించరు,54
2374,దయచేసి నా స్నేహితుడు నాకు డబ్బు ఎలా పంపగలడో నాకు చూపించు.,50
2375,నేను నకిలీ చెల్లింపును చూస్తున్నాను.,63
2376,"అంతర్జాతీయ బదిలీ చేయడానికి సాధారణ సమయం ఎంత? నేను కొన్ని రోజుల క్రితం తయారు చేసాను, అది ఇంకా రాలేదు.",5
2377,మరిన్ని కార్డ్‌లను పంపినందుకు నాకు ఛార్జీ విధించబడుతుందో లేదో దయచేసి నాకు చెప్పండి?,39
2378,అంతర్జాతీయ ATMలను ఉపయోగించడం వల్ల మారకపు రేటు దెబ్బతింటుంది.,76
2379,యాప్‌లో నేను ప్రామాణీకరించని చెల్లింపు ఉంది.,16
2380,ATM ఫీజులు ఉన్నాయా?,19
2381,యాప్‌లో డైరెక్ట్ డెబిట్ కనిపిస్తుంది కానీ నేను దానికి అధికారం ఇవ్వలేదు.,28
2382,"నేను ఈ స్థలంలో ఒక లావాదేవీని మాత్రమే చేసాను, కానీ అది చాలాసార్లు కనిపిస్తుంది.",63
2383,నా బదిలీ సాధ్యం కాదని నా స్క్రీన్‌పై ఎందుకు సందేశం వస్తుందో ఎవరైనా వివరించగలరా? నేను గతంలో చాలా చేసాను మరియు ఇప్పటి వరకు ఒక్క సమస్య కూడా లేదు. ఏం జరుగుతోంది?,7
2384,"బదిలీలు ఉచితం అని నాకు తెలియజేసారు. నాకు రుసుము ఉందని నేను గమనించాను, కానీ ఎందుకు?",64
2385,Google Pay పని చేయడం లేదు. తప్పు ఏమిటి?,2
2386,మీరు బదిలీల కోసం ఎందుకు వసూలు చేస్తారు?,56
2387,ఈ కార్డ్ కోసం యాక్టివేషన్ పద్ధతిని వివరించండి,0
2388,నా కార్డ్ త్వరలో కావాలి,12
2389,నేను గుర్తించని పేరుతో కార్డ్ చెల్లింపు ఉంది,16
2390,నేను డెబిట్ కార్డ్‌తో టాప్ ఆఫ్ చేయవచ్చా?,54
2391,"నేను నా టాప్-అప్ కార్డ్‌ని ధృవీకరించడానికి ప్రయత్నిస్తున్నాను, కానీ నాకు కోడ్ కనిపించడం లేదు...?",71
2392,డిస్పోజబుల్ కార్డుల తయారీకి పరిమితి ఉందా?,29
2393,నేను చెక్‌తో టాప్ అప్ చేయాలనుకుంటున్నాను,58
2394,UK వెలుపల కార్డు పొందడానికి ఏదైనా అవకాశం ఉందా?,24
2395,నేను ఇటీవల పూర్తి చేసిన వాపసు కోసం నాకు వాపసు కనిపించడం లేదు.,51
2396,నాకు వేరొక కరెన్సీలో నా జీతం అవసరమైతే?,50
