text,category
@nikesupport నేను గత వారం కొన్న కొన్ని షూలకు సంబంధించి నాకు కొంత సహాయం కావాలి,social_post
@realdonaldtrump ట్విట్టర్‌లో ఏదైనా కొత్తగా పోస్ట్ చేసారా,social_query
@wendys వారి ఉత్పత్తి నాకు నచ్చలేదని ట్వీట్ చేయండి,social_post
@కస్యూమర్ సర్వీస్‌కి నా ఫిర్యాదుని ట్వీట్ చేయండి,social_post
16 యొక్క మూలం ఏమిటి,qa_maths
4 యొక్క వర్గము ఏమిటి,qa_maths
abc ముగింపు ధర ఎంత,qa_stock
నా ఖాతాలో abc కంపెనీ సంతృప్తి చెందని విధంగా చాలా చెడ్డ ఫాలోఅప్‌ని పోస్ట్ చేయండి,social_post
దయచేసి applebee's వద్ద స్లో సర్వీస్ గురించి ఫిర్యాదును ట్వీట్ చేయండి,social_post
arby's do takeaway,takeaway_query
bde ఖర్చు ఎంత,qa_stock
bejeweled అప్ ప్రారంభించండి,play_game
cnn,news_query
cnn న్యూస్ ఫేస్‌బుక్ పేజీలో ఏవైనా స్టేటస్ అప్‌డేట్‌లు ఉన్నాయా,news_query
cnn వెబ్‌సైట్‌లోని వార్తా కథనాలు ఏమిటి,news_query
cnnలో ఇటీవలి ముఖ్యాంశాలు ఏమిటి,news_query
cnn ప్రపంచ వార్తలు,news_query
cnn ముఖ్యాంశాలు,news_query
cnn యాప్ తెరవండి,news_query
cpuని నిర్వచించండి,qa_definition
cvs ఫార్మసీకి ట్విట్టర్ ద్వారా ఫిర్యాదును పోస్ట్ చేయండి,social_post
czk మరియు యూరో మధ్య మారకం రేటు ఎంత,qa_currency
czk మరియు డాలర్ మధ్య మారకం రేటును నాకు చూపించు,qa_currency
డాన్విల్లే ఇల్ యొక్క ప్రస్తుత వాతావరణం నాకు చెప్పండి,weather_query
డెయా గువామ్ ప్రిస్క్రిప్షన్ డ్రగ్ దుర్వినియోగం పెరుగుతోంది,news_query
dominos డెలివరీ ఎంపికను కలిగి ఉంది,takeaway_query
dvrలో నా సినిమాల ప్లేజాబితాలో ఏమున్నది,lists_query
emily rosser కోసం erosser@hotmail డాట్ కామ్‌ని కొత్త పరిచయంగా జోడించండి,email_addcontact
est చేయడానికి తొమ్మిది am cst ఏమిటి,datetime_convert
నాకు facebook నుండి తాజా అప్‌డేట్‌లను పొందండి,social_query
facebook నుండి తాజా వార్తల ఫీడ్,social_query
facebook నుండి నేటి ముఖ్యాంశాలు ఏమిటి,social_query
facebook ప్రస్తుత స్టాక్ రేటు ఎంత,qa_stock
ఫేస్బుక్ స్థితి నవీకరణను పోస్ట్ చేయండి,social_post
fbలో ఏమి జరుగుతోంది,social_query
fb స్టాక్ ధర ఎంత,qa_stock
fb స్టాక్స్,qa_stock
స్టేషన్ fm తొంభై ఆరు పాయింట్ ఐదు వెళ్ళండి,play_radio
fmod ప్లే చేద్దాం,play_game
నాకు fondle అనే పదానికి నిర్వచనం ఇవ్వండి,qa_definition
దయచేసి fra స్టాక్ ప్రారంభ ధరను సూచించండి,qa_stock
g లో సమయం చెప్పు. m. t. అదనంగా ఐదు,datetime_convert
గ్రా రేటు ఎంత. బి. p. మీకు. లు. డి.,qa_currency
మార్చండి g. m. t. ist,datetime_convert
ప్రస్తుతం ge ధర ఎంత,qa_stock
google uber,transport_taxi
గూగుల్ కోసం నేటి ముగింపు ధర,qa_stock
Google కోసం ప్రస్తుత స్టాక్ ధరలు ఏమిటి,qa_stock
గూగుల్ ఓపెన్ లిస్ట్‌ను ట్రాష్ చేయండి,lists_remove
గూగుల్ స్టాక్ చిహ్నం,qa_stock
grubhub నుండి ఆహార ఆర్డర్,takeaway_order
grubhub ఆర్డర్,takeaway_order
"grubhub యాప్‌ని తెరవండి, తద్వారా నేను టేక్ అవుట్‌ని ఆర్డర్ చేయగలను",takeaway_order
hdfc స్టాక్ ధర ఎంత,qa_stock
hdfc స్టాక్ ధరను పేర్కొనండి,qa_stock
hdfc స్టాక్ ధరను చూడండి,qa_stock
hp కంపెనీ స్టాక్ ఎంత,qa_stock
I ఇరవై ఐదులో ట్రాఫిక్ ఎలా ఉంది,transport_traffic
I నలభైలో లక్ష్యానికి దిశలు,transport_query
దయచేసి నాకు i95 sb కోసం రహదారి సూచన ఇవ్వండి,transport_traffic
iamironman@gmail డాట్ కామ్ ఇమెయిల్ చిరునామాను జోడించండి,email_addcontact
inchoate యొక్క నిర్వచనం ఏమిటి,qa_definition
inr లో డాలర్ ధర ఎంత,qa_currency
inr మరియు u మార్పిడి రేట్లు. లు. డి.,qa_currency
instagramని తనిఖీ చేయండి,social_query
iphone,news_query
iphone గురించిన తాజా వార్తల కోసం శోధించండి,news_query
jcpenneyకి బదులుగా వాటిని షట్ డౌన్ చేయాలని macy's కి చెప్పే ట్వీట్ వ్రాయండి,social_post
జెన్ కె ఏరియా కోడ్ చెప్పండి,email_querycontact
jlo ఫ్యాన్ అప్‌డేట్‌లు,general_quirky
joanne@aol డాట్ కామ్‌కి ఇమెయిల్ పంపండి మరియు కొత్త పరిచయంగా జోడించండి,email_sendemail
juanpedro@gmail డాట్ కామ్‌కి ఇమెయిల్ పంపండి,email_sendemail
kfi నాకు ఇష్టమైన రాపర్,music_likeness
koc వద్ద ట్వీట్ చేయండి మీ నిరీక్షణ సమయం ఇబ్బందికరంగా ఉంది,social_post
చిక్కైన పదానికి అర్థం ఏమిటి,qa_definition
lechateauకి డెలివరీ సేవ ఉందా లేదా టేక్‌అవే మాత్రమే ఉందా,takeaway_query
lindafancy55@gmail డాట్ కామ్,email_sendemail
marissaకు ఇమెయిల్ పంపండి,email_sendemail
"నేను mcd వద్ద చేసిన ఆర్డర్‌ని రద్దు చేసాను, అది జరిగిందా",takeaway_query
mcdoకి దిశలు,transport_query
mi నుండి నేటి పోడ్‌కాస్ట్ ప్లే చేయండి,play_podcasts
దయచేసి mongomery llc కంపెనీ యొక్క సంప్రదింపు వివరాలను తనిఖీ చేసి నాకు చెప్పండి,email_querycontact
దయచేసి నేను mrjimతో చేసిన అపాయింట్‌మెంట్‌ను తీసివేయండి,calendar_remove
msnbcలో ఇటీవలి వార్తల కోసం తనిఖీ చేయండి,news_query
nba ఛాంపియన్‌షిప్‌ను ఎవరు గెలుచుకోబోతున్నారో దయచేసి నాకు చెప్పండి,general_quirky
నేను nbc వార్తల నుండి తాజా విషయాలను తెలుసుకోవాలనుకుంటున్నాను,news_query
newmail@gmail డాట్ కామ్‌కి ఇమెయిల్ పంపండి,email_sendemail
nflలో పాడ్‌కాస్ట్‌లను ప్రారంభించండి,play_podcasts
npr ted చర్చలు,play_podcasts
ny లో నేటి ఈవెంట్‌లను చూపించు,recommendation_events
ny లో ఏమి జరుగుతోంది,recommendation_events
ny లో కిడ్నాప్ గురించి తాజా వార్తా నివేదికను పొందండి,news_query
ny కి రైళ్లు మరియు సమయం చూపండి,transport_query
ny మార్కెట్‌లో మంచు స్టాక్ ధర ఎంత ఉందో దయచేసి నాకు చెప్పండి,qa_stock
nyt పోడ్‌కాస్ట్ తదుపరి ఎపిసోడ్,play_podcasts
నేను ola మరియు uber యొక్క స్టాక్ రేట్ జాబితాను కలిగి ఉండగలనా?,qa_stock
ఒల్లీ అంతే ఉంటుంది.,general_commandstop
"olly అది సరిపోతుంది, రద్దు చేయండి.",general_commandstop
ఒల్లీ నాకు లివింగ్ రూమ్ వాక్యూమ్ కావాలి మీరు వాక్యూమ్ క్లీనర్ ఆన్ చేయగలరా,iot_cleaning
ఓలీ నా అలారం ఒక గంటలో ఆఫ్ అయ్యేలా సెట్ చేసాను,alarm_set
ఒల్లీ దయచేసి ఆపివేయండి.,general_commandstop
దయచేసి మీరు మూసివేయగలరు.,general_commandstop
olly దయచేసి మీరు షట్ డౌన్ చేయగలరా.,general_commandstop
దయచేసి మీరు షట్ డౌన్ చేస్తారా.,general_commandstop
olly మీరు దయచేసి మూసివేయండి.,general_commandstop
ఒల్లీ దయచేసి ఆపివేయండి.,general_commandstop
olly దయచేసి షట్ డౌన్ చేయండి.,general_commandstop
దయచేసి మీరు మూసివేస్తారా?,general_commandstop
దయచేసి మీరు రద్దు చేయగలరు.,general_commandstop
దయచేసి మీరు రద్దు చేయగలరు.,general_commandstop
దయచేసి మీరు రద్దు చేయగలరు.,general_commandstop
olly దయచేసి మీరు రద్దు చేయగలరు.,general_commandstop
olly నేను జాక్ కాదు jake అని చెప్పాను.,general_negate
ఒల్లీ నువ్వు ఆపివేయగలవా.,general_commandstop
ఒల్లీ మీరు మూసివేయవచ్చు.,general_commandstop
olly మీరు మూసివేయవచ్చు.,general_commandstop
olly మీరు మూసివేస్తారా.,general_commandstop
olly షట్ డౌన్.,general_commandstop
ఒల్లీ యోగా అలారాలను రద్దు చేయండి,alarm_remove
olly లైట్లు ప్రకాశవంతం,iot_hue_lightup
పానాసోనిక్ కోసం నేటి మార్కెట్ ట్రెండ్‌లను నాకు అందించండి,qa_stock
పావెల్ జాన్‌తో సమావేశాన్ని సిద్ధం చేశాడు,calendar_query
pda అంటే ఏమిటి,qa_definition
pdr amని ఆన్ చేయండి,play_radio
pf మార్పులు టేకౌట్ ఆర్డర్‌లను అంగీకరిస్తాయా?,takeaway_query
"పిజ్జా హట్‌కి కాల్ చేసి, నా ఆర్డర్ సిద్ధంగా ఉందో లేదో తెలుసుకోండి",takeaway_query
నాకు pstలో సమయం ఇవ్వండి,datetime_query
qerwerq@hotmail డాట్ కామ్‌కి ఇమెయిల్ పంపండి,email_sendemail
redditలో ఏదైనా కొత్తది ఉందా?,social_query
s n ఎంత ఎత్తులో ఉంది. p,qa_stock
s n ఏమి చేసారు. p క్లోజ్ అవుట్,qa_stock
s అనే మొదటి అక్షరాలు ఉన్న sms గ్రహీతను తీసివేయండి,lists_remove
"s1, మీరు దానిపై నాకు మరింత స్పష్టత ఇవ్వగలరా.",general_explain
"s1, దాని గురించి నన్ను మరింతగా మళ్లీ వ్రాయండి.",general_explain
"s1, దీన్ని మరింత పునరావృతం చేయండి.",general_explain
"s1, మీ ప్రతిస్పందనపై మరింత వివరించండి.",general_explain
"s1, దయచేసి మీ సమాధానాలపై నాకు మరింత స్పష్టత ఇస్తా.",general_explain
"s1, దయచేసి దానిపై నన్ను మళ్లీ వ్రాయండి.",general_explain
"s1, దయచేసి నాకు దాని గురించి మరింత వివరించండి.",general_explain
"s1, దయచేసి మీరు నాకు మరింత వివరంగా చెబుతారా.",general_explain
"s1, దయచేసి మీరు ఇప్పుడే చెప్పిన దాని గురించి నాకు మళ్లీ చెప్పండి.",general_explain
"s1, దయచేసి మీరు నాతో చెప్పిన దాని గురించి మళ్లీ చెప్పగలరా.",general_explain
"s1, దయచేసి మీరు ఇప్పుడే చెప్పిన దాని గురించి మళ్ళీ నాకు వివరించండి.",general_explain
"s1, దయచేసి మీ సమాధానం గురించి నాకు మరింత వివరించండి.",general_explain
"s1, దయచేసి మీ సమాధానం గురించి నాకు మళ్ళీ వివరించండి.",general_explain
"s1, దయచేసి మీ సమాధానాలను మళ్లీ స్పష్టం చేయండి.",general_explain
"s1, దయచేసి మీ సమాధానాల గురించి మరోసారి నాకు స్పష్టం చేయండి.",general_explain
"s1, దయచేసి మీరు నాకు మళ్లీ వ్రాయగలరా.",general_explain
"s1, దయచేసి చివరి వాక్యంపై మీరు నన్ను మరింత తిరిగి వ్రాయగలరా.",general_explain
"s1, దయచేసి నాకు మరోసారి స్పష్టం చేయండి.",general_explain
"s1, దయచేసి మీరు ఇప్పుడే చెప్పిన దాని గురించి మరోసారి నాకు స్పష్టం చేయగలరా.",general_explain
"s1, మీరు ఇప్పుడే చెప్పిన దాని గురించి మరోసారి వివరిస్తారా?",general_explain
"s1, దయచేసి మీరు నాకు చెప్పిన దాని గురించి మరింత వివరించగలరు.",general_explain
"s1, దయచేసి మీరు చెప్పిన దాని గురించి నాకు మరింత వివరిస్తారా?",general_explain
"s1, మీరు మరింత వివరిస్తారా.",general_explain
"s1, దయచేసి నాకు మళ్ళీ వివరించండి.",general_explain
"s2, దీన్ని పొందలేము.",general_explain
"s2, మీ ప్రతిస్పందన గురించి నాకు అస్పష్టంగా ఉంది.",general_explain
"s2, మీ సమాధానం పొందలేదు.",general_explain
"s2, మీ సమాధానాల గురించి నాకు అస్పష్టంగా ఉంది.",general_explain
"s2, మీ మాటలు నాకు అర్థం కాలేదు.",general_explain
"s2, మీ మాటల గురించి నాకు అస్పష్టంగా ఉంది.",general_explain
"s2, నాకు అది అర్థం కాలేదు.",general_explain
"s2, నాకు అది అర్థం కాలేదు.",general_explain
"s2, నేను దానిని పట్టుకోలేను.",general_explain
"s2, నేను దానిని పొందలేకపోయాను.",general_explain
"s2, నేను మీతో అంతగా చేరుకోలేకపోయాను.",general_explain
"s2, నేను నిన్ను కలుసుకోలేను.",general_explain
"s2, నేను మిమ్మల్ని కలుసుకోలేకపోయాను.",general_explain
"s2, చివరి వాక్యాన్ని పొందవద్దు.",general_explain
"s2, చివరి వాక్యం స్పష్టంగా లేదు.",general_explain
"s2, నేను దాని గురించి స్పష్టంగా తెలియలేదు.",general_explain
"s2, దాని గురించి నాకు స్పష్టంగా తెలియదు.",general_explain
"s2, దాని గురించి నాకు అస్పష్టంగా ఉంది.",general_explain
"s2, మీరు ఇప్పుడు చెప్పిన దాని గురించి నాకు అంత స్పష్టంగా తెలియలేదు.",general_explain
"s2, మీరు ఇప్పుడే చెప్పిన దాని గురించి నాకు స్పష్టంగా తెలియలేదు.",general_explain
"s2, మీరు చెప్పినది పొందలేకపోయాము.",general_explain
samuelwaters@hotmail డాట్ కామ్ కోసం ఇమెయిల్ పంపండి మరియు సంప్రదింపు సమాచారాన్ని సేవ్ చేయండి,email_addcontact
shazam ఈ సంగీతం,music_settings
సిరి ఓపెన్ ట్విట్టర్ ట్వీట్ @potus సక్స్,social_post
స్నాప్చాట్,social_post
స్నాప్‌చాట్‌లో ఏదైనా కొత్తది ఉందా,social_query
స్టార్‌బక్స్ కోసం ఫిర్యాదు వెబ్‌సైట్‌ను పైకి లాగండి,social_post
స్వాత్ మంచి సినిమా,recommendation_movies
Telugu,category
Turiellos పిజ్జా నుండి సాధారణ ఆర్డర్ చేయండి,takeaway_order
u మధ్య మారకం రేటు ఎంత. లు. డి. మరియు inr,qa_currency
u మధ్య మారకం రేటు ఎంత. లు. డి. మరియు క్యాడ్,qa_currency
u మధ్య మారకం రేటు ఎంత. లు. డి. మరియు యూరో,qa_currency
u మధ్య రేటు ఎంత. లు. డి. మరియు ఉక్రెయిన్ కరెన్సీ,qa_currency
u లో రెండు వేల యెన్ ఎంత. లు. డి.,qa_currency
u యొక్క మార్పిడి రేటును చూపు. లు. డి. మరియు యూరో,qa_currency
u మార్పిడి రేటు ఎంత. లు. డి. cdn కు,qa_currency
u యొక్క కరెన్సీ మార్పిడి. లు. డి. మరియు eur,qa_currency
u. లు. డి. ఇప్పుడు స్థానం,qa_currency
u. లు. డి. యెన్ కు,qa_currency
ఉబర్ ఈట్స్‌లో ఆఫర్‌లు ఏమిటి,takeaway_order
uberలో టాక్సీ బుకింగ్ చేయండి,transport_taxi
ఉబెర్ యొక్క అద్దె క్యాబ్‌ను బుక్ చేయండి,transport_taxi
uberని ఏర్పాటు చేసింది,transport_taxi
"uber తెరిచి, పన్నెండు గంటలకు కారును బుక్ చేయండి",transport_taxi
దయచేసి uber యాప్‌ని తెరిచి నాకు కారు ఇప్పించండి,transport_taxi
"uber యాప్‌ని తెరిచి, ఎయిర్‌పోర్ట్‌లో పికప్ చేయడానికి నాకు కారును బుక్ చేయండి",transport_taxi
uber దయచేసి,transport_taxi
udrive సేవ నుండి టాక్సీని అభ్యర్థించండి,transport_taxi
uefa యూరోపియన్ ఛాంపియన్‌షిప్,general_quirky
umf వివరాలు ఏమిటి,general_quirky
umf గురించి ప్రతిదీ చెప్పు,general_quirky
USA నేటి ముఖ్యాంశాలు,news_query
wfrn తొంభై తొమ్మిది పాయింట్ వన్ ఆన్ చేయండి,play_radio
wgrr నూట మూడు పాయింట్ల ఐదు వింటాం,play_radio
ఇది wolfram alpha వంటి శోధన ఫలితాల నుండి సమాధానాన్ని గణించగలదని నేను కోరుకుంటున్నాను,general_quirky
x యొక్క కారకం ఏమిటి,qa_maths
x ప్లస్ రెండు ఐదుకి సమానం అయితే x విలువ ఎంత,qa_maths
xmtuneలో ప్రోగ్రామ్‌ను మార్చండి,play_radio
దయచేసి xyz@gmail డాట్ కామ్‌కి బదులుగా abc@gmail డాట్ కామ్‌కి ఇమెయిల్ పంపండి,email_sendemail
ymca క్యూలో నిలబడండి,play_music
యప్సిలాంటి దగ్గర ట్రాఫిక్ ఎలా ఉంది,transport_traffic
పరిసరాల చుట్టూ ఏమి జరుగుతోంది,recommendation_events
అక్టోబరులో చదవడానికి వేట విందాము,play_audiobook
అక్రోన్‌లో సమయం ఎంత,datetime_query
మోనెట్ ఎగ్జిబిషన్ ఎక్కడ జరుగుతుంది,recommendation_locations
ఇక్కడ మరియు అక్కడ మధ్య సమయం తేడా ఏమిటి,datetime_convert
"అయ్యో, అది సరైన ప్రతిస్పందన కాదు.",general_negate
"అయ్యో, ఇది సరైన ప్రతిస్పందన కాదని నేను భావిస్తున్నాను.",general_negate
"అయ్యో, మీరు నన్ను అర్థం చేసుకోలేదని నేను అనుకుంటున్నాను.",general_negate
"అయ్యో, మీరు నన్ను అర్థం చేసుకోలేదు.",general_negate
"అయ్యో, మీరు తప్పుగా ఉన్నారు.",general_negate
దయచేసి జిప్ కోడ్ ఇరవై తొమ్మిది వేల తొమ్మిది వందల డెబ్బై ఎనిమిది కోసం ఈ వారం వర్షం పడే అవకాశాలను నాకు తెలియజేయండి,weather_query
మెయిల్‌లను తనిఖీ చేయండి,email_query
"డామిట్, ఇది నేను ఇప్పుడే చెప్పింది కాదు.",general_negate
"పాడు, సరైన స్పందన లేదు.",general_negate
"డామిట్, నేను తప్పు స్పందన అనుకుంటున్నాను.",general_negate
"డామిట్, అది నేను చెప్పింది కాదు.",general_negate
"డామిట్, అది నా ఉద్దేశ్యం కాదు.",general_negate
"డామిట్, నేను వెతుకుతున్నది అది కాదు.",general_negate
అడెలె పాటపై నా అభిప్రాయాన్ని సేవ్ చేయండి,music_likeness
అడిలె ద్వారా పాటలు ప్లే చేయండి,play_music
