text,category
మీరు నా కోసం అలారం ఆఫ్ చేస్తారా,alarm_remove
నా కోసం సంఖ్యల జాబితాను రూపొందించండి,lists_createoradd
నా కోసం కాంతిని తిరిగి పొందండి,iot_hue_lightup
దయచేసి నా కోసం చివరి ఇమెయిల్ చదవండి,email_query
నా కోసం కుక్కల జాబితాను తొలగించు,lists_remove
నా కోసం వర్క్‌హౌస్‌ను వివరించండి,qa_definition
మీరు నా ఇమెయిల్‌లను తనిఖీ చేస్తారా,email_query
మీరు నా కోసం రైలు టిక్కెట్ ధరలను చూడగలరా?,transport_query
నా కోసం వాక్యూమ్‌ని ప్రారంభించండి,iot_cleaning
మీరు నా కోసం జాన్ యొక్క ఇమెయిల్ చిరునామాను పొందగలరా?,email_querycontact
నాకు అధిక వాల్యూమ్ కావాలి,audio_volume_up
నాకు మరింత కాంతి కావాలి,iot_hue_lightup
నాకు మరింత కాంతి కావాలి,iot_hue_lightup
నాకు అది అంతగా పట్టలేదు.,general_explain
నాకు అది అంతగా అర్థం కాలేదు.,general_explain
నాకు అది పట్టలేదు.,general_explain
నాకు అది అర్థం కాలేదు.,general_explain
దాని గురించి నాకు అంత స్పష్టత లేదు.,general_explain
నేను ఆ పాటను ప్రేమిస్తున్నాను,music_likeness
నాకు ఆ పాట నచ్చిందని గుర్తు చేయండి,music_likeness
నాకు పాన్‌కేక్‌లు చూపించు,cooking_recipe
నాకు అమెజాన్ రెస్టారెంట్‌లను గుర్తించండి,recommendation_locations
నాకు దగ్గరగా టాక్సీ సేవను కనుగొనండి,transport_taxi
నాకు సమీపంలోని స్థానిక సంఘటనలను చూపించు,recommendation_events
గ్లూటెన్ ఫ్రీ బ్రెడ్‌పై నా దగ్గర ఉన్న సూపర్‌మార్కెట్‌లో ఏది ఉత్తమ ధర ఉందో తెలుసుకోవాలనుకుంటున్నాను,recommendation_locations
నాకు సమీపంలో ఉన్న టాప్ రెస్టారెంట్‌ని చెక్అవుట్ చేసి షాహి పన్నర్‌ని ఆర్డర్ చేయండి,takeaway_order
నాకు సమీపంలోని ఉత్తమ సర్కస్ గురించి తెలియజేయండి,recommendation_events
నాకు సమీపంలోని సబ్‌వే ఫుడ్ సెంటర్‌ని చెక్అవుట్ చేయండి మరియు తందూరి రోటీని ఆర్డర్ చేయండి,takeaway_order
నాకు సమీపంలోని డొమినో సెంటర్‌ని చెక్అవుట్ చేసి చీజ్ పిజ్జా ఆర్డర్ చేయండి,takeaway_order
మీరు నాకు సమీపంలోని థియేటర్‌లో చూడటానికి కొన్ని సినిమాలను సిఫార్సు చేయగలరు,recommendation_movies
నాకు సమీపంలోని థియేటర్లలో ఏ సినిమాలు ఆడుతున్నాయి,recommendation_movies
నాకు సమీపంలోని వారంవారీ వాతావరణాన్ని తెలియజేయండి,weather_query
నాకు సమీపంలో ఉన్న అత్యధిక రేటింగ్ పొందిన చైనీస్ క్యారీఅవుట్ కోసం మీరు నన్ను మెనూకి మళ్లించగలరా?,takeaway_order
నాకు సమీపంలో ఉన్న దుకాణాలను జాబితా చేయండి,recommendation_locations
దయచేసి నాకు సమీపంలో ఉన్న ఉత్తమ బట్టల దుకాణాలను జాబితా చేయండి,recommendation_locations
డెలివరీ చేసే నా దగ్గర ఉన్న బెస్ట్ పిజ్జా ఏది,takeaway_order
నాకు దగ్గరగా ఉన్న సుషీ కావాలి,recommendation_locations
నా దగ్గర అందుబాటులో ఉన్న టాక్సీని బుక్ చేయండి,transport_taxi
నాకు సమీపంలోని థియేటర్లలో ఉత్తమ imdb రేటింగ్‌లు ఉన్న సినిమాని చెప్పండి,recommendation_movies
నాకు సమీపంలోని థియేటర్లు,recommendation_movies
దయచేసి నాకు సమీపంలోని బట్టల దుకాణాలను చూడండి,recommendation_locations
నాకు దగ్గరగా ఉన్న లైట్‌ను ఆఫ్ చేయండి,iot_hue_lightoff
నా దగ్గర ఏ సంఘటనలు జరుగుతున్నాయి,recommendation_events
మీరు నాకు పొరుగున ఉన్న వీధి ప్రదర్శనను కనుగొనగలరా?,recommendation_events
నా దగ్గర వాకింగ్ ట్రైల్ ఎక్కడ ఉంది,recommendation_locations
నా దగ్గర మంచి వైన్ బార్ ఎక్కడ ఉంది,recommendation_locations
మీరు నాకు సమీపంలోని ఫర్నిచర్ దుకాణాన్ని కనుగొనగలరా?,recommendation_locations
నా దగ్గర ఉన్న చైనీస్ ఫుడ్ చూపించు,takeaway_order
నాకు దగ్గర డెలివరీ చూపించు,takeaway_order
నా దగ్గర ఉన్న థాయ్ ఫుడ్ చూపించు,recommendation_locations
నా దగ్గర గ్లూటెన్ ఫ్రీ బేకరీని కనుగొనండి,recommendation_locations
నాకు సమీపంలో పిజ్జా డెలివరీ ఉన్న స్థలాలు,takeaway_order
నా దగ్గర ట్రాఫిక్ ఎలా ఉంది,transport_traffic
నాకు ఎలాంటి అలారాలు అక్కర్లేదు,alarm_remove
నాకు ఆర్ ఎన్ బి అంటే ఇష్టం,music_likeness
నాకు సంగీతం ఇష్టం,music_likeness
నాకు ఇది అర్థం కాలేదు.,general_explain
నాకు ఈ ప్రశ్న అర్థం కాలేదు కానీ అందులో ఎలా ఉంది,general_quirky
నాకు ఈ పాట ఇష్టము,music_likeness
నేను ఈ వారం సెలవులో ఉన్నాను,calendar_query
"నాకు ఈ లైట్ నచ్చలేదు, దయచేసి నాకు ఇతర ఎంపికలను చూపించు",iot_hue_lightchange
నాకు ఇప్పుడు కాఫీ కావాలి,iot_coffee
నాకు ఇప్పుడు టాక్సీ ప్రయాణం కావాలి,transport_taxi
నాకు ప్రస్తుతం టాక్సీ అవసరం,transport_taxi
నా కోసం ఇప్పుడు కాపుచినో ప్రారంభించండి,iot_coffee
నాకు ఇప్పుడు కాఫీ ఇష్టం,iot_coffee
నాకు ఇప్పుడు స్మార్ట్ సాకెట్ ఆఫ్ కావాలి,iot_wemo_off
నాకు మెషిన్ నుండి కాఫీ కావాలి,iot_coffee
నాకు రెండు బర్గర్లు కావాలి మరియు ఒక కోక్ త్వరగా ఆర్డర్ చేయండి,takeaway_order
నాకు రెండు పిజ్జాలు స్టాట్ కావాలి,takeaway_order
నా కోసం రెండు హాంబర్గర్‌లను ఆర్డర్ చేయి,takeaway_order
మీరు నాకు రాత్రి భోజనం చేయగలరా,general_quirky
ఈ రోజు నాకు తేలికపాటి లేదా భారీ జాకెట్ అవసరమా?,weather_query
నాకు ఈ రోజు నా టోపీ కావాలి,weather_query
ఈరోజు నాకు గొడుగు కావాలి,weather_query
నాకు ఈరోజు డాక్టర్ అపాయింట్‌మెంట్ ఉందా?,calendar_query
నాకు ఈరోజు బూట్లు అవసరమా,weather_query
నాకు ఈరోజు మధ్యాహ్నం మీటింగ్ ఉంది,calendar_set
నాకు ఈరోజు ముగ్గురికి అలారం కావాలి,alarm_set
నాకు ఈరోజు సేల్స్ మీటింగ్ ఉందా,calendar_query
నాకు మరికొన్ని లైట్లు కావాలి,iot_hue_lightup
"నాకు పది నిమిషాల్లో నా ఫిల్టర్ కాఫీ కావాలి, దయచేసి కాఫీ తయారీదారుని అడగండి",iot_coffee
నాకు మరింత పాలు కావాలి,lists_createoradd
నాకు ఆహారం తీసుకురండి,takeaway_order
నేను నిజంగా స్కా సంగీతం,music_likeness
"నాకు నిజంగా తెలియదు, ఒల్లీ.",general_dontcare
"నాకు నిజంగా తెలియదు, ఒల్లీ.",general_dontcare
నేను ఉత్సాహంగా ఉన్నప్పుడు ఆ పాటను ఉంచు,music_likeness
నాకు పర్పుల్ లైట్లు కావాలి,iot_hue_lightchange
నాకు టేక్‌అవే ఫుడ్ తీసుకురండి,takeaway_order
నేను దేని గురించి పట్టించుకోను.,general_dontcare
"నా నైపుణ్యం స్థాయికి అనుగుణంగా నాకు వ్యతిరేకంగా తొమ్మిది బంతులు ఆడుదాం, ఎల్లప్పుడూ నన్ను గెలవనివ్వండి",play_game
నాకు వ్యతిరేకంగా ఓపెన్ చెస్ ప్లే,play_game
"నాకు ఏది మంచిది, ఒల్లీ.",general_dontcare
నాకు ఏది బాగానే ఉంటుంది.,general_dontcare
నాకు ఏమైనా సరే.,general_dontcare
నాకు ఏది సరే.,general_dontcare
నాకు ఏది సరే.,general_dontcare
నాకు ఏది సరే.,general_dontcare
నాకు ఏదైనా సరే.,general_dontcare
నాకు ఏదైనా సరే.,general_dontcare
నాకు ఏదైనా సరే.,general_dontcare
నాతో ఏదైనా సరే.,general_dontcare
నాకు ఏదైనా సరే.,general_dontcare
"నాకు తెలియదు, ఒల్లీ.",general_dontcare
నాతో ఏదైనా బాగానే ఉంటుంది.,general_dontcare
నాకు ఎలాంటి సంగీతం ఇష్టం అని మీరు అనుకుంటున్నారు,music_query
నాకు అన్ని జాజ్ సంగీతాన్ని ప్లే చేయండి,play_music
ఎవరు నాకు వ్రాసారు లేదా సోషల్ మీడియాలో నన్ను ప్రస్తావించారు,social_query
నా కోసం ఏ అలారాలు సెట్ చేసారో చెప్పండి,alarm_query
నాకు ఎలాంటి అలారాలు ఉన్నాయి,alarm_query
"నాకు ఏమి చేయాలో తెలియదు, ఒల్లీ.",general_dontcare
"నాకు ఏది మంచిది, ఒల్లీ.",general_dontcare
నాకు ఏవైనా అపాయింట్‌మెంట్‌లు రాబోతున్నాయా?,calendar_query
ఏదైనా సోషల్ మీడియాలో నాకు ప్రైవేట్ సందేశాలు ఉన్నాయా?,social_query
నా కోసం ఏదైనా కొత్త మెయిల్ ఉందా,email_query
నాకు ఏవైనా కొత్త ఫ్రెండ్ రిక్వెస్ట్‌లు ఉన్నాయా,social_query
నాకు ఏదైనా కొత్త ఇమెయిల్ వచ్చిందా,email_query
నాకు ఏదైనా కొత్త ఇమెయిల్ వచ్చిందో లేదో చూడాలి,email_query
నా కోసం ఏవైనా కొత్త ఇమెయిల్‌లు,email_query
నాకు ఏవైనా కొత్త ఇమెయిల్‌లు వచ్చాయా?,email_query
నాకు ఏవైనా ఇమెయిల్‌లు పంపాను,email_query
నాకు అలారం కావాలి,alarm_set
నాకు విరామం కావాలి ఐదు నిమిషాల తర్వాత దాన్ని ప్రారంభించండి,play_audiobook
నాకు లోకల్ రెస్టారెంట్ పెట్టండి,recommendation_locations
నాకు ఒక కప్పు కాఫీ ఇవ్వు,iot_coffee
మీరు నాకు ఒక కప్పు కాఫీ చేయగలరా,iot_coffee
నాకు ఒక కప్పు కాఫీ కావాలి,iot_coffee
నాకు ఒక కప్పు కాఫీ కావాలి,iot_coffee
నాకు ఒక కప్పు కాఫీ కావాలి,iot_coffee
దయచేసి నాకు ఒక కప్పు కాఫీ కావాలి,iot_coffee
సాల్టెడ్ కార్మెల్ ఫ్లేవర్డ్ క్రీమ్‌తో నాకు ఒక కప్పు కాఫీ తయారు చేయి,iot_coffee
నాకు కాఫీ తీసుకురండి,iot_coffee
నాకు కాఫీ చేయి,iot_coffee
నాకు కాఫీ తయారు చేయి,iot_coffee
దయచేసి నాకు కాఫీ కావాలి,iot_coffee
నాకు కారు ఇప్పించండి,transport_taxi
నాకు క్లాసికల్ రేడియో స్టేషన్ ఇవ్వండి,play_radio
నాకు ఒక కప్పు కాఫీ చేయి,iot_coffee
నాకు సమావేశాన్ని గుర్తు చేయడానికి రేపు పదికి అలారం పెట్టండి,alarm_set
నాకు టాక్సీ ఉబెర్ కావాలి,transport_taxi
నాకు టాక్సీ తీసుకురండి,transport_taxi
నాకు టాక్సీ బుక్ చేయండి,transport_taxi
నాకు టాక్సీ బుక్ చేయి,transport_taxi
మీరు నాకు టాక్సీ బుక్ చేయగలరా,transport_taxi
నాకు ఒక జోక్ పంచుకోండి,general_joke
"నాకు మంచి వైన్ షాప్‌ని కనుగొనండి, అది పది సంవత్సరాల కంటే పాత పాత వైన్‌లను నిల్వ చేయి ఆ దుకాణానికి నన్ను నావిగేట్ చేయండి",general_quirky
నాకు మంచి దుకాణం కావాలి,recommendation_locations
మీరు నాకు మంచి కాఫీ తీసుకురాగలరా,iot_coffee
నాకు మంచి పిల్ల కావాలి,recommendation_movies
నాకు మంచి జోక్ కావాలి,general_joke
నాకు ఈవెంట్ ఉందని గడియారాన్ని గుర్తు చేయండి,calendar_set
నాకు ఒక రిమైండర్ అలారం కావాలి,alarm_set
నాకు చాలా కష్టమైన రోజు వచ్చింది,general_quirky
నాకు పానీయం కావాలి,iot_coffee
నాకు ఫిర్యాదు ఉంది,social_post
నాకు కొత్త లేత రంగు ఇవ్వండి,iot_hue_lightchange
నాకు కొత్త జాబితాను ప్రారంభించండి,lists_createoradd
మీరు నా కోసం ఒక కొత్త ఇమెయిల్ చిరునామాకు ఇమెయిల్ పంపగలరా,email_sendemail
నాకు కొత్త నిర్వచనం ఇవ్వండి,qa_definition
నాకు పాడ్‌కాస్ట్ ప్లే చేయి,play_podcasts
నాకు ఒక గంటలో రైడ్ కావాలి,transport_taxi
నాకు ఉబెర్ ఇవ్వండి,transport_taxi
నాకు ఉబెర్ ఇవ్వండి,transport_taxi
నాకు రోమ్ బుక్ టిక్కెట్టుకు రైలు టిక్కెట్ కావాలి,transport_ticket
నాకు క్యాబ్ బుక్ చేయి,transport_taxi
నాకు బలమైన కప్పు కాఫీని తయారు చేయి,iot_coffee
నాకు హాలిడే ట్రిప్ ప్లాన్ చేయండి,general_quirky
మీరు నా కోసం ఒక జంతు జోక్ కనుగొనగలరా?,general_joke
నాకు ఒక ఫన్నీ జోక్ చూపించు,general_joke
నాకు స్పఘెట్టి రెసిపీని చూపించు,cooking_recipe
నాకు ఒరెగాన్‌కి రైలు టిక్కెట్ కావాలి,transport_ticket
నాకు వాల్యూమ్ బిగ్గరగా ఉండాలి,audio_volume_up
నాకు ధ్వని వద్దు,audio_volume_mute
నాకు వాల్యూమ్ నిశ్శబ్దంగా ఉండాలి,audio_volume_down
నాకు చివరి వాక్యం అర్థం కాలేదు.,general_explain
నేను అందుకున్న చివరి ఇమెయిల్ ఏమిటి,email_query
నా కోసం కాలిఫోర్నియాకు రైలు టిక్కెట్టు బుక్ చేయండి,transport_ticket
నేను పట్టించుకోను.,general_dontcare
"నేను పట్టించుకోను, ఒల్లీ.",general_dontcare
నాకు కొంచెం కాఫీ ఇవ్వు,iot_coffee
నాకు కొంచెం కాఫీ ఇవ్వు,iot_coffee
నాకు కాఫీ చేయి,iot_coffee
నువ్వు నాకు కొంచెం కాఫీ తెస్తావా,iot_coffee
నాకు కాఫీ చేయడానికి కాఫీ మెషీన్‌ని ఆన్ చేయండి,iot_coffee
నాకు కాఫీ చేయి,iot_coffee
మీరు నాకు కొంచెం కాఫీ చేయగలరా,iot_coffee
నాకు కాఫీ కావాలి,iot_coffee
నాకు కాఫీ కావాలి,iot_coffee
నాకు కాఫీ కావాలి,iot_coffee
"నాకు కాఫీ కావాలి, దయచేసి వేడిగా ఉండాలి",iot_coffee
మీరు నాకు కొంచెం కాఫీని సరిచేయగలరా?,iot_coffee
నాకు ఆరు ఉదయం వేకప్ కాల్ కావాలి,alarm_set
నాకు ఉదయం వార్తలు ఇవ్వండి,news_query
నాకు గాత్రం అంటే ఇష్టం,music_likeness
నాకు కూల్డ్ కాఫీ తయారు చేయి,iot_coffee
నాకు కొంటె జోక్ అవసరం అయితే కొంటె కాదు,general_joke
నాకు తక్కువ కాంతి కావాలి,iot_hue_lightdim
నాకు కొంత సంగీతం విననివ్వండి,play_music
నాకు కొంచెం కాఫీ కావాలి,iot_coffee
దయచేసి నాకు కొంచెం కాఫీ కావాలి,iot_coffee
నాకు కొంచెం కాఫీ కావాలి,iot_coffee
నాకు కొంచెం చైనీస్ ఫుడ్ ఆర్డర్ చేయండి,takeaway_order
దయచేసి నాకు కొంత వాతావరణం కావాలి,iot_hue_lightchange
కొంత సమయం ఇవ్వండి,datetime_query
నాకు కొంచెం బోవీ ఇవ్వండి,music_query
నాకు కొంచెం మసక వెలుతురు ఇవ్వండి,iot_hue_lightdim
నాకు కొంత మెలోడీ పాటను ప్లే చేయి,play_music
నాకు ఈ మధ్య ఏదైనా ఇమెయిల్స్ వచ్చాయా,email_query
దయచేసి నా కోసం వంటగది లైట్‌ను ఆఫ్ చేయండి,iot_hue_lightoff
నాకు వంటకాలు ఇవ్వండి,cooking_recipe
నాకు అంతర్జాతీయ వార్తలు ఇవ్వండి,news_query
నాకు రైడ్ బుక్ చేయండి,transport_taxi
నాకు శనివారం మార్చి ఇరవై ఐదవ తేదీన మీటింగ్ ఉందా?,calendar_query
నాకు శాక్రమెంటోలో కచేరీలు చూపించు,recommendation_events
నాకు కొన్ని ఆరోగ్య చిట్కాలు ఇవ్వండి,general_quirky
నాకు కొన్ని ఫన్నీ ఫేస్‌బుక్ పోస్ట్‌లు ఇవ్వండి,social_query
నాకు ఎరుపు దీపాలు ఇవ్వండి,iot_hue_lightchange
నాకు ఉత్తమ వంట ఆలోచనలు ఇవ్వండి,cooking_recipe
ఇది నాకు మంచి పాటలలో ఒకటి,music_likeness
నాకు వేడి కాఫీ కావాలి,iot_coffee
నాకు వార్తలు ఇవ్వండి,news_query
నాకు న్యూస్ రేడియో ఛానెల్ ప్లే చేయండి,play_radio
నాకు మంగళవారం గడువు ఉంది,general_quirky
నాకు సేనాని పాటలంటే ఇష్టం,music_likeness
మీరు నాకు హైదరాబాద్‌కి రైలు టిక్కెట్టు ఇప్పిస్తారా,transport_query
నాకు చదరంగం ఆడాలని అనిపిస్తోంది నువ్వు ఆడగలవా,play_game
నన్ను గుర్తుంచుకోవడంలో సహాయపడటానికి అలారం చేయండి,alarm_set
"నాకు ఆదివారం ఉదయం ఎనిమిది గంటలకు అలారం కావాలి, దయచేసి నా కోసం ఒకటి సెట్ చేయగలరా",alarm_set
నాకు టిక్ టాక్ టో గేమ్ ఆడండి,play_game
నా కోసం డైసీ గుడ్విన్ పుస్తకాన్ని మరికొన్ని చదవండి,play_audiobook
నేను డెలివరీ ఎప్పుడు పొందుతాను,takeaway_query
నాకు డెన్వర్‌కి రైలు టిక్కెట్ కావాలి,transport_query
నాకు ట్రాఫిక్ అప్‌డేట్ ఇవ్వండి,transport_traffic
నాకు హెడ్‌లైన్ వార్తలు ఇవ్వండి,news_query
నాకు తారా జాన్ పరిచయం ఉందా?,email_querycontact
నాకు సినిమా సమయాలను చూపించు,recommendation_movies
నాకు రోజూ కాఫీ కావాలి,iot_coffee
నాకు రోజూ ఉదయం ఆరు గంటలకు అలారం కావాలి,alarm_set
నాకు తెలిసిన వారెవరైనా ఈ నెల పుట్టినరోజు కదా,email_querycontact
"నాకు తెలియదు, ఒల్లీ.",general_dontcare
నాకు తెలియదు.,general_dontcare
నాకు ఎన్నికల అప్‌డేట్‌లు ఇవ్వండి,news_query
