text,category
నాలుగు ప్లస్ నాలుగు అంటే ఏమిటి,qa_maths
నాలుగు నక్షత్రాలు లేదా అంతకంటే ఎక్కువ రేటింగ్ ఉన్న తాజా జానపద పాటలను డౌన్‌లోడ్ చేసుకోండి మరియు షఫుల్ లేకుండా అన్నీ ప్లే చేయండి,play_music
నాలుగు పన్నెండుకి రివైండ్ చేయండి,play_podcasts
నాలుగు గంటల శరీరం యొక్క చౌకైన కాపీని నాకు కనుగొనండి,general_quirky
నాలుగు మరియు ఆరు రెండు సంఖ్యల మొత్తం ఎంత,qa_maths
నాజీల వేటకు వెళ్దాం,play_game
వినడానికి కార్యక్రమంలో మిగిలినవి ఉన్నాయి,play_radio
ఈవెంట్‌లో అన్ని వివరాలను తొలగించండి,calendar_remove
ఈవెంట్ సమయంలో నన్ను హెచ్చరించండి,calendar_set
ఈవెంట్ వేదిక ఎక్కడ ఉంది,recommendation_events
ఈవెంట్ బుక్ క్లబ్ డెబ్బీస్ హౌస్‌ను బుధవారం రాత్రి జోడించండి,calendar_set
ఈ రాత్రి ఐదు సాయంత్రం ఈవెంట్ బేస్ బాల్ ప్రాక్టీస్‌ని జోడించండి,calendar_set
సంఘటనలను తుడిచివేయండి,calendar_remove
సంఘటనలను కనుగొనండి,recommendation_events
ఈవెంట్‌కు రెండు రోజుల ముందు రిమైండర్‌ను సెట్ చేయండి,calendar_set
ఈవెంట్‌ను నెలలో మొదటి సోమవారం పునరావృతమయ్యేలా సెట్ చేయండి,calendar_set
కానన్ వివరణలో ఎన్ని మెగా పిక్సెల్‌లు జాబితా చేయబడ్డాయి,qa_factoid
న్యూ ఓర్లీన్స్‌లో నాకు అతి చిన్న కాఫీ షాప్‌ని కనుగొనండి,recommendation_locations
న్యూకాజిల్ నుండి ఎడిన్‌బర్గ్‌కి రైలు వచ్చే ఖచ్చితమైన సమయం చెప్పండి,transport_query
న్యూకాజిల్‌కి రైలు టికెట్ కోసం శోధించండి,transport_ticket
న్యూయార్క్ సమీపంలోని ఈవెంట్‌లను జాబితా చేయండి,recommendation_events
న్యూయార్క్ వెళ్ళడానికి ఒక రౌండ్ ట్రిప్ రైలు టికెట్ ఎంత,transport_query
న్యూయార్క్ వెళ్లే తదుపరి రైలులో నాకు సీటు ఇప్పించండి,transport_ticket
న్యూయార్క్ టైమ్స్ నుండి తాజా ట్వీట్లు ఏమిటి,social_query
న్యూయార్క్ టైమ్స్ మొదటి పేజీని నాకు చదవండి,news_query
నేను న్యూయార్క్ నగరం నుండి పఫ్‌కీప్సీకి ఎలా వెళ్ళగలను,transport_query
న్యూయార్క్ నగరం నుండి పౌకీప్సీకి ఏ పర్యటనలు అందుబాటులో ఉన్నాయి,transport_query
న్యూయార్క్ నగరం నుండి బయలుదేరే తదుపరి రైలు బయలుదేరే సమయం ఎంత,transport_query
న్యూయార్క్ నగరానికి హాంకాంగ్‌కి ఎన్ని గంటల తేడా,datetime_convert
న్యూయార్క్ నగరానికి టాక్సీ బుక్ చేయండి,transport_taxi
నేను న్యూయార్క్ నగరంలో ప్రస్తుత వాతావరణం తెలుసుకోవాలి,weather_query
న్యూయార్క్ నగరంలో వాతావరణం నాకు చెప్పండి,weather_query
న్యూయార్క్ నగరంలో ఏమి చేయాలి,recommendation_events
న్యూయార్క్ నగరంలో తాజా ఈవెంట్,recommendation_events
న్యూయార్క్ నగరంలో సమయం నాకు చూపించు,datetime_query
న్యూయార్క్ నగరంలో సమయం ఎంత,datetime_query
న్యూయార్క్ నగరం దగ్గర డాగ్ షోలు జరుగుతున్నాయా?,recommendation_events
న్యూయార్క్ సమయాన్ని లండన్‌గా మార్చండి,datetime_convert
న్యూయార్క్ సమయం,datetime_query
న్యూయార్క్ మరియు లాగోస్ మధ్య సమయ వ్యత్యాసం ఏమిటి,datetime_convert
ఇప్పుడు న్యూయార్క్‌లోని థియేటర్లలో అత్యంత ప్రజాదరణ పొందిన రోమ్ కామ్ సినిమా గురించి నాకు తెలియజేయండి,recommendation_movies
న్యూయార్క్‌లో వచ్చే వారం వాతావరణం,weather_query
ప్రస్తుతం న్యూయార్క్‌లో వాతావరణం ఎలా ఉంది,weather_query
ప్రస్తుతం న్యూయార్క్‌లో ఉష్ణోగ్రత ఎంత,qa_factoid
న్యూయార్క్ నుండి ఓర్లాండో వరకు పది ప్రదేశాలను చూడడానికి ఒక రైడ్ బుక్ చేయండి,transport_ticket
న్యూయార్క్ నుండి శాన్ ఫ్రాన్సిస్కోకి నా ఫస్ట్ క్లాస్ AC రైలు టిక్కెట్‌ను బుక్ చేయండి,transport_ticket
న్యూయార్క్ నుండి లాస్ వెగాస్ నెవాడాకి ఒక వారం పాటు రైలు టిక్కెట్‌ను కొనుగోలు చేయండి,transport_ticket
న్యూయార్క్‌లో నేటి ఈవెంట్‌లను చూపించు,recommendation_events
న్యూయార్క్ చుట్టుపక్కల థియేటర్లలో నేను ఏ రోమ్ కామ్ మూవీని చూడగలను,recommendation_movies
మీరు న్యూయార్క్‌లో సమయం చెప్పగలరా,datetime_query
న్యూయార్క్‌లో నిర్వహించిన ఈవెంట్‌లు ఏమిటి,recommendation_events
న్యూయార్క్‌లో నాకు తాజా వార్తలను పొందండి,news_query
న్యూయార్క్ చుట్టూ తాజా ఈవెంట్‌లను చూపండి,recommendation_events
మీరు న్యూయార్క్‌లో కొంత వినోదాన్ని సూచించగలరు,recommendation_events
న్యూయార్క్‌లో ట్రాఫిక్ గురించి నాకు అప్‌డేట్ ఇవ్వండి,transport_traffic
న్యూయార్క్‌లో తేదీ,datetime_query
న్యూయార్క్‌లో జరిగే అన్ని హాలోవీన్ ఈవెంట్‌ల జాబితాను రూపొందించండి,calendar_query
న్యూయార్క్‌లో సమయం ఎంత,datetime_query
న్యూయార్క్‌లో చూడటానికి ఐదు గమ్యస్థానాలను కవర్ చేసే రైలు ప్రయాణాన్ని నాకు బుక్ చేయండి,transport_ticket
న్యూయార్క్ టిక్కెట్,transport_ticket
న్యూయార్క్‌కి తదుపరి రైలు ఎప్పుడు,transport_query
న్యూయార్క్ కోసం క్యాబ్ బుక్ చేయండి,transport_taxi
నాకు న్యూయార్క్‌కి అత్యంత చౌకైన రైలు టిక్కెట్‌ను బుక్ చేయండి,transport_ticket
న్యూయార్క్‌కి రైలు టిక్కెట్‌ను బుక్ చేయండి,transport_ticket
న్యూయార్క్‌కి రైలు టిక్కెట్‌ను బుక్ చేయండి,transport_ticket
దయచేసి న్యూయార్క్‌కి రైలు టిక్కెట్‌ను ఎలా కొనుగోలు చేయాలనే దాని గురించి నాకు సమాచారం పంపండి,transport_query
న్యూయార్క్‌కి రైలు సమయాలు,transport_query
నాకు న్యూయార్క్ ప్రస్తుత సమయం ఇవ్వండి,datetime_query
న్యూస్ ఎక్స్‌ప్రెస్ నుండి ఏ వార్తల నవీకరణలు ఉన్నాయి,news_query
న్యూస్ ఎక్స్‌ప్రెస్‌లో ఏమి జరుగుతోంది,news_query
శాశ్వతంగా నిర్వచించండి,qa_definition
బకాయి చెల్లింపు గురించి అలెక్స్‌కి మెయిల్ పంపండి,email_sendemail
పెండింగ్‌లో ఉన్న అన్ని రిమైండర్‌లను పరిశీలిద్దాం,calendar_query
స్టేషన్ నుండి లొకేషన్‌కి రైలు సమయాలను నాకు తెలియజేయండి,transport_query
స్టేషన్‌ను ఎనభై రెండు పాయింట్లు నాలుగుకి మార్చండి,play_radio
స్థిర నుండి పెన్సిల్ తొలగించండి,lists_remove
స్థాయి ముగింపులో స్పీకర్ వాల్యూమ్‌ను తగ్గించండి,audio_volume_mute
రంగు యొక్క అస్పష్టతను మార్చండి,iot_hue_lightchange
రంగును కాంతి నుండి చీకటికి మార్చండి,iot_hue_lightchange
రంగు మార్చండి,iot_hue_lightchange
ఆగి మళ్లీ ప్రారంభించండి.,general_repeat
"ఆగి, నేను చెప్పినదాన్ని మరోసారి ప్రయత్నించండి.",general_repeat
"ఆపు, అది సరైన ఆదేశం కాదని నేను భావిస్తున్నాను.",general_negate
"ఆపండి, ఇది సరైన సమాధానం కాదు.",general_negate
"ఆపండి, మీరు అభ్యర్థనను సరిగ్గా సూచించలేదు.",general_negate
కంపెనీకి ట్వీట్ పంపండి,social_post
కంపెనీ సమావేశం గురించి మూడవ మార్చిలో నోటిఫికేషన్‌ను సెట్ చేయండి,calendar_set
కంపెనీ వారి సేవ చెడ్డదని చెప్పండి,social_post
కంపెనీ ప్రస్తుతం వాక్యూమ్ క్లీనర్‌ను ఆన్ చేస్తోంది,iot_cleaning
నిలబడి ఉన్న రాక్ నిరసన గురించి నాకు తెలియజేయండి,news_query
రిమైండర్ కోసం అలారం సెట్ చేయండి,alarm_set
దయచేసి రిమైండర్‌ని సెట్ చేయండి,calendar_set
రిమైండర్లు,calendar_set
నాకు గుర్తు చేసినందుకు ధన్యవాదాలు.,general_praise
నువ్వు నా లాండ్రీ ఎప్పుడు చేస్తావు,general_quirky
మీరు నా కోసం దీపాలను వెలిగించగలరా?,iot_hue_lightup
నువ్వేమి చేస్తున్నావు,general_quirky
"మీరు రాక్,.",general_praise
నేను నీ పాటను ప్రేమిస్తున్నాను,music_likeness
"నువ్వు తెలివైనవాడివి, ఒల్లీ.",general_praise
నువ్వు నోరు మూసుకుంటావా.,general_commandstop
నువ్వు ఆడాలని అనుకుంటున్నావా,play_game
"నువ్వు హీరోవి, ఒల్లీ.",general_praise
మీరు abc@gmail డాట్ కామ్‌కి ఇమెయిల్ పంపవచ్చు ఇది నా కొత్త ఇమెయిల్ చిరునామా,email_sendemail
మీరు కోక్ ఆటలో శత్రువు పాత్రను తీసుకోగలరా?,play_game
మీరు fm ఎనిమిది వందల తొంభై రేడియో ఛానెల్‌ని ప్రారంభించగలరా?,play_radio
మీరు fm ఎనిమిది వందల తొంభై రేడియో ఛానెల్‌ని ప్రారంభించాలి,play_radio
మీరు గ్రెగ్‌కి ఇమెయిల్ పంపుతారా,email_sendemail
"మీరు కెఎఫ్‌ఐని తనిఖీ చేయాలి, అతను ఉత్తముడు",music_likeness
మీరు rfi ఆడగలరా?,play_music
"మీరు samsungని సంప్రదించి, నా వాషర్ మంటల్లో ఉందని చెప్పగలరా",social_post
మీరు మూసివేస్తారా.,general_commandstop
మీరు దానిని కొద్దిగా పెంచగలరా,audio_volume_up
మీరు బిగ్గరగా పునరావృతం చేయడం నేను వినలేకపోయాను,audio_volume_up
మీరు దాన్ని తనిఖీ చేయగలరా.,general_confirm
దయచేసి దాన్ని తనిఖీ చేస్తారా.,general_confirm
"మీరు సరిగ్గా చేసారు, చాలా ప్రశంసించబడింది, ఒల్లీ.",general_praise
మీరు సరిగ్గా చేసారు.,general_affirm
మీరు దానిని సంపూర్ణంగా చేసారు.,general_affirm
మీరు సరిగ్గా అర్థం చేసుకున్నారా?,general_confirm
మీరు దానిని సంపూర్ణంగా పొందారు.,general_affirm
మీరు దానిని సరిగ్గా పొందారు.,general_affirm
మీరు దానిని సరిగ్గా పొందారు.,general_affirm
మీరు దానిని తిరస్కరించగలరా,audio_volume_down
మీరు దానిని ఆపాలని నేను కోరుకుంటున్నాను.,general_commandstop
మీరు దానిని సంపూర్ణంగా చేసారు.,general_affirm
మీరు మరోసారి మాట్లాడగలరా.,general_repeat
నువ్వు మళ్ళీ చేస్తావా.,general_repeat
మీరు దానిని రద్దు చేయాలనుకుంటున్నాను.,general_commandstop
మీరు దానిని రద్దు చేయడాన్ని నేను ఇష్టపడుతున్నాను.,general_commandstop
మీరు దానిని రద్దు చేయాలనుకుంటున్నాను.,general_commandstop
మీరు దానిని రద్దు చేయాలనుకుంటున్నాను.,general_commandstop
"మీరు సరిగ్గా చేసారు, ప్రశంసించబడింది.",general_praise
"మీరు సరిగ్గా చేసారు, చాలా ప్రశంసించబడింది, ఒల్లీ.",general_praise
మీరు సరిగ్గా చేసారు.,general_praise
"మీరు ఆ వచనాన్ని పంపాలని నేను కోరుకోలేదు, ఇంకా నేను పంపే వరకు వేచి ఉండండి",email_sendemail
మీరు సెట్ చేసిన అలారాల గురించి నాకు తెలియజేయండి,alarm_query
"మీరు అద్భుతంగా ఉన్నారు, ధన్యవాదాలు.",general_praise
"మీరు అద్భుతంగా ఉన్నారు, నేను దానిని అభినందిస్తున్నాను.",general_praise
"మీరు అద్భుతంగా ఉన్నారు,.",general_praise
నాకు మీరు అలారం సెట్ చేయాలి,alarm_set
మీరు సూచనను నిర్ధారించగలరు.,general_confirm
మీరు సూచనలను తనిఖీ చేస్తారా.,general_confirm
మీరు సూచనలను తనిఖీ చేసి నిర్ధారిస్తారా.,general_confirm
"మీరు అద్భుతమైన పని చేసారు, చాలా ధన్యవాదాలు.",general_praise
మీరు అద్భుతమైన పని చేసారు.,general_praise
మీరు అద్భుతమైన పని చేసారు.,general_praise
మీరు పంపిన అలారం గురించి తెలుసుకోవాలనుకుంటున్నాను,alarm_query
"మీరు ఆడియోను పాజ్ చేసి, రివైండ్ చేయగలరా, ఆపై పునఃప్రారంభించవచ్చు",play_audiobook
"మీరు ఆడియోను ఫాస్ట్ ఫార్వార్డ్ చేసి, ఆపై పునఃప్రారంభించాలని నేను కోరుకుంటున్నాను",play_audiobook
మీరు దీన్ని సరిగ్గా అర్థం చేసుకోలేదని నేను అనుకుంటున్నాను.,general_negate
మీరు ఇదంతా తప్పు పద్ధతిలో చేశారని నేను భావిస్తున్నాను.,general_negate
మీరు ఈ సమస్యపై వాస్తవాలను తనిఖీ చేయగలరు,calendar_query
మీరు ఇప్పుడేం చెప్పారో నాకు అర్థం కావడం లేదు.,general_explain
మీరు ఇప్పుడే చెప్పిన మీ పదబంధాన్ని మళ్లీ ప్లే చేయగలరా.,general_repeat
మీరు ఇప్పుడు ఏమి చెప్పారో నాకు స్పష్టంగా తెలియలేదు.,general_explain
దయచేసి మీరు ఇప్పుడే చెప్పినట్లు తనిఖీ చేసి నిర్ధారించగలరా.,general_confirm
మీరు ఇప్పుడు చెప్పిన దాని గురించి మీరు మరోసారి నాకు పునరావృతం చేస్తారా.,general_explain
మీరు మరింత మృదువుగా మాట్లాడగలరు,audio_volume_up
మీరు మీ అవగాహనను సరిగ్గా చేసారు.,general_affirm
మీరు మీ అవగాహనను సరిగ్గా చేసారు.,general_affirm
మీరు నిజమైన వారేనా,general_quirky
"మీరు సహాయకారిగా ఉన్నారు, ధన్యవాదాలు.",general_praise
"మీరు సహాయకారిగా ఉన్నారు, ప్రశంసించబడ్డారు.",general_praise
"మీరు సహాయకారిగా ఉన్నారు, చాలా ప్రశంసించబడింది.",general_praise
మీరు ఉక్కును ఎలా తయారు చేస్తారు,general_quirky
మీరు బంగాళాదుంపను ఏ ఉష్ణోగ్రతలో కాల్చారు,cooking_recipe
మీరు ఎలా ఉన్నారు,general_quirky
మీరు కుకీలను ఎలా తయారు చేస్తారు,cooking_recipe
మీరు బసాల్ట్ ఎలా పొందవచ్చు,general_quirky
మీరు పాస్తా ఎలా తయారు చేస్తారు,cooking_recipe
మీరు ఎంత తరచుగా అప్‌డేట్‌లను పూర్తి చేస్తారు,general_quirky
మీరు నా కోసం ఈ గేమ్ ఆడాలని నేను కోరుకుంటున్నాను,play_game
మీరు నా కోసం ఉబెర్ బుక్ చేయగలరా,transport_taxi
మీరు నా కోసం ఒక టాక్సీని బుక్ చేసుకోవాలి,transport_taxi
మీరు నా కోసం రోప్‌ని మార్చగలరా,general_quirky
మీరు నా కోసం స్టేటస్ పోస్ట్ చేస్తే బాగుంటుంది,social_post
మీరు నా కోసం రైలు టిక్కెట్‌ను బుక్ చేయాలనుకుంటున్నాను,transport_ticket
మీరు నా కోసం రైలు టిక్కెట్టు చేయగలరా,transport_ticket
మీరు నాకు ఒక జోక్ చెప్పగలరా,general_joke
మీరు నాకు టేక్అవుట్ ఆర్డర్ చేయగలరా,takeaway_order
దయచేసి మీరు నా చివరి ఆదేశాన్ని ధృవీకరించాలని నేను ఇష్టపడుతున్నాను.,general_confirm
మీరు నా సూచనలను సరిగ్గా పొందారు.,general_affirm
మీరు నా గణితాన్ని పరిష్కరిస్తారా?,qa_maths
నువ్వు నా బెస్ట్ ఫ్రెండ్ కాగలవా,general_quirky
"మీరు నా స్టార్, చాలా ధన్యవాదాలు.",general_praise
మీరు నా పేరు సరిగ్గా చెప్పలేదు.,general_negate
మీరు నా సూచనలను సరిగ్గా అర్థం చేసుకున్నారు.,general_affirm
"మీరు నా హీరో, ప్రశంసించబడింది.",general_praise
"మీరు నా హీరో, చాలా ధన్యవాదాలు, ఒల్లీ.",general_praise
మీరు ఏ అలారాలు సెట్ చేసారు,alarm_query
మీరు దాని అర్థం ఏమిటి.,general_explain
మీ ఉద్దేశ్యం ఏమిటి.,general_explain
మీరు దాని అర్థం ఏమిటి.,general_explain
మీరు దాని అర్థం ఏమిటి.,general_explain
మీరు ఏమి చర్చిస్తున్నారో ఎవరైనా నాకు చెప్పగలరా,social_query
"మీరు నాకు సరైన తేదీని చెప్పారు, దయచేసి దీన్ని సరిచేయండి.",general_negate
మీరు నాతో ఆట ఆడాలనుకుంటున్నారా,play_game
దయచేసి మీరు నాతో ఆడగలిగే గేమ్‌ను ఎంచుకోండి,play_game
మీరు నాతో ఆడగల ఆటలను జాబితా చేయండి,play_game
మీరు నన్ను తప్పుగా పట్టుకున్నారు.,general_negate
మీరు నన్ను తప్పుగా నడిపిస్తున్నారు.,general_negate
మీరు నన్ను తప్పుగా కలిగి ఉన్నారు.,general_negate
మీరు నన్ను అర్థం చేసుకోలేదని అనుకుంటున్నాను.,general_negate
మీరు టాక్సీకి కాల్ చేయగలరా,transport_taxi
