text,category
@nikesupport मुझे पिछले सप्ताह खरीदे गए कुछ जूतों के संबंध में कुछ सहायता की आवश्यकता है,social_post
क्या @realdonaldtrump ने ट्विटर पर कुछ नया पोस्ट किया है?,social_query
@wendys को ट्वीट करें कि मुझे उनका उत्पाद पसंद नहीं है,social_post
मेरी शिकायत @consumer service पर ट्वीट करें,social_post
16 का मूल क्या है?,qa_maths
4 का वर्ग क्या है,qa_maths
एबीसी का समापन मूल्य क्या है?,qa_stock
"एक ट्वीट इस प्रकार पोस्ट करें, एबीसी कंपनी द्वारा किया गया बहुत ही खराब फॉलो-अप मेरे खाते से संतुष्ट नहीं है",social_post
कृपया Applebee's की धीमी सेवा के बारे में शिकायत ट्वीट करें,social_post
क्या अरबी टेकअवे करता है?,takeaway_query
बीडीई की लागत कितनी है,qa_stock
आभूषणों से सुसज्जित प्रारंभ करें,play_game
सीएनएन,news_query
क्या सीएनएन न्यूज फेसबुक पेज पर कोई स्टेटस अपडेट है?,news_query
सीएनएन वेबसाइट पर क्या खबरें हैं?,news_query
सीएनएन पर नवीनतम सुर्खियाँ क्या हैं?,news_query
सीएनएन विश्व समाचार,news_query
सीएनएन सुर्खियाँ,news_query
सीएनएन ऐप खोलें,news_query
सीपीयू को परिभाषित करें,qa_definition
सीवीएस फार्मेसी को ट्विटर के माध्यम से शिकायत पोस्ट करें,social_post
सीज़के और यूरो के बीच विनिमय दर क्या है?,qa_currency
मुझे सीजेडके और डॉलर के बीच विनिमय दर दिखाओ,qa_currency
मुझे डेनविल आईएल का वर्तमान मौसम बताएं,weather_query
डी गुआम प्रिस्क्रिप्शन नशीली दवाओं का दुरुपयोग बढ़ रहा है,news_query
क्या डोमिनोज़ के पास डिलीवरी का विकल्प है?,takeaway_query
डीवीआर पर मेरी फिल्मों की प्लेलिस्ट में क्या है,lists_query
एमिली रोज़र के लिए एक नए संपर्क के रूप में erosser@hotmail dot com जोड़ें,email_addcontact
सुबह नौ बजे सीएसटी से स्था. क्या है?,datetime_convert
मुझे फेसबुक से नवीनतम अपडेट प्राप्त करें,social_query
फेसबुक से नवीनतम समाचार फ़ीड,social_query
फेसबुक से आज की मुख्य बातें क्या हैं?,social_query
फेसबुक का वर्तमान स्टॉक रेट क्या है?,qa_stock
फेसबुक स्टेटस अपडेट पोस्ट करें,social_post
फेसबुक पर क्या चल रहा है?,social_query
एफबी स्टॉक की कीमत कितनी है?,qa_stock
एफबी स्टॉक,qa_stock
स्टेशन एफएम निन्यानबे दशमलव पाँच पर जाएँ,play_radio
आइए एफएमओडी खेलें,play_game
मुझे फ़ॉन्डल शब्द की परिभाषा दीजिए,qa_definition
कृपया फ्रा स्टॉक की शुरुआती कीमत बताएं,qa_stock
मुझे जी में समय बताओ एम। टी। प्लस पाँच,datetime_convert
जी का रेट क्या है? बी। पी। तुम्हें एस। डी।,qa_currency
जी परिवर्तित करें एम। टी। प्रथम करने के लिए,datetime_convert
अभी जीई की कीमत क्या है,qa_stock
गूगल उबर,transport_taxi
गूगल के लिए आज का समापन मूल्य,qa_stock
Google के लिए वर्तमान स्टॉक कीमतें क्या हैं?,qa_stock
Google की खुली सूची को ट्रैश करें,lists_remove
गूगल स्टॉक सिंबल,qa_stock
ग्रुभ से भोजन का ऑर्डर,takeaway_order
ग्रुभ आदेश,takeaway_order
ग्रुबह ऐप खोलें ताकि मैं बाहर निकालने का ऑर्डर दे सकूं,takeaway_order
एचडीएफसी का शेयर मूल्य क्या है?,qa_stock
एचडीएफसी के शेयर मूल्य का उल्लेख करें,qa_stock
एचडीएफसी के शेयर मूल्य देखें,qa_stock
एचपी कंपनी का स्टॉक कितना है?,qa_stock
I25 पर ट्रैफिक कैसा है,transport_traffic
मैं चालीस पर लक्ष्य के लिए दिशा-निर्देश,transport_query
कृपया मुझे i95 एसबी के लिए सड़क का पूर्वानुमान बताएं,transport_traffic
ईमेल पता iamironman@gmail dot com जोड़ें,email_addcontact
इंचोएट की परिभाषा क्या है,qa_definition
डॉलर की कीमत INR में क्या है?,qa_currency
आईएनआर और यू की विनिमय दरें। एस। डी।,qa_currency
इंस्टाग्राम जांचें,social_query
आई - फ़ोन,news_query
iPhone के बारे में नवीनतम समाचार खोजें,news_query
मेसी को बताते हुए एक ट्वीट लिखें कि उन्हें जेसीपीनी के बजाय बंद कर देना चाहिए,social_post
मुझे जेन के का क्षेत्र कोड बताएं,email_querycontact
जेएलओ फैन अपडेट,general_quirky
joanne@aol dot com पर ईमेल भेजें और नए संपर्क के रूप में जोड़ें,email_sendemail
Juanpedro@gmail dot com पर एक ईमेल भेजें,email_sendemail
केएफआई मेरा पसंदीदा रैपर है,music_likeness
koc पर ट्वीट करें आपका प्रतीक्षा समय बेकार है,social_post
भूलभुलैया शब्द का क्या अर्थ है,qa_definition
क्या लेचेटौ के पास डिलीवरी सेवा है या केवल टेकअवे है,takeaway_query
lindafancy55@gmail डॉट कॉम,email_sendemail
मैरिसा को ईमेल भेजें,email_sendemail
"मैंने एमसीडी को दिया गया ऑर्डर रद्द कर दिया है, क्या यह पूरा हो गया?",takeaway_query
एमसीडीओ को निर्देश,transport_query
mi से आज का पॉडकास्ट खेलें,play_podcasts
कृपया जांचें और मुझे मोंगोमरी एलएलसी कंपनी का संपर्क विवरण बताएं,email_querycontact
कृपया वह नियुक्ति हटा दें जो मैंने श्रीजिम के साथ की है,calendar_remove
एमएसएनबीसी पर हालिया समाचारों की जांच करें,news_query
कृपया मुझे बताएं कि एनबीए चैंपियनशिप कौन जीतने वाला है,general_quirky
मैं एनबीसी न्यूज से नवीनतम जानकारी जानना चाहूंगा,news_query
newmail@gmail.com पर ईमेल भेजें,email_sendemail
एनएफएल पर पॉडकास्ट शुरू करें,play_podcasts
एनपीआर टेड वार्ता,play_podcasts
न्यूयॉर्क में आज के कार्यक्रम दिखाएँ,recommendation_events
न्यूयॉर्क में क्या हो रहा है?,recommendation_events
न्यूयॉर्क में अपहरण पर नवीनतम समाचार रिपोर्ट प्राप्त करें,news_query
न्यूयॉर्क के लिए ट्रेनें और समय दिखाएं,transport_query
कृपया मुझे बताएं कि न्यूयॉर्क बाजार में ओस का स्टॉक मूल्य क्या है,qa_stock
एनआईटी पॉडकास्ट का अगला एपिसोड,play_podcasts
क्या मुझे ओला और उबर की स्टॉक रेट सूची मिल सकती है?,qa_stock
बस इतना ही होगा.,general_commandstop
"बस इतना ही काफी है, बस रद्द करें।",general_commandstop
"ओली, मुझे लिविंग रूम को वैक्यूम करवाना है, क्या आप वैक्यूम क्लीनर चालू कर सकते हैं",iot_cleaning
ऑली ने मेरा अलार्म एक घंटे में बंद होने के लिए सेट कर दिया,alarm_set
ऑली क्या आप कृपया बंद कर देंगे?,general_commandstop
ऑली क्या आप कृपया इसे बंद कर सकते हैं।,general_commandstop
ऑली कृपया क्या आप बंद कर सकते हैं।,general_commandstop
ऑली कृपया क्या आप बंद कर देंगे?,general_commandstop
ऑली क्या आप कृपया इसे बंद कर देंगे?,general_commandstop
ऑली कृपया बंद करें।,general_commandstop
ऑली कृपया बंद करें।,general_commandstop
ऑली क्या आप कृपया बंद कर देंगे।,general_commandstop
ओली कृपया क्या आप रद्द कर सकते हैं?,general_commandstop
ऑली क्या आप कृपया रद्द कर सकते हैं।,general_commandstop
ऑली कृपया क्या आप रद्द कर सकते हैं?,general_commandstop
ऑली कृपया क्या आप रद्द कर सकते हैं।,general_commandstop
ऑली मैंने कहा जैक को नहीं जेक को बुलाओ।,general_negate
ऑली क्या आप बंद कर सकते हैं?,general_commandstop
ऑली क्या आप बंद कर सकते हैं?,general_commandstop
ऑली क्या आप बंद कर सकते हैं?,general_commandstop
ऑली क्या आप बंद कर देंगे?,general_commandstop
ऑली बंद हो गया.,general_commandstop
ऑली योग अलार्म रद्द करें,alarm_remove
ऑली रोशनी चमकाओ,iot_hue_lightup
मुझे पैनासोनिक के लिए आज के बाज़ार रुझान बताएं,qa_stock
पावेल जॉन के साथ बैठक की तैयारी करते हैं,calendar_query
पीडीए का क्या मतलब है,qa_definition
पीडीआर एएम चालू करें,play_radio
क्या पीएफ परिवर्तन टेकआउट ऑर्डर स्वीकार करता है?,takeaway_query
पिज़्ज़ा हट को कॉल करें और पता करें कि मेरा ऑर्डर तैयार है या नहीं,takeaway_query
मुझे पीएसटी में समय दीजिए,datetime_query
qerwerq@hotmail dot com पर एक ईमेल भेजें,email_sendemail
क्या Reddit पर कुछ नया है?,social_query
एस एन कितना ऊंचा है. पी,qa_stock
एसएन ने क्या किया? पी पर बंद करें,qa_stock
उस एसएमएस प्राप्तकर्ता को हटा दें जिसके आरंभिक अक्षर s हैं,lists_remove
"s1, क्या आप मुझे इस पर और स्पष्टीकरण दे सकते हैं।",general_explain
"s1, इस पर मुझे और अधिक पुनः लिखें।",general_explain
"s1, इसे आगे पुनः लिखें।",general_explain
"s1, अपनी प्रतिक्रिया पर और अधिक स्पष्ट करें।",general_explain
"s1, क्या आप कृपया मुझे अपने उत्तरों पर और स्पष्टीकरण देंगे।",general_explain
"s1, कृपया मुझे इसके बारे में दोबारा बताएं।",general_explain
"s1, कृपया मुझे इसके बारे में और विस्तार से बताएं।",general_explain
"s1, क्या आप कृपया मुझे और विस्तार से बताएंगे।",general_explain
"s1, कृपया आपने अभी जो कहा उसके बारे में मुझे दोबारा बताएं।",general_explain
"s1, क्या आप कृपया जो कुछ आपने मुझसे कहा है उसे दोबारा लिख ​​सकते हैं।",general_explain
"एस1, कृपया मुझे फिर से विस्तार से बताएं कि आपने अभी क्या कहा है।",general_explain
"s1, कृपया मुझे अपने उत्तर के बारे में और विस्तार से बताएं।",general_explain
"s1, कृपया मुझे अपने उत्तर के बारे में फिर से विस्तार से बताएं।",general_explain
"s1, कृपया फिर से अपने उत्तर स्पष्ट करें।",general_explain
"s1, कृपया मुझे अपने उत्तरों के बारे में एक बार फिर से स्पष्ट करें।",general_explain
"s1, क्या आप कृपया मुझे फिर से दोबारा बता सकते हैं।",general_explain
"एस1, क्या आप कृपया मुझे अंतिम वाक्य को और अधिक स्पष्ट रूप से बता सकते हैं।",general_explain
"s1, कृपया एक बार फिर मुझे स्पष्ट करें।",general_explain
"एस1, क्या आप कृपया मुझे एक बार फिर से स्पष्ट कर सकते हैं कि आपने अभी क्या कहा है।",general_explain
"एस1, क्या आप मुझे एक बार फिर से समझाएंगे कि आपने अभी क्या कहा है।",general_explain
"एस1, क्या आप कृपया मुझे जो कुछ कहा है उसके बारे में अधिक बता सकते हैं।",general_explain
"s1, क्या आप कृपया मुझे आपके द्वारा कही गई बातों के बारे में और विस्तार से बताएंगे।",general_explain
"s1, क्या आप आगे बताएंगे।",general_explain
"s1, कृपया मुझे फिर से समझाएं।",general_explain
"s2, यह नहीं मिल सकता.",general_explain
"s2, मैं आपकी प्रतिक्रिया के बारे में अस्पष्ट था।",general_explain
"s2, आपका उत्तर नहीं मिलता.",general_explain
"s2, मैं आपके उत्तरों के बारे में अस्पष्ट था।",general_explain
"एस2, मुझे आपकी बातें समझ नहीं आईं।",general_explain
"s2, मैं आपके शब्दों के बारे में अस्पष्ट हूँ।",general_explain
"एस2, मैं उसे पूरी तरह समझ नहीं पाया।",general_explain
"s2, मैं उसे समझ नहीं पाया।",general_explain
"s2, मैं उसे पूरी तरह से नहीं पकड़ सकता।",general_explain
"s2, मुझे वह नहीं मिल सका।",general_explain
"एस2, मैं आपसे पूरी तरह नहीं मिल सका।",general_explain
"s2, मैं आपसे नहीं मिल सकता।",general_explain
"s2, मैं आपसे संपर्क नहीं कर सका।",general_explain
"s2, अंतिम वाक्य नहीं मिलता।",general_explain
"s2, अंतिम वाक्य स्पष्ट नहीं था।",general_explain
"s2, मैं इसके बारे में स्पष्ट नहीं था।",general_explain
"s2, मैं इसके बारे में स्पष्ट नहीं था।",general_explain
"s2, मैं इसके बारे में अस्पष्ट हूँ।",general_explain
"एस2, आपने अभी जो कहा उसके बारे में मैं इतना स्पष्ट नहीं था।",general_explain
"एस2, आपने अभी जो कहा उसके बारे में मैं अस्पष्ट था।",general_explain
"s2, आपने जो कहा है वह समझ में नहीं आया।",general_explain
एक ईमेल भेजें और samuelwaters@hotmail dot com के लिए संपर्क जानकारी सहेजें,email_addcontact
इस संगीत को शाज़म करें,music_settings
सिरी ओपन ट्विटर ट्वीट @potus बेकार है,social_post
Snapchat,social_post
क्या स्नैपचैट पर कुछ नया है?,social_query
स्टारबक्स के लिए शिकायत वेबसाइट खींचें,social_post
स्वात एक अच्छी फिल्म है,recommendation_movies
Hindi,category
ट्यूरिलोस पिज़्ज़ा से सामान्य ऑर्डर करें,takeaway_order
आपके बीच विनिमय दर क्या है? एस। डी। और inr,qa_currency
आपके बीच विनिमय दर क्या है? एस। डी। और कैड,qa_currency
आपके बीच विनिमय दर क्या है? एस। डी। और यूरो,qa_currency
आपके बीच क्या रेट है? एस। डी। और यूक्रेन की मुद्रा,qa_currency
आप में दो हजार येन कितना है? एस। डी।,qa_currency
आपकी रूपांतरण दर दिखाएं. एस। डी। और यूरो,qa_currency
आपकी विनिमय दर क्या है? एस। डी। सीडीएन के लिए,qa_currency
यू का मुद्रा रूपांतरण. एस। डी। और यूरो,qa_currency
यू एस। डी। अभी स्थिति,qa_currency
यू एस। डी। येन के लिए,qa_currency
Uber Eats में क्या ऑफर हैं,takeaway_order
उबर में टैक्सी बुकिंग करें,transport_taxi
उबर की किराये की कैब बुक करें,transport_taxi
उबर सेट करें,transport_taxi
उबर खोलो और बारह बजे के लिए कार बुक करो,transport_taxi
कृपया उबर ऐप खोलें और मुझे एक कार दिलवाएं,transport_taxi
उबर ऐप खोलें और हवाई अड्डे पर लेने के लिए मेरे लिए एक कार बुक करें,transport_taxi
कृपया उबरें,transport_taxi
यूड्राइव सेवा से टैक्सी का अनुरोध करें,transport_taxi
यूईएफए यूरोपीय चैंपियनशिप,general_quirky
यूएमएफ पर विवरण क्या हैं?,general_quirky
मुझे उम्फ़ के बारे में सब कुछ बताओ,general_quirky
यूएसए टुडे की सुर्खियाँ,news_query
डब्लूएफआरएन निन्यानबे पॉइंट वन चालू करें,play_radio
आइए सुनें wgrr एक सौ तीन दशमलव पाँच,play_radio
मैं चाहूंगा कि यह वोल्फ्राम अल्फा की तरह खोज परिणामों से उत्तर की गणना करने में सक्षम हो,general_quirky
x का भाज्य क्या है?,qa_maths
यदि x जोड़ दो पांच के बराबर है तो x का मान क्या था?,qa_maths
प्रोग्राम को xmtune चालू करें,play_radio
कृपया ईमेल को xyz@gmail dot com के बजाय abc@gmail dot com पर भेजें,email_sendemail
वाईएमसीए को कतारबद्ध करें,play_music
यप्सिलंती के पास यातायात कैसा है?,transport_traffic
आस-पड़ोस में क्या हो रहा है,recommendation_events
आइए अक्टूबर पढ़ने के लिए शिकार को सुनें,play_audiobook
एक्रोन में क्या समय हुआ है?,datetime_query
जहां मोनेट की प्रदर्शनी लगती है,recommendation_locations
यहाँ और वहाँ के बीच समय का अंतर कितना है?,datetime_convert
"उफ़, यह सही प्रतिक्रिया नहीं है।",general_negate
"उफ़, मुझे लगता है कि यह सही प्रतिक्रिया नहीं थी।",general_negate
"उफ़, मुझे लगता है आप मुझे नहीं समझते।",general_negate
"उफ़, तुम मुझे समझ नहीं आये।",general_negate
"उफ़, तुम ग़लत हो.",general_negate
कृपया मुझे ज़िप कोड उनतीस हजार नौ सौ अठहत्तर के लिए इस सप्ताह बारिश की संभावना बताएं,weather_query
मेल जांचें,email_query
"अरे, यह वह नहीं है जो मैंने अभी कहा।",general_negate
"धिक्कार है, सही प्रतिक्रिया नहीं।",general_negate
"धिक्कार है, मुझे लगता है कि प्रतिक्रिया ग़लत है।",general_negate
"अरे, मैंने ऐसा नहीं कहा।",general_negate
"धिक्कार है, मेरा मतलब यह नहीं था।",general_negate
