text,category
"जब तक मैं कुछ और न कहूँ, तब तक अपने आप को शांत रखें",audio_volume_mute
मुझे जस्टिन बीबर्स का संगीत पसंद है कृपया इसे बजाएं,music_likeness
आखिरी बार मैंने जॉन से कब बात की थी,email_querycontact
जॉन के साथ मेरी शाम की मुलाकात किस समय है?,calendar_query
मुझे जॉन को दोबारा किस समय लेना है?,calendar_query
मैं अभी अच्छा होऊंगा,iot_coffee
क्या मैंने खरीदारी सूची में दूध जोड़ा?,lists_query
क्या मैंने खरीदारी की सूची बनाई?,lists_query
क्या मैं स्पैनिश स्थान से टेकअवे ऑर्डर कर सकता हूँ?,takeaway_order
मैं स्पीकर को म्यूट करना चाहता हूं,audio_volume_mute
मैं स्वास्थ्य देखभाल पर एक नया पॉडकास्ट सुनना चाहता हूं,play_podcasts
चार अक्टूबर रात बारह बजे निर्धारित बैठक हटाएं,calendar_remove
चैप्टर चार से फिफ्टी शेड्स ऑफ ग्रे पढ़ना शुरू करें,play_audiobook
आइटम चार हटाएं,lists_remove
चार से छह बजे तक मुझे कब फ्री ब्रेक मिलता है,calendar_query
चार को दो से विभाजित करने पर दो बराबर होता है,qa_maths
चार बीस तक आगे,play_podcasts
चार और पांच क्या है,qa_maths
चार और पांच बराबर नौ,qa_maths
चार और चार क्या है,qa_maths
चार सितारा या उससे अधिक रेटिंग वाले नवीनतम लोक गीत डाउनलोड करें और बिना किसी फेरबदल के बजाएं,play_music
चार बारह पर वापस लौटें,play_podcasts
मेरे लिए चार घंटे की बॉडी की सबसे सस्ती प्रति ढूंढो,general_quirky
दो संख्याओं चार और छह का योग क्या है?,qa_maths
चलो नाज़ी शिकार पर चलते हैं,play_game
सुनने के लिए कार्यक्रम का शेष भाग है,play_radio
घटना में सभी विवरण हटा दें,calendar_remove
घटना के समय मुझे सचेत करें,calendar_set
कार्यक्रम स्थल कहां है,recommendation_events
बुधवार की रात इवेंट बुक क्लब डेबी का घर जोड़ें,calendar_set
आज रात पांच बजे इवेंट बेसबॉल अभ्यास जोड़ें,calendar_set
घटनाओं को मिटाएँ,calendar_remove
घटनाओं का पता लगाएं,recommendation_events
इवेंट से दो दिन पहले के लिए एक अनुस्मारक सेट करें,calendar_set
ईवेंट को महीने के पहले सोमवार को दोबारा शुरू करने के लिए सेट करें,calendar_set
कैनन के विवरण में कितने मेगा पिक्सेल सूचीबद्ध हैं,qa_factoid
मेरे लिए न्यू ऑरलियन्स की सबसे छोटी कॉफ़ी शॉप ढूंढो,recommendation_locations
मुझे न्यूकैसल से एडिनबर्ग तक ट्रेन के आगमन का सही समय बताएं,transport_query
न्यूकैसल के लिए ट्रेन टिकट खोजें,transport_ticket
न्यूयॉर्क के आस-पास की घटनाओं की सूची बनाएं,recommendation_events
न्यूयॉर्क जाने के लिए राउंड ट्रिप ट्रेन टिकट की कीमत कितनी है?,transport_query
मुझे न्यूयॉर्क जाने वाली अगली ट्रेन में सीट दिला दो,transport_ticket
न्यूयॉर्क टाइम्स के नवीनतम ट्वीट क्या हैं?,social_query
मुझे न्यूयॉर्क टाइम्स का पहला पृष्ठ पढ़ें,news_query
मैं न्यूयॉर्क शहर से पॉकीप्सी कैसे पहुँचूँ?,transport_query
न्यूयॉर्क शहर से पॉकीप्सी तक कौन सी यात्राएँ उपलब्ध हैं,transport_query
न्यूयॉर्क शहर से निकलने वाली अगली ट्रेन के प्रस्थान का समय क्या है?,transport_query
न्यूयॉर्क शहर से हांगकांग में कितने घंटे का अंतर है?,datetime_convert
न्यूयॉर्क शहर के लिए टैक्सी बुक करें,transport_taxi
मुझे न्यूयॉर्क शहर का वर्तमान मौसम जानना है,weather_query
मुझे न्यूयॉर्क शहर का मौसम बताओ,weather_query
न्यूयॉर्क शहर में करने के लिए क्या है?,recommendation_events
न्यूयॉर्क शहर में नवीनतम घटना,recommendation_events
मुझे न्यूयॉर्क शहर में समय दिखाओ,datetime_query
न्यूयॉर्क शहर में क्या समय हुआ है?,datetime_query
क्या न्यूयॉर्क शहर के पास डॉग शो चल रहे हैं?,recommendation_events
न्यूयॉर्क समय को लंदन में बदलें,datetime_convert
न्यूयॉर्क का समय,datetime_query
न्यूयॉर्क और लागोस के बीच समय का अंतर क्या है?,datetime_convert
मुझे न्यूयॉर्क के सिनेमाघरों में चल रही सबसे लोकप्रिय रॉम कॉम फिल्म के बारे में सूचित करें,recommendation_movies
न्यूयॉर्क में अगले सप्ताह का मौसम,weather_query
न्यूयॉर्क में इस समय मौसम कैसा है?,weather_query
न्यूयॉर्क में इस समय तापमान क्या है?,qa_factoid
न्यूयॉर्क से ऑरलैंडो तक दस स्थानों को देखने के लिए यात्रा बुक करें,transport_ticket
न्यूयॉर्क से सैन फ्रांसिस्को तक मेरी प्रथम श्रेणी एसी ट्रेन टिकट बुक करें,transport_ticket
अब से न्यूयॉर्क से लास वेगास नेवादा तक एक सप्ताह के लिए ट्रेन टिकट खरीदें,transport_ticket
न्यूयॉर्क में आज की घटनाएँ दिखाएँ,recommendation_events
मैं न्यूयॉर्क के आसपास के सिनेमाघरों में कौन सी रॉम कॉम फिल्म देख सकता हूं?,recommendation_movies
क्या आप मुझे न्यूयॉर्क में समय बता सकते हैं?,datetime_query
न्यूयॉर्क में कौन से कार्यक्रम आयोजित किये जाते हैं?,recommendation_events
मुझे न्यूयॉर्क में नवीनतम समाचार प्राप्त करें,news_query
न्यूयॉर्क के आसपास की नवीनतम घटनाएँ दिखाएँ,recommendation_events
क्या आप न्यूयॉर्क में कुछ मनोरंजन का सुझाव दे सकते हैं?,recommendation_events
मुझे न्यूयॉर्क में ट्रैफ़िक पर अपडेट दें,transport_traffic
न्यूयॉर्क में तारीख,datetime_query
न्यूयॉर्क में होने वाले सभी हैलोवीन कार्यक्रमों की एक सूची बनाएं,calendar_query
न्यूयॉर्क में क्या समय है?,datetime_query
न्यूयॉर्क में देखने के लिए पाँच गंतव्यों को कवर करने वाली ट्रेन यात्रा बुक करें,transport_ticket
न्यूयॉर्क के लिए टिकट,transport_ticket
न्यूयॉर्क के लिए अगली ट्रेन कब है,transport_query
न्यूयॉर्क के लिए कैब बुक करें,transport_taxi
मेरे लिए न्यूयॉर्क का सबसे सस्ता ट्रेन टिकट बुक करें,transport_ticket
न्यूयॉर्क के लिए ट्रेन टिकट बुक करें,transport_ticket
न्यूयॉर्क के लिए ट्रेन टिकट बुक करें,transport_ticket
कृपया मुझे न्यूयॉर्क के लिए ट्रेन टिकट खरीदने के तरीके के बारे में जानकारी भेजें,transport_query
न्यूयॉर्क के लिए ट्रेन का समय,transport_query
मुझे न्यूयॉर्क का वर्तमान समय बताएं,datetime_query
न्यूज़ एक्सप्रेस से क्या समाचार अपडेट हैं,news_query
न्यूज एक्सप्रेस में क्या हो रहा है,news_query
शाश्वत को परिभाषित करें,qa_definition
बकाया भुगतान के बारे में पूछने के लिए एलेक्स को एक मेल भेजें,email_sendemail
आइए सभी लंबित अनुस्मारक देखें,calendar_query
मुझे स्टेशन से स्थान तक ट्रेन का समय बताएं,transport_query
स्टेशन को बयासी दशमलव चार पर बदलें,play_radio
स्टेशनरी से पेंसिल हटाओ,lists_remove
स्तर के अंत में स्पीकर का वॉल्यूम कम करें,audio_volume_mute
रंग की अपारदर्शिता बदलें,iot_hue_lightchange
रंग को हल्के से गहरे रंग में बदलें,iot_hue_lightchange
रंग बदलना,iot_hue_lightchange
रुकें और फिर से शुरू करें.,general_repeat
रुकें और जो मैंने अभी कहा है उसे एक बार फिर से आज़माएँ।,general_repeat
"रुकें, मुझे लगता है कि यह सही आदेश नहीं है।",general_negate
"रुकें, यह सही उत्तर नहीं है.",general_negate
"रुकें, आपने अनुरोध का सही निर्देश नहीं दिया।",general_negate
कंपनी को एक ट्वीट भेजें,social_post
कंपनी की बैठक के बारे में तीसरे मार्च को एक अधिसूचना निर्धारित करें,calendar_set
कंपनी को बताएं कि उनकी सेवा खराब है,social_post
कंपनी अभी वैक्यूम क्लीनर पर काम कर रही है,iot_cleaning
मुझे स्थायी रॉक विरोध पर अद्यतन करें,news_query
अनुस्मारक के लिए अलार्म सेट करें,alarm_set
कृपया अनुस्मारक सेट करें,calendar_set
अनुस्मारक,calendar_set
याद दिलाने के लिए धन्यवाद।,general_praise
तुम मेरे कपड़े कब धोओगे?,general_quirky
क्या आप मेरे लिए रोशनी रोशन कर सकते हैं?,iot_hue_lightup
आप क्या कर रहे हो,general_quirky
"आपने धमाल मचाया,।",general_praise
मुझे गाना पसंद है क्या आपको?,music_likeness
"तुम होशियार हो, ओली।",general_praise
क्या तुम चुप रहोगे।,general_commandstop
आप खेलना चाहते हैं,play_game
"आप हीरो हैं, ओली।",general_praise
आप abc@gmail.com पर ईमेल भेज सकते हैं यह मेरा नया ईमेल पता है,email_sendemail
क्या आप कोक के खेल में दुश्मन की भूमिका निभा सकते हैं?,play_game
क्या आप एफएम आठ सौ नब्बे रेडियो चैनल शुरू कर सकते हैं?,play_radio
मैं चाहता हूं कि आप एफएम आठ सौ नब्बे रेडियो चैनल शुरू करें,play_radio
क्या आप ग्रेग को ईमेल भेजेंगे?,email_sendemail
आपको केएफआई को जांचना होगा कि वह सबसे अच्छा है,music_likeness
क्या आप आरएफआई खेल सकते हैं?,play_music
क्या आप सैमसंग से संपर्क कर सकते हैं और कह सकते हैं कि मेरे वॉशर में आग लग गई है,social_post
क्या आप बंद कर देंगे?,general_commandstop
क्या आप इसे थोड़ा बढ़ा सकते हैं?,audio_volume_up
मैं तुम्हें इतनी ज़ोर से दोहराते हुए नहीं सुन सका,audio_volume_up
क्या आप इसे जांच सकते हैं।,general_confirm
क्या आप कृपया इसकी जाँच करेंगे?,general_confirm
"आपने इसे सही ढंग से किया है, इसकी सराहना की जाएगी, ऑली।",general_praise
आपने इसे सही ढंग से किया है.,general_affirm
आपने इसे पूरी तरह से किया है.,general_affirm
क्या आपने इसे सही ढंग से समझा?,general_confirm
आपने इसे बिल्कुल ठीक से समझ लिया है।,general_affirm
तुम्हें बिल्कुल वही मिल गया है।,general_affirm
तुम्हें बिल्कुल वही मिल गया है।,general_affirm
क्या आप उसे ठुकरा सकते हैं?,audio_volume_down
मैं चाहता हूं कि आप इसे रोकें।,general_commandstop
आपने यह काम बखूबी किया है.,general_affirm
क्या आप इसे एक बार फिर बोल सकते हैं?,general_repeat
आपकी इसे फ़िर से करने की इच्छा है।,general_repeat
मैं चाहूंगा कि आप इसे रद्द करें।,general_commandstop
मुझे पसंद है कि आप इसे रद्द कर दें।,general_commandstop
मैं चाहूंगा कि आप इसे रद्द करें.,general_commandstop
मैं चाहता हूं कि आप इसे रद्द कर दें।,general_commandstop
"आपने यह सही किया है, इसकी सराहना की जाएगी।",general_praise
"तुमने यह सही किया है, मस्क ने इसकी सराहना की, ओली।",general_praise
आपने यह सही किया है.,general_praise
"मैं नहीं चाहता था कि आप वह संदेश भेजें, फिर भी मेरे कहने तक प्रतीक्षा करें कि भेजो",email_sendemail
मुझे आपके द्वारा सेट किए गए अलार्म के बारे में बताएं,alarm_query
"आप अद्भुत हैं, धन्यवाद.",general_praise
"आप अद्भुत हैं, मैं इसकी सराहना करता हूं।",general_praise
"आप कमाल हैं,।",general_praise
मैं चाहता हूँ कि आप अलार्म सेट करें,alarm_set
क्या आप निर्देश की पुष्टि कर सकते हैं?,general_confirm
क्या आप कृपया निर्देश की जाँच करेंगे?,general_confirm
क्या आप निर्देश की जांच और पुष्टि करेंगे?,general_confirm
"आपने बहुत बढ़िया काम किया, बहुत बहुत धन्यवाद।",general_praise
आपने बहुत बढ़िया काम किया.,general_praise
आपने बहुत बढ़िया काम किया.,general_praise
आपके द्वारा भेजा गया अलार्म जानना चाहूंगा,alarm_query
क्या आप ऑडियो को रोक सकते हैं और रिवाइंड कर सकते हैं और फिर से शुरू कर सकते हैं,play_audiobook
मैं चाहता हूं कि आप ऑडियो को तेजी से आगे बढ़ाएं और फिर से शुरू करें,play_audiobook
मुझे लगता है कि आपको यह सही नहीं लगा.,general_negate
मुझे लगता है कि आपने यह सब गलत तरीके से किया है।,general_negate
क्या आप इस मुद्दे पर तथ्यों की जांच कर सकते हैं?,calendar_query
मुझे समझ नहीं आया कि आपने अभी क्या कहा।,general_explain
क्या आप अभी-अभी कहे गए अपने वाक्यांश को दोबारा दोहरा सकते हैं?,general_repeat
आपने अभी जो कहा उसके बारे में मैं स्पष्ट नहीं था।,general_explain
क्या आप कृपया जांच कर सकते हैं और पुष्टि कर सकते हैं कि अभी क्या कहा गया है?,general_confirm
क्या आप मुझे एक बार फिर से वही बताएंगे जो आपने अभी कहा था।,general_explain
क्या आप अधिक धीरे से बोल सकते हैं?,audio_volume_up
आपने अपनी समझ सही ढंग से बनाई है।,general_affirm
तुमने ठीक से समझ लिया है।,general_affirm
क्या आप असली हैं,general_quirky
"आप मददगार हैं, धन्यवाद.",general_praise
"आप मददगार हैं, सराहना की जाती है।",general_praise
"आप मददगार हैं, मस्क ने सराहना की।",general_praise
आप स्टील कैसे बनाते हैं,general_quirky
आप आलू को किस तापमान पर पकाते हैं,cooking_recipe
आप कैसे हैं,general_quirky
आप कुकीज़ कैसे बनाते हैं,cooking_recipe
आप बेसाल्ट कैसे प्राप्त कर सकते हैं,general_quirky
आप पास्ता कैसे बनाते हैं,cooking_recipe
आप कितनी बार अपडेट पूरा करते हैं,general_quirky
मैं चाहता हूं कि आप मेरे लिए यह गेम खेलें,play_game
क्या आप मेरे लिए उबर बुक कर सकते हैं?,transport_taxi
मुझे चाहिए कि आप मेरे लिए एक टैक्सी बुक करें,transport_taxi
क्या आप मेरे लिए आरओआईपी में हेरफेर कर सकते हैं?,general_quirky
यदि आप मेरे लिए स्टेटस पोस्ट करेंगे तो अच्छा रहेगा,social_post
मैं चाहता हूं कि आप मेरे लिए ट्रेन टिकट बुक करें,transport_ticket
क्या आप मेरे लिए रेल टिकट बनवा सकते हैं?,transport_ticket
क्या आप मुझे एक चुटकुला सुना सकते हैं?,general_joke
क्या आप मुझे टेकआउट का आदेश दे सकते हैं?,takeaway_order
मुझे अच्छा लगा कि आप कृपया मेरे अंतिम आदेश की पुष्टि करें।,general_confirm
तुम्हें मेरे निर्देश ठीक-ठीक मिल गये हैं।,general_affirm
क्या आप मेरा गणित हल कर रहे हैं?,qa_maths
क्या तुम मेरे सबसे अच्छे दोस्त बन सकते हो?,general_quirky
"आप मेरे स्टार हैं, आपका बहुत-बहुत धन्यवाद।",general_praise
आपने मेरा नाम ठीक से नहीं बताया.,general_negate
आपने मेरे निर्देशों को ठीक से समझ लिया है।,general_affirm
"आप मेरे हीरो हैं, सराहना की जाती है।",general_praise
"आप मेरे हीरो हैं, बहुत बहुत धन्यवाद, ओली।",general_praise
आपने कौन से अलार्म सेट किए हैं?,alarm_query
इससे आपका क्या तात्पर्य है?,general_explain
आपका क्या मतलब है।,general_explain
इससे आपका क्या मतलब था?,general_explain
उससे आपका क्या मतलब है।,general_explain
क्या कोई मुझे बता सकता है कि आप लोग क्या चर्चा कर रहे हैं?,social_query
"आपने मुझे गलत तारीख बताई, कृपया इसे ठीक करें।",general_negate
क्या आप मेरे साथ एक गेम खेलना चाहेंगे?,play_game
कृपया ऐसा खेल चुनें जिसे आप मेरे साथ खेल सकें,play_game
उन खेलों की सूची बनाएं जिन्हें आप मेरे साथ खेल सकते हैं,play_game
आपने मुझे ग़लत समझा है।,general_negate
आप मुझे गलत रास्ते पर ले जा रहे हैं.,general_negate
