text,category
रसोई की लाइटें बंद कर दो,iot_hue_lightoff
अब रसोई की लाइटें धीमी करने का समय आ गया है,iot_hue_lightdim
रसोई की लाइट बंद कर दो,iot_hue_lightoff
रसोई की लाइट चालू करो,iot_wemo_on
रसोई में लाइट बंद कर दो,iot_hue_lightoff
रसोई से स्वास्थ्य शो प्रसारित करें,play_radio
मैं चाहूंगा कि रसोई में एक अलग रंग हो,iot_hue_lightchange
क्या आप कृपया रसोई में ओवरहेड लाइट बंद कर सकते हैं,iot_hue_lightoff
रसोई में रोशनी को नीला कर दें,iot_hue_lightchange
मैं चाहता हूँ कि रसोई की लाइट बंद रहे,iot_hue_lightoff
मुझे रसोई में धीमी रोशनी दो,iot_hue_lightdim
रसोई में रोशनी कम करो,iot_hue_lightdim
रसोई में लाइटें बंद कर दें,iot_hue_lightoff
रसोई में रोशनी जलाओ,iot_hue_lighton
रसोई में लाइट बंद कर दो,iot_hue_lightoff
रसोई की सफ़ाई के लिए रूमबा ले आओ,iot_cleaning
रसोई को वैक्यूम करें,iot_cleaning
व्यंजनों,cooking_recipe
मुझे खाना पकाने वाली वेबसाइटें दिखाओ,cooking_recipe
खाना पकाने की विधि,cooking_recipe
रेसिपी साइट के बारे में माँ के मेल संदेश का जवाब दें,email_sendemail
झूमर को पूरा ऊपर घुमाएँ,iot_hue_lightup
अनियंत्रित ईमेल पढ़ें,email_query
कृपया जांचें और पुष्टि करें।,general_confirm
जांचें और मुझे मेरे मित्र एलेक्स का पता बताएं,email_querycontact
इसे सही ढंग से समझ लिया.,general_affirm
बिलकुल समझ गया.,general_affirm
"आपने यह सही किया है, आपका बहुत-बहुत धन्यवाद।",general_praise
आपने इसे सही ढंग से किया है धन्यवाद.,general_praise
आपने यह सही किया है धन्यवाद.,general_praise
आपने यह सही किया है धन्यवाद.,general_praise
"आपने यह सही ढंग से किया है, बहुत-बहुत धन्यवाद।",general_praise
"आपने यह सही किया, बहुत बहुत धन्यवाद।",general_praise
"आपने यह सही किया है, धन्यवाद, ओली।",general_praise
"आपने इसे सही ढंग से किया है, धन्यवाद, ओली।",general_praise
बिलकुल सटीक उत्तर मिला.,general_affirm
सही ढंग से।,general_affirm
समय पर अपॉइंटमेंट हटाएं,calendar_remove
सही समय क्या है,datetime_query
सही गेम खोजें,play_game
"उत्तम कार्य, तुमने अच्छा किया, ओली।",general_praise
"उत्तम कार्य, आपने अच्छा किया है।",general_praise
एकदम सही।,general_affirm
कृपया मुझे बिना चीनी वाली कॉफ़ी परोसने में मदद करें,iot_coffee
कपड़े धोना शुरू करो,iot_wemo_on
वॉश जींस को लॉन्ड्री सूची में जोड़ें,lists_createoradd
"यह थोड़ा अंधेरा है, रोशनी बढ़ाएँ",iot_hue_lightup
छना मेरेया गीत को मेरी प्लेलिस्ट में सहेजें,music_likeness
बिजली बिल भुगतान के लिए शनिवार सुबह नौ बजे के लिए रिमाइंडर अलर्ट सेट करें,calendar_set
शनिवार सुबह फुटबॉल अभ्यास के लिए सुबह आठ बजे का अलार्म सेट करें,alarm_set
शनिवार दोपहर दो बजे के बाद एंटवर्प जाने वाली ट्रेनों को प्रदर्शित करें,transport_query
शनिवार शाम चार बजे जोआना के साथ बैठक तय की गई,calendar_set
कृपया शनिवार अपराह्न तीन बजे के लिए अनुस्मारक अलार्म सेट करें,alarm_set
शनिवार को यॉर्क के लिए ट्रेन पकड़ने का सबसे सुविधाजनक समय कौन सा है?,transport_query
शनिवार को मौसम कैसा रहेगा,weather_query
शनिवार के लिए मेरा कैलेंडर साफ़ करें,calendar_remove
शनिवार के लिए मेरे कामों की सूची में डाकघर जोड़ें,lists_createoradd
शनिवार के लिए मेरे जागने वाले अलार्म सेट से छुटकारा पाएं,alarm_remove
कृपया मेरे कैलेंडर में शनिवार को मैरी के साथ रात्रि भोज जोड़ें,calendar_set
आप सनी साइड अप अंडे कैसे बनाते हैं?,cooking_recipe
सॉकेट बंद,iot_wemo_off
सॉकेट बंद करें,iot_wemo_off
सॉकेट बंद करें,iot_wemo_off
सॉकेट बंद करें,iot_wemo_off
सॉकेट बंद करें,iot_wemo_off
सॉकेट बंद करें,iot_wemo_off
सॉकेट को बंद स्थिति में रखें,iot_wemo_off
सॉकेट चालू करें,iot_wemo_on
मेरे लिए सॉकेट उपलब्ध कराओ,iot_wemo_on
सॉकेट बंद करें,iot_wemo_off
सैक्रामेंटो में आज रात क्या हो रहा है?,recommendation_events
मुझे सैक्रामेंटो में कार्यक्रम दिखाओ,recommendation_events
क्या आप मुझे बता सकते हैं कि चॉकलेट चिप कुकीज कैसे बनाई जाती है?,cooking_recipe
क्या मुझे चॉकलेट ब्राउनी की विधि मिल सकती है?,cooking_recipe
सैंडी को एक पुष्टिकरण ईमेल भेजें,email_sendemail
क्या मेरे पास सैंडी से एक नया ईमेल है?,email_query
डिवाइस में सहेजा गया बराक ओबामा का पॉडकास्ट चलाएं,play_podcasts
चॉपिन खेलें,play_music
सॉफ्टबॉल खेल के बारे में जेम्स को ईमेल करें जेम्स हमें आगे बढ़ने से पहले कुछ जलपान प्राप्त करने की आवश्यकता है,email_sendemail
डाइनिंग रूम में स्मार्ट सॉकेट चालू करें,iot_wemo_on
भोजन कक्ष बंद करें,iot_hue_lightoff
भोजन कक्ष को वैक्यूम करें,iot_cleaning
भोजन क्षेत्र में प्रकाश को निम्नतम स्तर पर स्विच करें,iot_hue_lightdim
क्या आप मुझे खाने के लिए कोई अच्छी जगह बता सकते हैं?,recommendation_locations
मुझे सैम को बताने के लिए एक मज़ेदार चुटकुला चाहिए,general_joke
कृपया मुझे बताएं कि सैम का जन्मदिन कब है,email_querycontact
कल समुराई जैक पर क्या हुआ?,news_query
सैम की पार्टी रद्द करें,calendar_remove
मुझे सैम स्मिथ ssmith@yahoo dot com के लिए यह नया संपर्क जोड़ने की आवश्यकता है,email_addcontact
सैम हैरिस ऑडियोबुक चलाएं,play_audiobook
कृपया सैमसंग कंपनी के लिए आज के स्टॉक मूल्य खोजें,qa_stock
सैमसंग को मेरे टीवी के बारे में शिकायत का एक ट्वीट लिखें,social_post
सैमसंग पर ट्वीट त्रुटि लॉग,social_post
क्या आप मुझे बता सकते हैं कि गाड़ी क्या है?,qa_definition
क्या सारा ने आज कुछ भी पोस्ट किया है?,social_query
क्या सारा ने मुझे कॉल करने की कोशिश की?,email_querycontact
सारा और जेमी के साथ डिनर शेड्यूल करें,calendar_set
क्या मेरे पास सारा की ओर से कोई नया ईमेल है?,email_query
क्या मुझे सारा से कोई ईमेल मिला?,email_query
कृपया सारा की ओर से मेरे संपर्कों में एक नया ईमेल जोड़ें,email_addcontact
सारा के मेल के लिए इनबॉक्स जांचें,email_query
सारा के घर का फ़ोन नंबर क्या है?,email_querycontact
सारा को बुलाओ,calendar_set
मैं सारा तक कैसे पहुंचूं?,email_querycontact
मैं सारा कैसे डायल करूं?,email_querycontact
चार्ल्स का ईमेल क्या है,email_querycontact
मुझे चार्ल्स का टेलीफ़ोन नंबर दीजिए,email_querycontact
चार्ल्सटन वेस्ट वर्जीनिया के लिए सुबह आठ बजे की यात्रा के लिए ट्रेन टिकट बुक करें,transport_ticket
चार्ली चैपलिन को क्या हुआ?,general_quirky
क्या चार्ली का स्टीकहाउस डिलीवरी करता है,takeaway_query
कृपया चार्ली के स्टीकहाउस डिलिवरी का पता लगाएं,takeaway_query
देखें कि चार्ली का स्टीकहाउस डिलीवर करता है या नहीं,takeaway_query
मैं चार्लोट में क्या कर सकता हूँ?,recommendation_events
चार्लोट को ईमेल का उत्तर दें,email_sendemail
क्या सड़क एक मुक्त मार्ग है या टोल रोड है,transport_traffic
सड़क यातायात,transport_traffic
क्या सैन डिएगो में आज बारिश होने वाली है?,weather_query
मुझे सैन पाउलो ब्राज़ील में वर्तमान समय बताएं,datetime_query
सैन फ्रांसिस्को से न्यूयॉर्क तक ट्रेन का समय क्या है?,transport_query
मुझे आज रात सैन फ्रांसिस्को में रात्रि भोज के लिए कहाँ जाना चाहिए?,recommendation_events
क्या आप मुझे सैन फ्रांसिस्को में समय बता सकते हैं?,datetime_query
सैन फ्रांसिस्को में बे ब्रिज पर यातायात कैसा है,transport_traffic
सैन फ्रांसिस्को के लिए ट्रेन कितने बजे आने वाली है?,transport_query
सैन फ्रांसिस्को के लिए ट्रेन टिकट की कीमत कितनी है?,transport_query
सीएनएन पर राजनीति में क्या खबर है?,news_query
मुझे गंतव्य स्थान के लिए लोकल ट्रेन का समय सीएसटीएम बताएं,transport_query
शिकागो इलिनोइस में वर्तमान मौसम की स्थिति क्या है,weather_query
मुझे शिकागो से मियामी की दिशा बताओ,transport_query
ब्रिटिश एयरवेज ने ट्वीट किया कि शिकागो से लंदन की मेरी आखिरी उड़ान में देरी हुई,social_post
मुझे शिकागो में आगामी कार्यक्रम दिखाओ,recommendation_events
क्या आप कृपया मुझे शिकागो के लिए अगली चार निर्धारित ट्रेनों के बारे में बता सकते हैं,transport_query
शिकागो के लिए मौसम का पूर्वानुमान क्या है?,weather_query
सुबह शिकागो जाने वाली ट्रेन का समय क्या है?,transport_query
"अरे, मुझे सिगुर रोस का संगीत पसंद है",music_likeness
चिकन टिक्का रेसिपी दिखाएँ,cooking_recipe
चिकन टिक्का कैसे बनाये,cooking_recipe
मेरे लिए चिकन नूडल सूप की विधि ढूंढो,cooking_recipe
क्या आप कृपया मुझे बता सकते हैं कि सिंगापुर में क्या समय है,datetime_query
सिंगापुर में क्या समय हुआ है,datetime_query
लीड्स शहर के लिए ट्रेन टिकट बुक करें,transport_ticket
मेरे लिए लीड्स शहर की ट्रेन का टिकट ले आओ,transport_ticket
सिंडी का पसंदीदा पॉडकास्ट चलाएं,play_podcasts
चिपोटल से छह चिकन टैकोस ऑर्डर करें,takeaway_order
क्या चिपोटल रेस्तरां में कोई टेकअवे है?,takeaway_query
चिपोल्टे में सामान्य बरिटो के लिए ऑर्डर दें,takeaway_order
सिएटल में सबसे अच्छा मेक्सिकन रेस्तरां कौन सा है?,recommendation_locations
कृपया सिएटल में एक रेस्तरां की सिफारिश करें,recommendation_locations
सिएटल में खाने के लिए अच्छी जगह कहाँ है?,recommendation_locations
सिएटल के लिए एक नॉन-स्टॉप ट्रेन खोजें,transport_ticket
क्या सिएटल में बर्फबारी हो रही है,weather_query
सिया के सस्ते रोमांच को आगे खेलने के लिए तैयार करें,play_music
सिरी ने एनसी के लिए ट्रेन टिकट ढूंढे,transport_query
सिरी येन में डॉलर क्या है,qa_currency
सिरी जापानी येन में एक अमेरिकी डॉलर क्या है,qa_currency
सिरी जिगगुराट की परिभाषा क्या है?,qa_definition
मुझे हंसाने के लिए कोई मज़ेदार चुटकुला सुनाओ,general_joke
मेरी ओर एक हंसी भेजो,general_joke
सीरियाई गृहयुद्ध पर नवीनतम अपडेट,news_query
सीरियस पर हावर्ड स्टर्न खेलें,play_radio
सीरियस पर जाएं और हिप हॉप चैनल चलाएं,play_radio
सीरियस ऐप खोलें और क्लासिकल चैनल चलाएं,play_radio
कुछ संगीत चालू करें,play_music
कुछ स्थानीय घटनाएँ क्या हैं?,recommendation_events
कुछ कॉफ़ी पकाओ,iot_coffee
कुछ अच्छे चुटकुले खोलें,general_joke
क्या किसी विशेष सड़क पर यातायात मुक्त है,transport_traffic
किसी विशेष क्षेत्र में सड़क चौड़ी या संकरी है,transport_traffic
कुछ दिनों की अवधि में होने वाली बैठकों के बारे में मुझे सूचित करें,calendar_query
कुछ बॉय बैंड संगीत बजाओ,play_music
कुछ यातायात सड़कें,transport_traffic
अब कुछ यूरो बेचने का अच्छा समय है,qa_stock
कुछ रेडियो चालू करो,play_radio
कुछ रोशनी फैलाओ,iot_hue_lightup
कुछ चुटकुले कहो,general_joke
स्पाइडर खेलना शुरू करें,play_game
कृपया मुझे बताएं कि सिलेंडर की परिभाषा क्या है?,qa_definition
सिल्विया का ईमेल पता क्या है?,email_querycontact
क्या आप रेड अक्टूबर के लिए शिकार खेल सकते हैं?,play_audiobook
लाल रंग की रोशनी पर स्विच करें,iot_hue_lightchange
क्या आप रंग को लाल में बदल सकते हैं?,iot_hue_lightchange
शिवाजी नगर में कौन सा रेस्टोरेंट है?,recommendation_locations
सबसे अच्छी चॉकलेट चिप कुकी रेसिपी क्या है?,general_quirky
आपके अनुसार सबसे अच्छा दशक कौन सा था?,general_quirky
सर्वश्रेष्ठ रैप संगीत,play_music
मुझे शीर्ष रेटेड पॉडकास्ट दिखाएं,play_podcasts
बेस्ट बाय स्टिक में क्या बदलाव है,qa_stock
सर्वोत्तम खरीदारी के लिए शिकायत लिखें,social_post
सर्वोत्तम स्पेगेटी रेसिपी खोजें,cooking_recipe
उत्कृष्ट।,general_affirm
रोशनी थोड़ी बढ़ाओ,iot_hue_lightup
रोशनी को थोड़ा ऊपर उठाएं,iot_hue_lightup
छोटी औरतें खेलें,play_audiobook
छोटी चीज़ों के देवता की भूमिका निभाएँ,play_audiobook
छोटी चीज़ों के भगवान पर रखो,play_audiobook
चीता कैसा दिखता है,qa_definition
वह कौन सी तारीख थी जब सिनसिनाटी ओहियो में प्लम स्ट्रीट मंदिर का निर्माण किया गया था,qa_factoid
यादृच्छिक संगीत बजाओ,play_music
यादृच्छिक रेडियो स्टेशन चलाएं,play_radio
सीरियल पॉडकास्ट ढूंढें और इसे चलाएं,play_podcasts
सीरियल पॉडकास्ट चलाएं,play_podcasts
चीनी भोजन के लिए सबसे अधिक रेटिंग वाले डिलीवरी विकल्प,takeaway_query
क्या चीनी डिलीवरी करता है,takeaway_query
चाइना बुफ़े से कॉम्बो प्लेट का ऑर्डर दें,takeaway_order
अभी चीन में क्या समय हुआ है,datetime_query
चीन में पचास अमेरिकी डॉलर कितने होते हैं?,qa_currency
चीन में समय दिखाओ,datetime_query
चीन में समय क्या है,datetime_query
चीन की राजधानी क्या है,qa_factoid
शॉन कॉनरी के बारे में विकिपीडिया पृष्ठ,qa_factoid
शॉन कॉनरी का जन्मदिन क्या है?,qa_factoid
क्या आप पनीर सैंडविच बना सकते हैं,cooking_recipe
चीज़केक कैसे बनाएं,cooking_recipe
बेक और ब्रोइल में क्या अंतर है,cooking_recipe
स्टैचू ऑफ़ लिबर्टी कहाँ स्थित है?,qa_factoid
स्टैच्यू ऑफ लिबर्टी का विवरण दीजिए,qa_definition
स्वतंत्रता की प्रतिमा का वर्णन करें,qa_definition
सफ़ाई शुरू करो,iot_cleaning
सफाई प्रक्रिया आरंभ करें,iot_cleaning
"सफ़ाई अच्छी है, धूल बहुत ख़राब है, अब अपना जादू करो, मेरा कालीन साफ़ करो",iot_cleaning
सबवे से हैम और पनीर सैंडविच ऑर्डर करें,takeaway_order
वॉल स्ट्रीट जर्नल समाचार प्रदान करें,news_query
वेमो को बंद करें,iot_wemo_off
यदि स्विच चालू है तो चालू करें अन्यथा बंद कर दें,iot_wemo_on
घूर्णनशील घटना सेट करें,calendar_set
आसपास क्या है,recommendation_locations
क्या आसपास कोई कार्यक्रम है,recommendation_events
चारों ओर कालीन बिछाओ,iot_cleaning
दौरे की सूची में क्या शामिल है,lists_query
क्या मेरे पास सुसान के लिए कोई कार्य संख्या है?,email_querycontact
सुसान के लिए ईमेल तैयार करें,email_sendemail
हॉट नब्बे सात खेलें,play_radio
एक गरम कॉफ़ी चाहिए,iot_coffee
सोशल मीडिया के चर्चित विषय क्या हैं?,social_query
सुपर गाना,music_likeness
सुपर मारियो लॉन्च करें,play_game
सुपर मार्केट के पास,recommendation_locations
सूर्यास्त कब है,qa_factoid
मुझे दोपहर में धूप से बचने के लिए दुपट्टे की जरूरत पड़ेगी,weather_query
मुझे सूर्य और चंद्रमा के बीच की दूरी बताओ?,qa_factoid
आप सूर्य का वर्णन कैसे करेंगे?,qa_definition
सूरज कितना दूर है,qa_factoid
सनसेट बुलेवार्ड पर ट्रैफ़िक कितना ख़राब है,transport_traffic
तूफ़ान क्या है,qa_definition
मुझे तूफ़ान के बारे में सब बताओ,qa_definition
