text,category
किसे चुनना है इसके बारे में कोई विचार नहीं है।,general_dontcare
किसी एक को चुनने में कोई आपत्ति नहीं है.,general_dontcare
किसी एक को चुनने में कोई आपत्ति नहीं है.,general_dontcare
किसी एक को चुनने में कोई आपत्ति नहीं है.,general_dontcare
किसी एक को चुनने में कोई आपत्ति नहीं होगी.,general_dontcare
मुझे वास्तव में किसी एक को चुनने में कोई आपत्ति नहीं है।,general_dontcare
कितने अलार्म सेट हैं,alarm_query
कितने अलार्म सूचीबद्ध हैं,alarm_query
दो सौ दस पाउंड कितने किलोग्राम हैं?,qa_factoid
बारह पेसोस कितने डॉलर है,qa_currency
आपने कितने बजे का अलार्म लगाया है,alarm_query
मेरा अलार्म मुझे कितने बजे जगाएगा,alarm_query
किस जगह पर ज्यादा ट्रैफिक है,transport_traffic
किन दुकानों को मंजूरी है,recommendation_locations
किस दुकान पर सबसे सस्ता तीन पौंड बीफ़ रम्प है,recommendation_locations
क्या ट्रे ने कोई संदेश भेजा?,email_query
बिना किसी ट्रैफ़िक से प्रभावित हुए शहर तक अपने काम तक पहुंचने का सबसे तेज़ तरीका क्या है?,transport_query
क्या आप मुझे बता सकते हैं कि किस फिल्म की समीक्षा सबसे अच्छी है?,recommendation_movies
आप यहां किस कपड़े की दुकान की सिफारिश करेंगे?,recommendation_locations
किसी भी फास्ट फूड भोजन की पेशकश,takeaway_order
सबसे अधिक जनसंख्या किस देश की है,qa_factoid
किसी भी देश का संगीत स्टेशन चलाएँ,play_radio
कौन सी मुद्रा बड़ी है अमेरिकी डॉलर या येन,qa_currency
आपने मेरे लिए किस समय का अलार्म लगाया है?,alarm_query
मैं किस समय स्थान की यात्रा कर सकता हूं?,transport_query
जैज़ उत्सव में कौन से पब भाग लेते हैं,recommendation_events
अभी कौन सा गाना चल रहा है,music_query
आज किस रूट पर ट्रैफिक कम है,transport_traffic
कोई भी पॉप एफएम चैनल चलाओ,play_radio
मुझे बताएं कि किस म्यूचुअल फंड में अधिकतम वार्षिक रिटर्न है,qa_stock
किसी भी प्रकार की सूची को हटा दें,lists_remove
कौन सा सप्ताह तेईसवां है,datetime_query
कोई भी खेल आयोजन मेरी सूची में है,lists_query
मुझे किस तापमान पर कुकीज़ बेक करनी चाहिए,cooking_recipe
संगीत किस फिल्म से आया है संगीत का नाम क्या है,music_query
क्या मेरे पास किसी सूची में कुछ भी उत्कृष्ट है?,lists_query
"मैंने इस रिफ़ को पहले भी सुना है कि किस गाने ने इस रिफ़ को चुराया है, यह बिल्कुल वैसा ही है",music_query
इस सप्ताह मेरे लिए सबसे अधिक मौसम कैसा रहा,weather_query
एथेंस को कैसे प्रशिक्षित करें,transport_query
शतरंज का एक अच्छा खेल कैसा रहेगा?,play_game
मुझे खाना बनाने का तरीका बताने के लिए Google का उपयोग करें,cooking_recipe
अभी बज रहा गाना कब रिलीज हुआ था,music_query
क्या आप मुझे किसी भी समय से समाचार प्राप्त कर सकते हैं?,news_query
अब तक का सबसे मजेदार चुटकुला कौन सा है?,general_joke
क्या एमी ने मुझे कोई नया ईमेल भेजा है?,email_query
क्या एमी की ओर से मेरा कोई नया ईमेल है?,email_query
एमिलिया का कार्य फ़ोन नंबर क्या है?,email_querycontact
जो एम्मा वॉटसन द्वारा अच्छी तरह से समीक्षा की गई फिल्में हैं,qa_factoid
एरिक नाम हटाओ,lists_remove
क्या आप मेरे लिए कुछ भैंस चिकन पिज़्ज़ा ऑर्डर कर सकते हैं,takeaway_order
एला फिट्जगेराल का खुश हो जाओ गाना बजाओ,play_music
मुझे एल्टन जॉन की कोई भी चीज़ पसंद है,music_likeness
मुझे सभी स्थानीय घटनाएँ बताओ,recommendation_events
कृपया सभी दिनों के लिए अलार्म सेट करें,alarm_set
क्या आप सारी बत्तियाँ मंद कर देंगे?,iot_hue_lightdim
एल्विस की पसंदीदा सवारी क्या है?,qa_factoid
एल्विस की मृत्यु के समय उनकी आयु कितनी थी?,qa_factoid
मुझे माउंट एवरेस्ट की ऊंचाई के बारे में जानना है,qa_factoid
कितना रेट कैलकुलेट किया जाएगा,qa_stock
हम कितनी जल्दी बारिश की उम्मीद कर सकते हैं?,weather_query
मुझे शाम सात सौ पैंतालीस बजे पुलाव को ओवन से बाहर निकालने की याद दिलाएँ,calendar_set
जागना चाहते हैं तो क्या आप कैपोचिनो ऑर्डर कर सकते हैं,iot_coffee
छिहत्तर को दो भागों में बांटो,qa_maths
मेरे लिए अमेरिकन आइडल शो खेलें,play_radio
मेरे लिए ऑफिस के लिए कैब बुक करो,transport_taxi
मेरे लिए संगीत बजाओ,play_music
मेरे लिए यह ऑडियोबुक चलाओ,play_audiobook
मेरे लिए इनबॉक्स द्वारा जांचें,email_query
मेरे लिए कुछ ट्वीट करो,social_post
मेरे लिए उबर बुलाओ,transport_taxi
मेरे लिए एक उबर बुक करो,transport_taxi
मेरे लिए एक कप कॉफ़ी शुरू करो,iot_coffee
मेरे लिए एक टैक्सी ढूंढो,transport_taxi
मेरे लिए टेकअवे ऑर्डर शुरू करें,takeaway_order
क्या आप कृपया मेरे लिए एक सूची बना सकते हैं?,lists_createoradd
क्या आप मेरे लिए एक नई सूची बना सकते हैं?,lists_createoradd
कृपया मेरे लिए एक नई सूची बनाएं,lists_createoradd
कृपया मेरे लिए एक नई सूची बनाएं,lists_createoradd
मेरे लिए एक नई सूची बनाओ,lists_createoradd
मेरे लिए एक नई सूची खोलें,lists_createoradd
मेरे लिए एक ट्रेन बुक करो,transport_ticket
क्या आप मेरे लिए कॉफी मशीन शुरू कर सकते हैं?,iot_coffee
मेरे लिए कैंडी क्रश गेम खेलें,play_game
क्या आप मेरे लिए रसोई की लाइट बंद कर सकते हैं?,iot_hue_lightoff
शाम को मेरे लिए कैब बुक करो,transport_taxi
मेरे लिए मिमो से एक बड़ा सादा पिज़्ज़ा ऑर्डर करें,takeaway_order
मेरे लिए रूमबा चालू करो,iot_cleaning
मेरे लिए रेडियो मिर्ची बजाओ,play_radio
मेरे लिए रोहन शर्मा पॉडकास्ट चलाओ,play_podcasts
मेरे लिए दिग्गजों की लीग शुरू करें,play_game
मेरे लिए रेडियो बजाओ,play_radio
मेरे लिए जैज़ संगीत बजाओ,play_music
क्या आप मेरे लिए जो की संपर्क जानकारी देखेंगे?,email_querycontact
मेरे लिए स्टार वार्स गेम खेलें,play_game
मेरे लिए हैरी पॉटर एंड द चैंबर ऑफ सीक्रेट्स गेम खेलें,play_game
मेरे लिए हिप हॉप संगीत बजाओ,play_music
क्या आप मेरे लिए अलार्म बंद कर देंगे?,alarm_remove
मेरे लिए संख्याओं की एक सूची बनाओ,lists_createoradd
मेरे लिए प्रकाश पुनः प्राप्त करो,iot_hue_lightup
कृपया मेरे लिए अंतिम ईमेल पढ़ें,email_query
मेरे लिए कुत्तों की सूची हटाओ,lists_remove
मेरे लिए एक कार्यस्थल का वर्णन करें,qa_definition
क्या आप मेरे लिए मेरे ईमेल जाँचेंगे?,email_query
क्या आप मेरे लिए ट्रेन टिकट की कीमतें देख सकते हैं?,transport_query
मेरे लिए वैक्यूम शुरू करो,iot_cleaning
क्या आप मेरे लिए जॉन का ईमेल पता प्राप्त कर सकते हैं?,email_querycontact
मुझे ऊंची आवाज़ चाहिए,audio_volume_up
मुझे और रोशनी चाहिए,iot_hue_lightup
मुझे और रोशनी चाहिए,iot_hue_lightup
मै उसे एक तरह से समझ नहीं पाया।,general_explain
मैं इसे पूरी तरह से समझ नहीं पा रहा हूं।,general_explain
मैं वह नहीं समझ सकता।,general_explain
मैं उसे समझ नहीं पाया.,general_explain
मैं इसके बारे में इतना स्पष्ट नहीं हूं।,general_explain
मुझे उस गाने से प्यार है,music_likeness
मुझे याद दिलाएं कि मुझे वह गाना पसंद है,music_likeness
मुझे पैनकेक दिखाओ,cooking_recipe
मेरे लिए अमेज़ॅन रेस्तरां खोजें,recommendation_locations
मेरे नजदीक एक टैक्सी सेवा ढूंढें,transport_taxi
मेरे आस-पास की स्थानीय घटनाएँ दिखाएँ,recommendation_events
मैं जानना चाहता हूं कि मेरे नजदीक कौन से सुपरमार्केट में ग्लूटेन मुक्त ब्रेड की कीमत सबसे अच्छी है,recommendation_locations
मेरे नजदीक शीर्ष रेस्तरां चेकआउट करें और शाही पैनर ऑर्डर करें,takeaway_order
मेरे आस-पास के सर्वश्रेष्ठ सर्कस के बारे में सूचित करें,recommendation_events
मेरे पास सबवे फूड सेंटर चेकआउट करें और तंदूरी रोटी ऑर्डर करें,takeaway_order
मेरे नज़दीक डोमिनोज़ सेंटर चेकआउट करें और चीज़ पिज़्ज़ा ऑर्डर करें,takeaway_order
क्या आप मेरे आस-पास के थिएटर में देखने के लिए कुछ फिल्में सुझा सकते हैं?,recommendation_movies
मेरे आस-पास के सिनेमाघरों में कौन सी फिल्में चल रही हैं,recommendation_movies
मुझे मेरे आस-पास का साप्ताहिक मौसम बताएं,weather_query
क्या आप मुझे मेरे आस-पास सबसे अधिक रेटिंग वाले चीनी कैरीआउट के मेनू पर निर्देशित कर सकते हैं,takeaway_order
मेरे आस-पास की दुकानों की सूची बनाओ,recommendation_locations
कृपया मेरे आस-पास सर्वोत्तम कपड़ों की दुकानों की सूची बनाएं,recommendation_locations
मेरे आस-पास सबसे अच्छा पिज़्ज़ा कौन सा है जो डिलीवर करता है,takeaway_order
मुझे कुछ सुशी चाहिए जो सबसे नजदीक हो,recommendation_locations
मेरी निकटतम उपलब्ध टैक्सी बुक करें,transport_taxi
मुझे मेरे नजदीकी सिनेमाघरों में चल रही सबसे अच्छी आईएमडीबी रेटिंग वाली फिल्म बताएं,recommendation_movies
मेरे नजदीक थिएटर,recommendation_movies
कृपया मेरे आस-पास कपड़ों की दुकानें देखें,recommendation_locations
मेरे निकटतम लाइट बंद कर दो,iot_hue_lightoff
मेरे आसपास कौन सी घटनाएँ घट रही हैं,recommendation_events
क्या आप मेरे लिए पड़ोस में एक सड़क मेला ढूंढ सकते हैं?,recommendation_events
मेरे पास पैदल चलने का रास्ता कहां है?,recommendation_locations
मेरे पास एक अच्छा वाइन बार कहाँ है?,recommendation_locations
क्या आप मुझे मेरे निकट कोई फ़र्निचर स्टोर ढूंढ सकते हैं?,recommendation_locations
मुझे मेरे पास चीनी खाना दिखाओ,takeaway_order
मुझे मेरे निकट डिलीवरी दिखाओ,takeaway_order
मुझे मेरे पास थाई खाना दिखाओ,recommendation_locations
मेरे निकट ग्लूटेन मुक्त बेकरी ढूंढें,recommendation_locations
मेरे आस-पास पिज़्ज़ा डिलीवरी वाले स्थान,takeaway_order
मेरे आसपास ट्रैफिक कैसा है,transport_traffic
मुझे कोई अलार्म नहीं चाहिए,alarm_remove
मुझे आर एन बी पसंद है,music_likeness
मुझे संगीत पसंद है,music_likeness
मुझे यह समझ नहीं आया.,general_explain
मुझे यह प्रश्न समझ नहीं आया लेकिन इसमें ऐसा क्या है,general_quirky
मुझे यह गाना बहुत पसंद है,music_likeness
क्या मैं इस सप्ताह छुट्टी पर हूँ?,calendar_query
मुझे यह लाइट पसंद नहीं है कृपया मुझे अन्य विकल्प दिखाएं,iot_hue_lightchange
मुझे अब कॉफ़ी चाहिए,iot_coffee
मुझे अब टैक्सी की सवारी की आवश्यकता है,transport_taxi
मुझे इस वक्त टैक्सी की जरूरत है,transport_taxi
अभी मेरे लिए कैप्पुकिनो शुरू करो,iot_coffee
मुझे अब कुछ कॉफ़ी पसंद है,iot_coffee
मैं स्मार्ट सॉकेट को अभी बंद करना चाहता हूं,iot_wemo_off
मुझे मशीन से कॉफ़ी चाहिए,iot_coffee
"मुझे दो बर्गर और एक कोक चाहिए, जल्दी ऑर्डर करें",takeaway_order
मुझे दो पिज़्ज़ा चाहिए स्टेट,takeaway_order
मेरे लिए दो हैमबर्गर ऑर्डर करें,takeaway_order
क्या आप मेरे लिए रात का खाना बना सकते हैं?,general_quirky
क्या मुझे आज हल्के या भारी जैकेट की ज़रूरत है?,weather_query
मुझे आज अपनी टोपी की जरूरत है,weather_query
क्या मुझे आज छाते की आवश्यकता होगी?,weather_query
क्या मुझे आज डॉक्टर से अपॉइंटमेंट लेनी है?,calendar_query
क्या मुझे आज जूते चाहिए?,weather_query
आज दोपहर को मेरी एक बैठक है,calendar_set
मुझे आज तीन लोगों के लिए अलार्म चाहिए,alarm_set
क्या आज मेरी बिक्री बैठक है?,calendar_query
मुझे कुछ और रोशनी चाहिए,iot_hue_lightup
"मुझे दस मिनट में अपनी फ़िल्टर कॉफ़ी की आवश्यकता होगी, कृपया कॉफ़ी मेकर से तदनुसार पूछें",iot_coffee
मुझे और दूध चाहिए,lists_createoradd
मेरे लिए कुछ खाना ले आओ,takeaway_order
मैं वास्तव में संगीत स्का,music_likeness
"मैं वास्तव में नहीं जानता, ओली।",general_dontcare
"मैं वास्तव में नहीं जानता, ओली।",general_dontcare
जब मुझे उत्साह बढ़ाने की आवश्यकता हो तो उस गीत को अपने पास रखें,music_likeness
मुझे बैंगनी रोशनी चाहिए,iot_hue_lightchange
मेरे लिए खाना ले जाओ,takeaway_order
मुझे किसी भी चीज़ से कोई फ़र्क नहीं पड़ता.,general_dontcare
"आइए मेरे खिलाफ नौ गेंदें खेलें, अपने कौशल स्तर के साथ अनुकूलन करें और मुझे हमेशा जीतने दें",play_game
मेरे खिलाफ खुला शतरंज खेलो,play_game
"जो कुछ भी मेरे लिए अच्छा होगा, ओली।",general_dontcare
जो भी होगा मेरे लिए ठीक होगा.,general_dontcare
जो कुछ भी मेरे साथ ठीक है.,general_dontcare
जो भी मेरे लिए ठीक है.,general_dontcare
जो कुछ भी मेरे साथ ठीक है.,general_dontcare
जो कुछ भी मेरे लिए ठीक होगा.,general_dontcare
मेरे लिए कुछ भी ठीक है.,general_dontcare
मेरे साथ कुछ भी ठीक है.,general_dontcare
मेरे लिए कुछ भी ठीक है.,general_dontcare
मेरे साथ कुछ भी ठीक है.,general_dontcare
मेरे लिए कुछ भी ठीक है.,general_dontcare
"मुझे कुछ पता नहीं, ओली।",general_dontcare
मेरे साथ कुछ भी ठीक होगा.,general_dontcare
आपको क्या लगता है मुझे किस तरह का संगीत पसंद है?,music_query
मेरे लिए सभी जैज़ संगीत बजाओ,play_music
जिन्होंने मुझे लिखा है या सोशल मीडिया में मेरा उल्लेख किया है,social_query
मुझे बताओ कि मेरे लिए कौन से अलार्म सेट हैं,alarm_query
मुझे कौन से अलार्म मिले?,alarm_query
"मुझे नहीं पता कि क्या करना है, ओली।",general_dontcare
"जो कुछ भी मेरे साथ अच्छा है, ओली।",general_dontcare
क्या मेरी कोई नियुक्ति होने वाली है?,calendar_query
क्या मेरे पास किसी सोशल मीडिया पर कोई निजी संदेश है?,social_query
क्या मेरे लिए कोई नया मेल है?,email_query
क्या मेरे पास कोई नया मित्र अनुरोध है?,social_query
क्या मुझे कोई नया ईमेल प्राप्त हुआ?,email_query
मुझे यह देखना है कि क्या मुझे कोई नया ईमेल मिला है,email_query
मेरे लिए कोई नया ईमेल,email_query
क्या मुझे कोई नया ईमेल मिला है?,email_query
क्या आपने मुझे कोई ईमेल भेजा?,email_query
मुझे एक अलार्म चाहिए,alarm_set
"मुझे एक ब्रेक चाहिए, इसे पांच मिनट बाद शुरू करें",play_audiobook
मुझे एक स्थानीय रेस्तरां दिलवाओ,recommendation_locations
मेरे लिए एक कप कॉफी बनाओ,iot_coffee
क्या आप मेरे लिए एक कप कॉफ़ी बना सकते हैं?,iot_coffee
मुझे एक कप कॉफ़ी चाहिए,iot_coffee
मुझे एक कप कॉफ़ी चाहिए,iot_coffee
मुझे एक कप कॉफी चाहिए,iot_coffee
कृपया मुझे एक कप कॉफ़ी चाहिए,iot_coffee
मेरे लिए नमकीन कारमेल स्वाद वाली क्रीम के साथ एक कप कॉफी बनाओ,iot_coffee
मेरे लिए कॉफ़ी ले आओ,iot_coffee
मेरे लिए कॉफ़ी बनाओ,iot_coffee
मेरे लिए कॉफ़ी बनाओ,iot_coffee
कृपया मुझे एक कॉफ़ी चाहिए,iot_coffee
मुझे एक कार दिलवाओ,transport_taxi
मुझे एक शास्त्रीय रेडियो स्टेशन दीजिए,play_radio
मेरे लिए एक कप कॉफ़ी बनाओ,iot_coffee
